Sr.No.,Project Name,Promoter Name,Promoter Address,Project Type,Email Id,Mobile No,Project Registration No.,District,Approved on
1068,MEDI PLUS,PAN ENTERPRISE,"9 BY 3, NA, SUR, NR. ARSHAD PARK, OPP AMBER TOWER SARKHEJ, AHMEDABAD Ahmedabad 382210",Commercial,panenterprise27@gmail.com,9099078886,PR/GJ/AHMEDABAD/AHMEDABAD CITY/AUDA/CAA07090/030620,Ahmedabad,03-06-2020
1069,Solitaire,SUNSHINE DEVELOPERS,"403-A Shivalik Corporate Park, Behind D' mart Satellite, Ahmedabad Ahmedabad 380015",Commercial,sunshine.rera@gmail.com,9979867595,PR/GJ/KHEDA/NADIAD/Others/CAA05893/140819,Kheda,14-08-2019
1070,THE LENORA,NAVPAD DEVELOPERS,"103-104, GOPINATH CHAMBER, FIRST FLOOR, DALGIYA SHERI, MAHIDHARPURA, SURAT Surat 395003",Commercial,navpad.developers733@gmail.com,9327364000,PR/GJ/SURAT/SURAT CITY/SUDA/CAA07128/120620,Surat,12-06-2020
1071,NIDHI TEXTILE MARKET,NTM Associates LLP,"SURVEY NO.59/1-2, BLOCK.87/3, NIDHI TEXTILE MARKET, PARVAT, SURAT Surat 395010",Commercial,nidhitextile12345@gmail.com,9328216087,PR/GJ/SURAT/SURAT CITY/Surat Municipal Corporation/CAA08350/A1C/110924/311225,Surat,22-04-2021
1072,BIJAL BUSINESS CENTRE,TIRTH INFRACON,"BIJAL BUSINESS CENTRE, B/H RADHEY BUSINESS PARK OPP. SHYAM ICON, NR. ASLALI CIRCLE Ahmedabad 382427",Commercial,tirthinfracon@gmail.com,9909905692,PR/GJ/AHMEDABAD/DASKROI/AUDA/CAA05909/A1C/261221,Ahmedabad,19-08-2019
1073,VASUPUJYA RIO EMPIRE,VASUPUJYA INFRASTRUCTURES LLP,"BLOCK NO.389, 432, /P, T.P.S.NO:-14 (PAL) O.P.NO. 125,132, F.P.NO- 146 PAIKEE PART B+ 148 AT-PAL DIST-SURAT Surat 395009",Commercial,rioempire9@gmail.com,9428020022,PR/GJ/SURAT/SURAT CITY/SUDA/CAA05975/A1C/090821,Surat,30-08-2019
1074,BROOKFIELDZ 9 to 5,SHREE JALA ASSOCIATES,"BROOKFIELDZ 9 to 5, Beside Roses Nursery Nr. SBI Bank Chhani Branch, Chhani Main Road, Nizampura, Vadodara Vadodara 390024",Commercial,info@brookfieldz.com,9825034249,PR/GJ/VADODARA/VADODARA/Others/CAA06317/A1C/170321,Vadodara,11-11-2019
1075,Sky Industrial Estate,Shree Buildcon,"Plot No.121, Opp. Krishna Estate, Nr. Ratnam Estate Kathwada-Singarva Road, Kathwada, Ahmedabad Ahmedabad 382430",Commercial,skyindustrial2019@gmail.com,9898445566,PR/GJ/AHMEDABAD/DASKROI/AUDA/CAA05854/070819,Ahmedabad,07-08-2019
1076,TURQUOISE 4,Ratnabhumi Buildspace LLP,"Opp. Decathlone, Shantipura Circle, Sarkhej, Ahmedabad 382210",Commercial,t4rera@gmail.com,9427022214,PR/GJ/AHMEDABAD/AHMEDABAD CITY/AUDA/CAA06289/061119,Ahmedabad,06-11-2019
1077,NOVEM SQUARE,SANJAYBHAI BABUBHAI PATEL,"""VIKAS"", 4 SILVER PARK AMIN MARG Rajkot 360001",Commercial,novemsquare@gmail.com,9825077363,PR/GJ/RAJKOT/RAJKOT/Others/CAA06678/240120,Rajkot,24-01-2020
1078,SHREE MARKET,SHREE DEVELOPERS,"R.S.NO.365 PAIKEE, BLOCK NO. 402 P1, T.P.S 20, F.P. 66 MOJE -PUNA, TA. PUNA Surat 395010",Commercial,shreedev4021@gmail.com,9898168550,PR/GJ/SURAT/SURAT CITY/SUDA/CAA05767/230719,Surat,23-07-2019
1079,SWARA DREAMS SHED AND GODOWNS,SWARA CONSTRUCTION,"PLOT NO.218,HILLTOP SOCIETY NEAR WATER TANK ,BHAVNAGAR Bhavnagar 364002",Commercial,swararera@gmail.com,9825229455,PR/GJ/BHAVNAGAR/BHAVNAGAR/Others/CAA06105/260919,Bhavnagar,26-09-2019
1080,GRAVITY RETAIL & WORK SPACES,SHAILY BUILDCON,"S R NO-452, T P NO-119, F P NO-95/2 NIKOL ASARWA Ahmedabad 382350",Commercial,shailybuildcon952@gmail.com,9429023236,PR/GJ/AHMEDABAD/AHMEDABAD CITY/AUDA/CAA06062/210919,Ahmedabad,21-09-2019
1081,Viral Heights,Viral Heights,"Viral Heights, Near Time Square II Ayodhya Chowk, 150 ft. Ring Road Rajkot 360005",Commercial,viral.heights.rajkot@gmail.com,7700049000,PR/GJ/RAJKOT/RAJKOT/Others/CAA06305/A1C/280422,Rajkot,07-11-2019
1082,BE MALL,BUSY BEE DEVELOPERS,"B 1,2,3 WARD -1 S NO -6453 BARDOLI Surat 394601",Commercial,mallbe2021@gmail.com,9227655641,PR/GJ/SURAT/BARDOLI/Others/CAA08357/220421,Surat,22-04-2021
1083,KESHAV INDUSTRIAL ESTATE,KSHIPRA DEVELOPERS,"A-918, AJITNATH SOCIETY, NR LILA PANI NA VERA AMBIKANAGAR ROAD, ODHAV, AHMEDABAD Ahmedabad 382415",Commercial,keshavindustrialestate.rera@gmail.com,9724487036,PR/GJ/AHMEDABAD/AHMEDABAD CITY/AUDA/CAA06670/EX1/041221,Ahmedabad,23-01-2020
1084,KABIR SHILP,SHRI GHANSHYAM INFRA,"Survey No 106 P, Opp Kansar Restaurant Kudasan, Gandhinagar - 382421 Gandhinagar 382421",Commercial,srighanshyaminfra@gmail.com,9429580815,PR/GJ/GANDHINAGAR/GANDHINAGAR/Others/CAA06388/EX1/220724/300625,Gandhinagar,26-11-2019
1085,AKSHAR INDUSTRIAL PARK,TRICON DEVELOPERS,"4,ZALAWADI PATEL SOCIETY , NEAR CANAL GOUR NO KUVO , PRERNA PARK, MANINAGAR, AHMEDABAD Ahmedabad 380008",Commercial,aksharindustrial@gmail.com,9925037759,PR/GJ/AHMEDABAD/AHMEDABAD CITY/AUDA/CAA06505/231219,Ahmedabad,23-12-2019
1086,RK PRIME-II,RK INFRASPACE LLP,"OFFICE NO. 702, RK PRIME NEXT TO SILVER HEIGHTS, NANA MAVA CIRCLE, 150 FEET RING ROAD Rajkot 360005",Commercial,rkinfraspacellp@gmail.com,9172264513,PR/GJ/RAJKOT/RAJKOT/Others/CAA05769/230719,Rajkot,23-07-2019
1087,7 CROSS,ANJNEY INFRASTRUCTURE,"2ND FLOOR, SANIDHIYA SHOPPING CENTRE JOSHIPARA MAIN ROAD Junagadh 362002",Commercial,anjneyinfra@gmail.com,9227812118,PR/GJ/JUNAGADH/JUNAGADH/Others/CAA05874/080819,Junagadh,08-08-2019
1088,ADALAJ TRADE CENTER,KATHAN INFRASTRUCTURE,"202, SHREEJI AVENUE, NR. IOC PETROL PUMP ADALAJ Gandhinagar 382421",Commercial,kathaninfra@gmail.com,9427019717,PR/GJ/GANDHINAGAR/GANDHINAGAR/Others/CAA06517/A1C/190322,Gandhinagar,24-12-2019
1089,AARYA EDGE,AARYA EDGE PROCON LLP,"Survey No.3992, FP.395, Aarya Epoch, Mehta Sweet mart, Nr.Vijay Cross Road Ahmedabad 380009",Commercial,info@aaryadevelopers.in,9825481687,PR/GJ/AHMEDABAD/DASKROI/AUDA/CAA05872/080819,Ahmedabad,08-08-2019
1090,AKSHAR SQUARE,STHAPATYA BUILDCON,"AKSHAR STADIA STERLING HOSPITAL ROAD, BEHIND ARMEIDA SALOON BODAKDEV THALTEJ,AHMEDABAD CITY,AHMEDABAD CITY,AHMEDABAD, GUJARAT Ahmedabad 380054",Commercial,sthapatyabuildcon@gmail.com,9825027977,PR/GJ/AHMEDABAD/AHMEDABAD CITY/AUDA/CAA06242/241019,Ahmedabad,24-10-2019
1091,Dream Icon @ Parimal,Dream Realty,"1st Floor, Sun Complex Opp SBI, C G Road, Navrangpura Ahmedabad 380009",Commercial,rera.dreamicon@gmail.com,9825047082,PR/GJ/AHMEDABAD/AHMEDABAD CITY/AUDA/CAA09516/211221,Ahmedabad,21-12-2021
1092,ANANTA STALLION,ANANTA BUSINESSCORP LIMITED,"ANANTA BUSINESSCORP LIMITED 2ND FLOOR SAHJANAND, KARELIBAUG, VADODARA-390011 Vadodara 390011",Commercial,stallion@anantabuilders.com,9979111177,PR/GJ/VADODARA/VADODARA/Others/CAA06032/130919,Vadodara,13-09-2019
1093,Venus Avan Business Centre,Sundaram Landscape LLP,"1101, Venus Amadeus, Jodhpur Cross Roads, Satellite Ahmedabad 380015",Commercial,rera.avan@venusinfrastructure.com,9099960022,PR/GJ/GANDHINAGAR/GANDHINAGAR/AUDA/CAA06234/231019,Gandhinagar,23-10-2019
1094,Capital One,Pradeep Vasudev Jadwani,"HOTEL VICE PRESIDENT, FIRST FLOOR, OPP BATA SHOWROOM, NR TIMES OF INDIA, ASHRAM ROAD, Ahmedabad 380009",Commercial,bharatjadwani@hotmail.com,9825877782,PR/GJ/AHMEDABAD/AHMEDABAD CITY/AUDA/CAA06800/250220,Ahmedabad,25-02-2020
1095,Manor Maxx,Siddhivinayak Associates,"Amber Bunglow, Commerce College Road, Nr St Xaviers College, Navrangpura Ahmedabad 380009",Commercial,siddhartha24@hotmail.com,9586500091,PR/GJ/AHMEDABAD/AHMEDABAD CITY/AUDA/CAA06342/181119,Ahmedabad,18-11-2019
1096,SYNERGY,HARSH NIRMAN BUILDSPACE LLP,"S.No.154/1, opp. Aryavrat-4, Besides Shaishya Tennis Academy, Opp. YMCA Club, Makarba, S.G. Highway. Ahmedabad 380058",Commercial,reraharshnirman@gmail.com,9825006657,PR/GJ/AHMEDABAD/AHMEDABAD CITY/AUDA/CAA09638/311221,Ahmedabad,31-12-2021
1097,Silver Radiance-4,Avirat Pavilius Project,"Avirat House, Nr. Science City, Sola Ahmedabad 380060",Commercial,sr4@aviratgroup.com,9712923545,PR/GJ/AHMEDABAD/AHMEDABAD CITY/AUDA/CAA05840/A1C/EX1/300623,Ahmedabad,05-08-2019
1098,UNITY PRIME,UNITY CORPORATION,"C-1304, COZY COURTYARD, NANA MAVA, KALAWAD ROAD, RAJKOT Rajkot 360005",Commercial,unityrera@gmail.com,9974400035,PR/GJ/RAJKOT/RAJKOT/Others/CAA05980/300819,Rajkot,30-08-2019
1099,International Finance Centre,S.S.ENTERPRISE,"HG-4, International Trade Center Majura Gate crossing, Ring road, Surat 395002",Commercial,suranagroup@ymail.com,9974011111,PR/GJ/SURAT/SURAT CITY/SUDA/CAA07355/A1C/090321,Surat,24-08-2020
1100,SHANTI HEIGHTS,KRISH DEVELOPERS,D-9 OPP. ORIENTAL BANK OF COMMERCE BH RAM MANTRA MANDIR KALVIBID Bhavnagar 364001,Commercial,bansalshipbreakers@gmail.com,9825205641,PR/GJ/BHAVNAGAR/BHAVNAGAR/Others/CAA06380/A1C/080421,Bhavnagar,26-11-2019
1101,R K PRIME PLUS,NARESH ORGANISERS PRIVATE LIMITED,1ST FLOOR NAVKAR COMMERCIAL COMPLEX DHEBAR ROAD ONE WAY NEAR SYNDICATE BANK RAJKOT Rajkot 360001,Commercial,rkprimeplus@gmail.com,9824040679,PR/GJ/RAJKOT/RAJKOT/Others/CAA07309/100820,Rajkot,10-08-2020
1102,NEW RUVAPARI INDUSTRIAL ESTATE,ARIFBHAI MUSABHAI LOHIYA,VADVA KACHIYAWAD NEAR CHABUTRA Bhavnagar 364001,Commercial,lohiyadevelopers1@gmail.com,9898033338,PR/GJ/BHAVNAGAR/BHAVNAGAR/Others/CAA06371/221119,Bhavnagar,22-11-2019
1103,AAROHI GALLERIA,Siddhi Developers and Builders,"B-003, Elanza Crest, Nr. HOF Living Sindhu Bhavan Road, Off S.G. Highway, Thaltej Ahmedabad 380059",Commercial,account@aarohistarz.com,9099049178,PR/GJ/AHMEDABAD/DASKROI/AUDA/CAA06251/241019,Ahmedabad,24-10-2019
1104,EMPORIS,AARUSH SPACES LLP,"203 PINNACLE, OPP. ROYAL ORCHID NR. AUDA GARDEN, PRAHLADNAGAR, AHMEDABAD Ahmedabad 380015",Commercial,info@aarushgroup.in,9712411777,PR/GJ/AHMEDABAD/AHMEDABAD CITY/AUDA/CAA05920/A2C/EX1/210324/281224,Ahmedabad,20-08-2019
1105,EXXONIIC,SAMPRATI PROCON,NR MAHAVIR SANSKAR DHAM ASHRAM ROAD Surat 395009,Commercial,samprati.procon@gmail.com,8866110984,PR/GJ/SURAT/SURAT CITY/SUDA/CAA07237/210620,Surat,21-06-2020
1106,SHREENATHJI COMMERCIAL HUB,K K RESIDENCY PRIVATE LIMITED,"SHOP 1,2,3/ SAIDHAM TENAMENT, MAHADEVNAGARTEKRA, VASTRAL, AHMEDABAD Ahmedabad 382418",Commercial,shreenathjicommercialhubrera@gmail.com,9879790067,PR/GJ/AHMEDABAD/AHMEDABAD CITY/AUDA/CAA07385/260820,Ahmedabad,26-08-2020
1107,NIRMAN AVENUE,shree krishna developers,"Shop No:12, City Survey No:2419, Village Dabhoda, Dist Gandhinagar Gandhinagar 382355",Commercial,nirmanavenue@gmail.com,9913684054,PR/GJ/GANDHINAGAR/GANDHINAGAR/Others/CAA07514/071020,Gandhinagar,07-10-2020
1108,Orbit,INFINITY DEVELOPERS,"Survey No. :4120 (Old Survey No. : 555p1), NH 48, Vapi, Tal. Vapi Valsad 396191",Commercial,rbhatu1213@gmail.com,9723655575,PR/GJ/VALSAD/PARDI/Others/CAA07324/140820,Valsad,14-08-2020
1109,RAVIRAJ COMPLEX,RAVI CORPORATION,"RAVI KUNJ BUNGLOW NR GERATPUR RAILWAY STATION, DASKROI Ahmedabad 382435",Commercial,jhirenb01@gmail.com,9426368236,PR/GJ/AHMEDABAD/DASKROI/AUDA/CAA06237/231019,Ahmedabad,23-10-2019
1110,NANDAN ARCADE,Maitri Corporation,"C-13, AAKAR SOCIETY, JODHPUR CHAR RASTA, SATELLITE, AHMEDABAD Ahmedabad 380015",Commercial,rera.nandan@gmail.com,9426586142,PR/GJ/MAHISAGAR/LUNAVADA/Others/CAA06113/260919,Mahisagar,26-09-2019
1111,Suvarna Icon,Suvarna Buildcon,"46, Shivshakti Society, New Sama Road, Vadodara Vadodara 390024",Commercial,suvarnaicon@gmail.com,9428584810,PR/GJ/VADODARA/VADODARA/Others/CAA07252/070720,Vadodara,07-07-2020
1112,MILESTONE INDIGO,ANAY ASSOCIATES,"T.P.-6,MAJURA,KHATODRA FINAL PLOT NO-260-261,NEAR GUJARAT SAMACHAR, KHATODRA ,SURAT Surat 395002",Commercial,mile.indigo@pradeepsinghi.com,9376444444,PR/GJ/SURAT/SURAT CITY/SUDA/RAA06245/A1C/261121,Surat,24-10-2019
1113,Shanti Arcade,Shanti Buildcon,Opp H.P Petrol Pump Near Shanti Multi Speciality Hospital Sadhu Vasvani Road Rajkot 360005,Commercial,shantimulti123@gmail.com,9825462399,PR/GJ/RAJKOT/RAJKOT/Others/CAA07033/220520,Rajkot,22-05-2020
1114,ASHTAVINAYAK-7,INDRASINHBAPUBHAGOHIL,"PLOT NO 21/E,""DIVYODAY"" B/H COMMISSIONER BUNGLOW, WAGHAWADI ROAD,BHAVNAGAR Bhavnagar 364002",Commercial,ashtavinayak72019@gmail.com,9898397868,PR/GJ/BHAVNAGAR/BHAVNAGAR/Others/CAA06118/A1C/EX1/311222,Bhavnagar,27-09-2019
1115,INCEPTUM,CONSTERA REALTY PRIVATE LIMITED,"6, ARYAN CORPORATE PARK, NR SHILAJ RAILWAY CROSSING,THALTEJ, Ahmedabad 380059",Commercial,consterarealty@gmail.com,9327920744,PR/GJ/AHMEDABAD/AHMEDABAD CITY/AUDA/CAA06196/A1C/220520,Ahmedabad,19-10-2019
1116,Meraki Latitude,Akshay Arvindbhai Kothari Proprietorship of MERAKI LATITUDE,"Padam Pujan Bunglow, Nr Navdeep Nagar Soc, O P Road, Vadodara 390020",Commercial,jaymin.m.kothari@gmail.com,9879572487,PR/GJ/VADODARA/VADODARA/Others/CAA07044/A1C/261020,Vadodara,28-05-2020
1117,SHREEMAAN ARCADE,PRANAMI ENTERPRISE,"SHREEMAAN ARCADE, OPP BALESHWAR CITY LALGEBI CIRCLE, HATHIJAN Ahmedabad 382445",Commercial,jhirenb02@gmail.com,8200432474,PR/GJ/AHMEDABAD/AHMEDABAD CITY/AUDA/CAA06636/170120,Ahmedabad,17-01-2020
1118,PRAMUKH AYAN,DEVMIT INFRASTRUCTURE,SUREVY NO156 TPS NO.8 FINAL PLOT NO.4 Gandhinagar 382421,Commercial,devmitrera@gmail.com,9979330668,PR/GJ/GANDHINAGAR/GANDHINAGAR/Others/CAA06972/110520,Gandhinagar,11-05-2020
1119,TIMES SQUARE,VISION DEVELOPERS,"OPP CAPTAIN TRADING, RS NO 3136 PAIKI 1559 DEESA HIGHWAY, PALANPUR Banaskantha 385001",Commercial,info.timesvision@gmail.com,8000820364,PR/GJ/BANASKANTHA/PALANPUR/Palanpur Municipality/CN222AA10122/141022,Banaskantha,14-10-2022
1120,Skywalk The Element,SHREETATVA SADHNA GROUP,"A1, NILAM PARK APARTMENT , THALTEJ, AHMEDABAD Ahmedabad 380054",Commercial,skywalktheelement@gmail.com,8511119588,PR/GJ/AHMEDABAD/AHMEDABAD CITY/AUDA/CAA06817/020320,Ahmedabad,02-03-2020
1121,KANKUBAG MALL,VIKRAMBHAI PATEL AND GEETABEN PATEL,"a-35, amrapali co-op society, Ajay-5, VASTRAL Ahmedabad 382418",Commercial,kankubagmall@gmail.com,9825070506,PR/GJ/AHMEDABAD/AHMEDABAD CITY/AUDA/CAA07062/280520,Ahmedabad,28-05-2020
1122,KARNAVATI AVENUE,KARNAVATI BUILDERS,"A-1010, 10TH FLOOR, ATMA HOUSE NR. TIMES OF INDIA, ASHRAM ROAD, AHMEDABAD Ahmedabad 380009",Commercial,karnavativivantaliving@gmail.com,9824079416,PR/GJ/GANDHINAGAR/GANDHINAGAR/AUDA/CAA08403/EX1/301122,Gandhinagar,03-05-2021
1123,BLOCK C SQUARE,D R CORPORATION,"410, NATIONAL PLAZA, R C DUTT ROAD ALKAPURI Vadodara 390007",Commercial,anishrana78692@gmail.com,9898204504,PR/GJ/VADODARA/VADODARA/Others/CAA06060/190919,Vadodara,19-09-2019
1124,PANCHAM ICON,PANCHAM INFRACON,"D/6,SAMRAJYA EXTENSION AKOTA MUNJMAHUDA ROAD Vadodara 390020",Commercial,panchaminfracon23@gmail.com,8469332800,PR/GJ/VADODARA/VADODARA/Others/CAA06297/061119,Vadodara,06-11-2019
1125,BOMBAY MALL,PINNACLE BUILD AND INFRA LLP,"23, DEEP BELLA CO-OP. HSG. SOCIETY, MOUNT MARRY ROAD, BANDRA(WEST), MUMBAI Mumbai City 400050",Commercial,mohsinmaredia1984@gmail.com,9820217765,PR/GJ/ANAND/ANAND/Others/CAA06699/290120,Anand,29-01-2020
1126,THE ALLEN TOWN,KOTHIYA BUILDOCN,"13 Krushnavihar Shopping center Nikol Naroda road ,Nikol Ahmedabad 382350",Commercial,theallentown2019@gmail.com,9662062385,PR/GJ/AHMEDABAD/AHMEDABAD CITY/AUDA/CAA06460/121219,Ahmedabad,12-12-2019
1127,LA-MAJESTY,SAI DEVELOPERS,"TULSIDHAM TO BHAVANS SCHOOLS ROAD NEAR ANUGRAH HOSPITAL, MANJALPUR Vadodara 390011",Commercial,lamajestym01@gmail.com,9879940000,PR/GJ/VADODARA/VADODARA/Others/CAA06770/130220,Vadodara,13-02-2020
1128,AZZARO SQUARE,RADHIKA CORPORATION,"307-A, ADITYA TRADE CENTER, OPP. PHULCHAB CHOWK, JYBUILI BAUG, RAJKOT Rajkot 360001",Commercial,azzarosquare.rera@gmail.com,9825079107,PR/GJ/RAJKOT/RAJKOT/Others/CAA07966/300121,Rajkot,30-01-2021
1129,VIVAN INDUSTRIAL PARK,VEER CORPORATION,"22, Haridwar Society, Behind Sutlej Hotel Naroda, Ahmedabad-382330 Ahmedabad 382330",Commercial,vivaan5055@gmail.com,9825294793,PR/GJ/AHMEDABAD/DASKROI/AUDA/CAA08577/070621,Ahmedabad,07-06-2021
1130,SAMIP,SIDDHIVINAYAK BUILDCON,301 SHIVANJALI ATABHAI CHOWK BHAVANAGAR Bhavnagar 364001,Commercial,arcus.vadodara@gmail.com,9825206903,PR/GJ/BHAVNAGAR/BHAVNAGAR/Others/CAA06535/301219,Bhavnagar,30-12-2019
1131,THE WALL STREET BUSINESS HUB,WALL STREET BUSINESS HUB,"HG - 27, ITC BUILDING, MAJURA GATE Surat 395002",Commercial,wallstreetbusinesshub@gmail.com,9825021119,PR/GJ/SURAT/SURAT CITY/SUDA/CAA06420/041219,Surat,04-12-2019
1132,K 10 ARCADE,K 10 DEVELOPERS,NR BACHAPAN SCHOOL SHOP 3 HIMALAYA HEIGHTS 100 FEET ROAD Anand 388001,Commercial,k10developers123@gmail.com,9824535053,PR/GJ/ANAND/ANAND/Others/CAA06797/250220,Anand,25-02-2020
1133,SHREENATH SIGNET II,SHREENATH BUILDCON,"FF 101, SHREENATH SARTHAK IND PARK, NR TORRENT POWER HOUSE SUB STATION, S P RING ROAD, NIKOL, AHMEDABAD Ahmedabad 382350",Commercial,shreenathsignet2.rera@gmail.com,9998961417,PR/GJ/AHMEDABAD/AHMEDABAD CITY/AUDA/CAA06044/170919,Ahmedabad,17-09-2019
1134,Abhay,Abhay,"1st Floor, Ravi Complex, Nr Vinayak Developers Opp. Indian Rayon Company, Veraval Gir Somnath 362265",Commercial,rera34.abhay@gmail.com,9925147372,PR/GJ/GIR SOMNATH/VERAVAL/Others/CAA07230/210620,Gir Somnath,21-06-2020
1135,DARSHANAM CAPITAL,SHIVAM BUILDERS,"BS.KONARK NEAR WAVES CLUB,30 Mt. CANAL RING ROAD, OPP-ESSAR PETROL PUMP ,VASNA BHAYLI ROAD Vadodara 391410",Commercial,darshanamcapital@gmail.com,9925070636,PR/GJ/VADODARA/VADODARA/Others/CAA06046/A2C/030622,Vadodara,17-09-2019
1136,Ariane Legacy,Ariane Reality LLP,"104, Shyam II, Near Banke Bihari Mandir, Gulab Tower Road, Thaltej, Ahmedabad Ahmedabad 380054",Commercial,arianelegacyrera@gmail.com,9825082052,PR/GJ/GANDHINAGAR/GANDHINAGAR/Others/CAA08271/260321,Gandhinagar,26-03-2021
1137,MIRACLE DOCTOR HOUSE,NARSHIBHAI P VEKARIYA,"BLOCK NO 15 A, PARISHRAM, SHREE COLONY STREET NO 2, B/H PANCHVATI SOCIETY, NANA MAVA ROAD, RAJKOT Rajkot 360001",Commercial,miracledoctorhouse@gmail.com,9824041228,PR/GJ/RAJKOT/RAJKOT/Others/CAA06477/171219,Rajkot,17-12-2019
1138,EMPIRE CREST,EMPIRE INFRACON,"107/G/1, OPP. RAJENDRA CO. OP HOUSING SOCIETY, JAWAHAR CHOWK, MANINAGAR, AHMEDABAD Ahmedabad 380008",Commercial,empirecrest05@gmail.com,9726634760,PR/GJ/AHMEDABAD/AHMEDABAD CITY/AUDA/CAA07005/140520,Ahmedabad,14-05-2020
1139,FLORENCE EXCELLENCE,KRISHNA INC,"F P 84/1, TP-3 BESIDE BRIGHT DAY SCHOOL, VASNA BHAYLI ROAD, BHAYLI Vadodara 390015",Commercial,florence.excellence@gmail.com,9879549418,PR/GJ/VADODARA/VADODARA/Others/CAA06212/211019,Vadodara,21-10-2019
1140,HR ELANZA,HR SPACECON LLP,"3/B, SATYAWADI SOC OPP. PETROL PUMP, USMANPURA, ASHRAM ROAD Ahmedabad 380013",Commercial,hreliseoiirera@gmail.com,9978877555,PR/GJ/AHMEDABAD/AHMEDABAD CITY/AUDA/CAA06286/041119,Ahmedabad,04-11-2019
1141,Astron Business Hub,Shree Enetrprise,"21-22, Commercial Chambers, Satta Bazar,Near Danapith,Rajkot Rajkot 360001",Commercial,shreeenterprise.rera@gmail.com,8849865467,PR/GJ/RAJKOT/RAJKOT/Others/CAA06730/A1C/060523,Rajkot,01-02-2020
1142,BROADWAY EMPIRE,NAVKAR REALTY,"A-401, VITRAG RESIDENCY NR. NATUBHAI CIRCLE RACE COURSE Vadodara 390007",Commercial,navkarrealty2019@gmail.com,9825069133,PR/GJ/VADODARA/VADODARA/Others/CAA06224/231019,Vadodara,23-10-2019
1143,Pride Empire,PRIDE CONSTRUCTION,"302, Third Floor, Pride One Appartment, Akshar Marg Off Amin Marg , Kalawad Road Rajkot - 360001 Rajkot 360001",Commercial,pridecapital01@gmail.com,9824239900,PR/GJ/RAJKOT/RAJKOT/Others/CAA06294/061119,Rajkot,06-11-2019
1144,OFIRA TEXTILE HUB,AVANTIS BUILDCORP LLP,"S-7,VIP Plaza, 2nd Floor, VIP Road , Near Khatushyam Temple , SURAT , GUJARAT Surat 395007",Commercial,ofira.hub@pradeepsinghi.com,9978146209,PR/GJ/SURAT/SURAT CITY/SUDA/CAA07076/EX2/031024/300925,Surat,30-05-2020
1145,MARUTI SOLARIS ANNEX,MARUTI SQUARE HOME MAKERS LLP,"301, MARUTI SUNAY, OPP-ARYA NAGAR, AMUL DAIRY ROAD, ANAND Anand 388001",Commercial,marutisamvid@gmail.com,9825206422,PR/GJ/ANAND/ANAND/Others/CAA09979/300322,Anand,30-03-2022
1146,KEDARAM TRADE CENTER,KEDARAM TRADE CENTER LLP,15 NEST BUNGLOWS NR NARMADA VASAHAT SATELITE Ahmedabad 380015,Commercial,kedaramtradecenter2021@gmail.com,9375377722,PR/GJ/AHMEDABAD/AHMEDABAD CITY/AUDA/CAA08664/250621,Ahmedabad,25-06-2021
1147,Suvidhi Park,SUVIDHI PROCON PRIVATE LIMITED,"405-406 Santorini Square, Opp Star Bazar B/s Abhishree Complex, Satellite Ahmedabad 380015",Commercial,rjshah_ca@yahoo.com,9898989389,PR/GJ/MEHSANA/VIJAPUR/Others/CAA07235/210620,Mehsana,21-06-2020
1148,MAGNATE SQUARE,MOTHERLAND INFRASTRUCTURE,Magnate Square opp Shiv ganga Bunglows New Ranip Ahmedabad Ahmedabad 382480,Commercial,motherland131@gmail.com,9825522478,PR/GJ/AHMEDABAD/AHMEDABAD CITY/AUDA/CAA06859/070320,Ahmedabad,07-03-2020
1149,PUSHKAR MAHADEV INDUSTRIAL ESTATE 2,SHLOK BUILDCON,"A-401 BALSHWAR AVENUE S.G HIGHWAY, BODAKDEV Ahmedabad 380054",Commercial,pushkarmahadevindrera@gmail.com,9099082121,PR/GJ/AHMEDABAD/AHMEDABAD CITY/AUDA/CAA07174/190620,Ahmedabad,19-06-2020
1150,PRAMUKH ANAND ORBIT MALL,PRAMUKHANAND CORPORATION LLP,"A-218 PRAMUKH ARCADE, NEARRAJDHANI SOCIETY KUDASAN Gandhinagar 382421",Commercial,pramukhanandrera@gmail.com,9426394900,PR/GJ/GANDHINAGAR/GANDHINAGAR/Others/CAA06153/A1C/010722,Gandhinagar,10-10-2019
1151,THE CBD,ZUNDAL ENTERPRISE,"F.P. No.:- 95 , T.P.S. No.:- 72, Opp. Shagun 108, Nr. Divine Circle, S.P.Ring Road, Zundal, Gandhinagar 382421",Commercial,zundalenterprise@gmail.com,9825161637,PR/GJ/AHMEDABAD/AHMEDABAD CITY/AUDA/CAA06207/A2C/230821,Ahmedabad,21-10-2019
1152,PARKVIEW NEXUS,PARKVIEW INFRASTRUCTURE,"206, PARKVIEW EXCHANGE S.P RING ROAD, BHADAJ Ahmedabad 380060",Commercial,nexus.parkview@gmail.com,9712912122,PR/GJ/AHMEDABAD/AHMEDABAD CITY/AUDA/CAA06511/A1C/EX1/250624/290624,Ahmedabad,24-12-2019
1153,SPACE ODYSSEY,SPACE INFRAVENTURES LLP,"BEHIND KKV HALL,KALAWAD ROAD, RAJKOT RAJKOT Rajkot 360005",Commercial,spaceodyssey156@gmail.com,9879799933,PR/GJ/RAJKOT/RAJKOT/Others/CAA06376/EX1/051224/300925,Rajkot,26-11-2019
1154,Addor Aspire-II,ADDIS REALTECH LLP,"32, 3rd Floor, Roopa Apartment , Opp. Lal Bunglow C G Road, Navrangpura Ahmedabad 380009",Commercial,accounts1@addorgroup.com,9913999444,PR/GJ/AHMEDABAD/AHMEDABAD CITY/AUDA/CAA06539/311219,Ahmedabad,31-12-2019
1155,SERENE CENTRUM,CREATIVE INFRA SPACE,"306, GANGOTRI ICON, OPP. GOKUL PARTY PLOT VASNA Vadodara 390015",Commercial,info.creativeinfraspace@gmail.com,9909012513,PR/GJ/VADODARA/VADODARA/Others/CAA06552/020120,Vadodara,02-01-2020
1156,SANKALP SQUARE III B (PHASE-II),SANKALP IN,"SANKALP SQUARE, NR.KAMLA KAMDHENU HALL, DRIVE IN ROAD, GURUKUL, Ahmedabad 380052",Commercial,account@sankalponline.com,9825084606,PR/GJ/AHMEDABAD/AHMEDABAD CITY/AUDA/CAA06971/060520,Ahmedabad,06-05-2020
1157,Shilp Arcade,SHILP INFRACON,"Survey No 80, FP 29, TP 109 Near HP Petrol Pump, SP Ring Road,Bilasiya, Ta Dascroi, Ahmedabad 382330",Commercial,shilparcaderera@gmail.com,9427302849,PR/GJ/AHMEDABAD/DASKROI/AUDA/CAA06854/070320,Ahmedabad,07-03-2020
1158,Shree Sarju Arena,SHREE SARJU INFRACON LLP,"B-7, Saraswatinagar Society, Near Visat Circle, Sabarmati Ahmedabad 380005",Commercial,shreesarjuarena@gmail.com,9099902766,PR/GJ/AHMEDABAD/AHMEDABAD CITY/AUDA/CAA06427/061219,Ahmedabad,06-12-2019
1159,V One,Venus Palm Infraspace LLP,"1101, Venus Amadeus, Opp. Gold Coin Complex Jodhpur Cross Road, Satellite Ahmedabad 380015",Commercial,v-one@venusinfrastructure.com,9825024444,PR/GJ/AHMEDABAD/AHMEDABAD CITY/AUDA/CAA06520/241219,Ahmedabad,24-12-2019
1160,Pride Classic,Rohit Ravani,"12 Nutannagar Street No-1, Sharda, Kotecha Chowk Kalawad Road Rajkot 360001",Commercial,pride.classic2019@gmail.com,9726079799,PR/GJ/RAJKOT/RAJKOT/Others/CAA06603/A1C/EX1/261021,Rajkot,09-01-2020
1161,SHREENATH SIGNET,SHREENATH VISIONARY,"FF 101, SHREENATH SARTHAK IND PARK, NR TORRENT POWER HOUSE SUB STATION, S P RING ROAD, NIKOL, AHMEDABAD-382350 Ahmedabad 382350",Commercial,shreenathsignet.rera@gmail.com,9998961417,PR/GJ/AHMEDABAD/AHMEDABAD CITY/AUDA/CAA06321/131119,Ahmedabad,13-11-2019
1162,NIRGUN ONE,SATYASANKALP REALTY,D 303 VRAJ VIHAR 8 Ahmedabad 380015,Commercial,nirgunone@gmail.com,9909965629,PR/GJ/AHMEDABAD/AHMEDABAD CITY/AUDA/CAA06467/131219,Ahmedabad,13-12-2019
1163,Saanvi Shopping Center,Aekta Vijaybhai Patel Proprietor of Aekta Vijaybhai Patel Through P.O.A.H. Vijaybhai Chimanbhai Patel,"SURVEY nO 3/1058 BHAIDANO TEKRO LIMDI CHOWK TOWER ROAD, BORSAD Anand 388540",Commercial,saanvishopping123@gmail.com,9825265907,PR/GJ/ANAND/BORSAD/Others/CAA06756/100220,Anand,10-02-2020
1164,GOLD SOUK,GOLDEN DEVELOPERS,"SWASTIK HOUSE, 3RD FLOOR,OPP. IMPERIAL HEIGHTS,150 FEET RING ROAD, KALAWAD ROAD, RAJKOT RAJKOT Rajkot 360005",Commercial,goldsoukrera@gmail.com,9925188533,PR/GJ/RAJKOT/RAJKOT/Others/CAA08885/EX1/290323,Rajkot,09-08-2021
1165,SAMAY ARCADE,SAMAY CONSTRUCTION,"F.P. 72, Opp. Gymkhana Ground, Near Eye Hospital Mehsana 384170",Commercial,samay.const@gmail.com,9664902266,PR/GJ/MEHSANA/UNJHA/Others/CAA11104/311222,Mehsana,31-12-2022
1166,Satyu Arcade,Satyu Enterprise,"203,204, Satyu Apartment, Jagan Park Custom Road, Chala, Vapi. Valsad 396191",Commercial,sirajchamadia@gmail.com,9825603124,PR/GJ/VALSAD/PARDI/Others/CAA06288/EX1/111121,Valsad,05-11-2019
1167,Aagam Avenue,Siddham Infrastructure LLP,"501/Shapath-II, Opp. Rajpath Club, S.G.Highway Bodakdev, Ahmedabad Ahmedabad 380054",Commercial,aagamrera@gmail.com,9825066598,PR/GJ/AHMEDABAD/AHMEDABAD CITY/AUDA/CAA06459/121219,Ahmedabad,12-12-2019
1168,A. Shridhar Athens,A SHRIDHAR INFRACON LLP,"A. Shridhar Corporate House, Shilaj Circle, Nr. Kaveri Sangam, S.P. Ring Road, Shilaj Ahmedabad 380058",Commercial,rera.anantaraabode@gmail.com,9825125156,PR/GJ/AHMEDABAD/AHMEDABAD CITY/AUDA/CAA06428/A1C/281220,Ahmedabad,06-12-2019
1169,CITY SHOPS,MUNDHVA SURESHBHAI SINDHABHAI,"AVADH CHITRAKUT DHAM STREET NO-1, AKSHAR ROAD CORNER, BEHIND DHARAM HALL, RAJKOT Rajkot 360001",Commercial,cityshopsrera@gmail.com,9825024624,PR/GJ/RAJKOT/RAJKOT/Others/CAA07458/150920,Rajkot,15-09-2020
1170,BOMBAY SUPER HEIGHTS-2,NIKISHA DEVELOPERS,"OFFICE NO-115, COSMO COMPLEX, MAHILA COLLEGE CHOWK, RAJKOT Rajkot 360001",Commercial,bombaysuperheight2@gmail.com,9426226016,PR/GJ/RAJKOT/RAJKOT/Others/CAA06724/A1C/250424/300625,Rajkot,31-01-2020
1171,R K WORLD TOWER,VIVAN INFRASPACE LLP,"1ST FLOOR, NAVKAR COMMERCIAL COMPLEX , DHEBAR ROAD ONE WAY ,NEAR SYNIDCATE BANK Rajkot 360001",Commercial,rkambiancee@gmail.com,9172264513,PR/GJ/RAJKOT/RAJKOT/Others/CAA06533/301219,Rajkot,30-12-2019
1172,NAKSHTRA 9,RAJSHRUNGAR REALITIES,"301-NAKSHTRA-2, 150 FEET RING ROAD,OPP KKV HALL, RAJKOT RAJKOT Rajkot 360005",Commercial,nakshtra10rera@gmail.com,9825079176,PR/GJ/RAJKOT/RAJKOT/Others/CAA08554/A1C/090322,Rajkot,02-06-2021
