Sr.No.,Project Name,Promoter Name,Promoter Address,Project Type,Email Id,Mobile No,Project Registration No.,District,Approved on
1686,SHREE KUBERJI VISION,SHREE KUBERJI BUILDVENTURE LLP,"SY No- 1704/1705/1706, PLOT-2, H/28/29 COMMAN,,SHREE KUBERJI & SONS NAWABWADI ROAD, BE GUMPURA,,SURAT Surat 395003",Commercial,shreekuberjivision02@gmail.com,9099960278,PR/GJ/SURAT/CHORASI/SUDA/CAA10728/031022,Surat,03-10-2022
1687,ROYAL EMPIRE,ROYAL ALLOYS,"First Floor, 111, Royal Plaza, Ranjit Sagar Road, Mayur Township, Jamnagar Jamnagar 361005",Commercial,royalalloys202223@gmail.com,9427770647,PR/GJ/JAMNAGAR/JAMNAGAR/Others/CAA11359/040323,Jamnagar,04-03-2023
1688,SHREENATHJI HEIGHTS,SHREE HARIOM CO OPERATIVE COMMERCIAL SERVICE SOCIETY LIMITED,"PLOT NO. 2, SECTOR NO. 8 GANDHIDHAM Kutch 370201",Commercial,shreenathjiheightsrera@gmail.com,9825228172,PR/GJ/KUTCH/GANDHIDHAM/Others/CAA11458/150323,Kutch,15-03-2023
1689,CORPORATE TOWER,ADVOCATE ENTERPRISE,"ADVOCATE ENTERPRISE,GHANTESHWAR, R.S.NO 20 32,JAMNAGAR ROAD Rajkot 360006",Commercial,advocatehouse.rera@gmail.com,8141522417,PR/GJ/RAJKOT/RAJKOT/Others/CAA10560/170822,Rajkot,17-08-2022
1690,MATRIX INDUSTRIAL PARK,SHREE MARUTI DEVLOPERS,"A-4, RADHIKA BUNGLOWS, SHUKAN BUNGLOWS NIKOL-NARODA ROAD, Ahmedabad 382350",Commercial,shreemarutidevlopers@gmail.com,9898012491,PR/GJ/AHMEDABAD/AHMEDABAD CITY/AUDA/CAA10725/031022,Ahmedabad,03-10-2022
1691,DWARIKA PRIDE,SHIVAM DEVELOPERS,"Gayatri Plaza, Shop No.103, Gayatri nagar Main Road, Rajkot Rajkot 360001",Commercial,rera.dwarikapride@gmail.com,8866115400,PR/GJ/RAJKOT/RAJKOT/Rajkot Municipal Corporation/CN193AA10093/190922,Rajkot,19-09-2022
1692,METRO PLAZA,GANESH BUILDERS,"505, ANGEL BIZZ, DIWALI PARK, PUNITNAGAR , KHODAL CHOWK , 80 FT ROAD, MAVDI PLOT Rajkot 360004",Commercial,reraganeshbuilders@gmail.com,9909913473,PR/GJ/RAJKOT/RAJKOT/Others/CAA10895/EX1/220724/290625,Rajkot,11-11-2022
1693,Ratnamani Industrial Estate,RATNAMANI CORPORATION,"23,MAHASHIV DARSHAN SOCIETY, BAPUNGAR Ahmedabad 380024",Commercial,ratnamindrera@gmail.com,9825016183,PR/GJ/AHMEDABAD/DASKROI/Ahmedabad Municipal Corporation/CN229AA10129/211022,Ahmedabad,21-10-2022
1694,SHILPMANI SKY,VISHVA DEVELOPERS,"B-75, GOPALNAGAR, TALAJA ROAD, BHAVNAGAR. Bhavnagar 364002",Commercial,vishvadevlopers9927@gmail.com,9409379933,PR/GJ/BHAVNAGAR/BHAVNAGAR/Bhavnagar Municipal Corporation/CN214AA10114/121022,Bhavnagar,12-10-2022
1695,RADHE KRISHNA INDUSTRIAL HUB,RADHE DEVELOPERS,"H/204, SHREEDHAR FLORA, AMAR JAWAN CIRCLE, NIKOL Ahmedabad Ahmedabad 382350",Commercial,radhedevelopers204@gmail.com,8487919500,PR/GJ/AHMEDABAD/DASKROI/Ahmedabad Municipal Corporation/CN216AA10116/121022,Ahmedabad,12-10-2022
1696,Natraj Empire,DHRUVI BUILDCON,"Sr. No. 104, TP No. 119, FP No. 25/1, Natraj Empire Anjana Chowk, Viratnagar to SP Ring Road, Nikol Ahmedabad 382330",Commercial,natrajempirerera@gmail.com,9725156865,PR/GJ/AHMEDABAD/AHMEDABAD CITY/AUDA/CAA10927/A1C/280324/180826,Ahmedabad,14-11-2022
1697,AKHILAM CORNER,AKHILAM CORPORATION,"PLOT NO.18/1, MAYUR VILLA,STREET NO.6, NEAR SAMARPAN HOSPITAL JAMNAGAR Jamnagar 361006",Commercial,akhilamcorporation5719@gmail.com,9727701111,PR/GJ/JAMNAGAR/JAMNAGAR/Others/CAA11570/060423,Jamnagar,06-04-2023
1698,Multilevel Parking and Commercial Complex at Sindhu Bhavan,AHMEDABAD MUNICIPAL CORPORATION,"Sardar Patel Bhavan, Danapith, Ahmedabad Ahmedabad 380001",Commercial,addcehp@ahmedabadcity.gov.in,9327038855,PR/GJ/AHMEDABAD/AHMEDABAD CITY/AUDA/CAA12390/071023,Ahmedabad,07-10-2023
1699,RK Elinora Phase-l,SHREE SAI DEEP ENTERPRISE,"R.S. No. 255 ZADESHWAR, BHARUCH Bharuch 392011",Commercial,shreesaideepent2022@gmail.com,8141010686,PR/GJ/BHARUCH/BHARUCH/Bharuch- Ankleshwar Urban Development Authority/CN273AA10173/261222,Bharuch,26-12-2022
1700,ROYAL ICON,ROYAL ASSETS,"142, ROYAL ICON, ASHIRWAD MARRIAGE HALL, N.H-8, KARJAN Vadodara 391240",Commercial,nirajvc@gmail.com,9426081477,PR/GJ/VADODARA/KARJAN/Karjan Municipality/CN303AA10203/270223,Vadodara,27-02-2023
1701,Samasta Arcade,BAKERI PROJECTS PRIVATE LIMITED,"SANSKRUT BUILDING, NR. OLD HIGH COURT ROAD, ASHRAM ROAD Ahmedabad 380009",Commercial,accgen@bakeri.com,9426385946,PR/GJ/AHMEDABAD/AHMEDABAD CITY/AUDA/CAA10688/270922,Ahmedabad,27-09-2022
1702,SHIVALIK SHOPS,SHREE SAI DEVELOPERS,"A-7, REVAPARK BUNGLOWS WAGHODIYA ROAD Vadodara 390018",Commercial,shivalik2023@gmail.com,9924203880,PR/GJ/VADODARA/VADODARA/Others/CAA10711/290922,Vadodara,29-09-2022
1703,KESHAV SQUARE,KESHAV AND SONS,"BEDESHWAR , MUKESH NIVAS ,OPP.JAHER PIR NI DARGAH, SHAH TRANSPORT COMPANY ,BEDI BUNDER ROAD,JAMNAGAR Jamnagar 361002",Commercial,keshavsquare.jam@gmail.com,7506438236,PR/GJ/JAMNAGAR/JAMNAGAR/Others/CAA11031/171222,Jamnagar,17-12-2022
1704,ICONIC HUB,APEX BUILDCON,SHOP NO 9 CLASSIC EMPIRE OPP SHILPA COMPOUND Mehsana 384002,Commercial,apexbuidcon9@gmail.com,9824018599,PR/GJ/MEHSANA/MAHESANA/Others/CAA10972/251122,Mehsana,25-11-2022
1705,SUNRISE,MUSTAFARANGWALA & Others,"STATION ROAD, OPP. WATER STAND NEAR BIBIDOSHI KUI BHAVNAGAR Bhavnagar 364001",Commercial,sunrissee22@gmail.com,9824200200,PR/GJ/BHAVNAGAR/BHAVNAGAR/Bhavnagar Municipal Corporation/CAA13174/270324/311227,Bhavnagar,27-03-2024
1706,ANGEL PLUS,ANGEL BUILDCON,"Office No.708, 7th Floor, Angel Bizz, Khodal Chowk, Nr. Matuki Restaurant "" 80 Feet Road, Mavdi, Rajkot, Gujarat-360004. "" Rajkot 360004",Commercial,angelplusrera@gmail.com,6355227551,PR/GJ/RAJKOT/RAJKOT/Others/CAA10603/290822,Rajkot,29-08-2022
1707,Inspirom,OM SAI DEVELOPERS,"805-905, Classic Residency Tower 2, Nr Akota Garden Vadodara 390020",Commercial,inspirom.vadodara@gmail.com,7574856726,PR/GJ/VADODARA/VADODARA/Others/CAA10815/181022,Vadodara,18-10-2022
1708,SAFFRON INDUSTRIAL PARK,SAFFRON DEVELOPERS,"4, Nakshtra Bunglows, Behind Saurashtra Samaj M.G. Road, Nikol, Ahmedabad - 382350 Ahmedabad 382350",Commercial,saffronind26@gmail.com,8128148379,PR/GJ/AHMEDABAD/DASKROI/AUDA/CAA10890/111122,Ahmedabad,11-11-2022
1709,Nirman Giriraj,GIRIRAJ CONSTRUCTION,"501, Vrundavan Enclave, 132 Ft. Ring Road, Nr. AEC Cross Roads, Naranpura, Ahmedabad 380013",Commercial,nirmangiriraj@gmail.com,9979855701,PR/GJ/AHMEDABAD/AHMEDABAD CITY/AUDA/CAA11811/220523,Ahmedabad,22-05-2023
1710,Dwarika Empire,DEV BUILDERS,"GAYTRI PLAZA SHOP NO. 103 GAYTRINAGAR MAIN ROAD, BHAKTINAGAR CIRCLE REGION, Rajkot 360002",Commercial,rera.dwarikaempire@gmail.com,9824233333,PR/GJ/RAJKOT/RAJKOT/Others/CAA10852/271022,Rajkot,27-10-2022
1711,Doctor House Plus,GOPAL DEVELOPERS,"SHOP NO 127A, SHUBH COMPLEX ZANZARDA BYPASS CHOKDI Junagadh 362001",Commercial,rera56.doctorhouseplus@gmail.com,9428890088,PR/GJ/JUNAGADH/JUNAGADH CITY/Junagadh Municipal Corporation/CN169AA10069/020922,Junagadh,02-09-2022
1712,SATYA 2 INDUSTRIAL PARK,SUN DEVELOPERS,"B/23, NILAM BUNGLOWS, NEAR SHYAM PARK KRISHNA NAGAR, SAIJPUR BOGHA, AHMEDABAD Ahmedabad 382345",Commercial,satya2industrial@gmail.com,9574835144,PR/GJ/AHMEDABAD/AHMEDABAD CITY/AUDA/CAA10702/280922,Ahmedabad,28-09-2022
1713,ONE PLUS BUSINESS POINT,GURUKRUPA CORPORATION,34 SAGAR TENAMENT OPP SBI BANK NARODA Ahmedabad 382330,Commercial,oneplusbusinesspoint@gmail.com,9825035840,PR/GJ/AHMEDABAD/AHMEDABAD CITY/AUDA/CAA10743/EX1/EX2/301024/311224,Ahmedabad,07-10-2022
1714,HAREKRISHNA 51 INDUSTRIAL ESTATE,HK BUILDCON,"B 67, Jagdish Park, Fountain Circle, Nr. Canal, Viratnagar Road, Odhav Ahmedabad Ahmedabad 382350",Commercial,hkbuildcon8@gmail.com,9909420789,PR/GJ/AHMEDABAD/DASKROI/Ahmedabad Municipal Corporation/CN204AA10104/280922,Ahmedabad,28-09-2022
1715,Panchratna Alfa Cottage Industrial Park,NEELKANTH ENTERPRISE,"Sr. No. 147/1 & 147/2, F.P. No. 64, TPS No. 90, Panchratna Alfa Cottage Industrial Park Opp. Paradise Park, Near Sainath Housing Apartment, SP Ring Road, Vinzol Ahmedabad 382445",Commercial,neelkanthdevelopersrera2022@gmail.com,9909008855,PR/GJ/AHMEDABAD/AHMEDABAD CITY/AUDA/CAA10930/161122,Ahmedabad,16-11-2022
1716,AKSHAR ARYA,SRUSHTI DEVELOPERS,"KHAMDHROD CHOWKDI, JUNAGADH RAJKOT BYPASS OPP BHAJAP KARYALAY, NR GAMTHI HOTEL Junagadh 362001",Commercial,rera70.akshararya@gmail.com,9925054927,PR/GJ/JUNAGADH/JUNAGADH/Others/CAA11682/270423,Junagadh,27-04-2023
1717,RUDRAKSH ONE,RUDRAKSH CONSTRUCTION,"FIRST FLOOR SHOP NO 10 HARIYA COLLEGE ROAD, MURLIDHAR COMPLEX, NEAR OLD JAKAT NAKA Jamnagar 361008",Commercial,rudrakshcon2022@gmail.com,9638890906,PR/GJ/JAMNAGAR/JAMNAGAR/Others/CAA10705/280922,Jamnagar,28-09-2022
1718,SATYA INDUSTRIAL PARK,SATYA DEVELOPERS,"9 ,SARDAR PATEL, BUNGLOWS, B/H KALYAN CHOWK, THAKKARBAPANAGAR, AHMEDABAD Ahmedabad 382350",Commercial,satyaindustrialpark@gmail.com,9979774015,PR/GJ/AHMEDABAD/DASKROI/AUDA/CAA10756/101022,Ahmedabad,10-10-2022
1719,BUSINESS EMPIRE,APPLE DEVELOPERS,"FLAT NO 301, VAIDEHI APARTMENT, 1 OM NAGAR ST NO. 7, BESIDE PANCHTATVA COMPLEX, MAVDI PLOT, Rajkot 360004",Commercial,apple.businessempire@gmail.com,9898039194,PR/GJ/RAJKOT/RAJKOT/Others/CAA11360/040323,Rajkot,04-03-2023
1720,CAPITAL ONE BUSINESS CENTER,SHREE DHARAN COMMERCIAL CO OPERATIVE SOCIETY LIMITED,PLOT NO 16 WARD NO DC-2 GANDHDIHAM Kutch 370201,Commercial,dharanrealtors@gmail.com,9099250153,PR/GJ/KUTCH/GANDHIDHAM/Others/CAA10987/021222,Kutch,02-12-2022
1721,DASARAM PRIME 2,DASARAM BUILDERS,"SHOP NO 159 FIRST FLOOR, UNIQ PRIZAM COMPLEX, OPP.BUS STATION, JUNAGADH, GUJARAT-362001 Junagadh 362001",Commercial,dasaramprime2@gmail.com,9825220270,PR/GJ/JUNAGADH/JUNAGADH/Others/CAA10999/031222,Junagadh,03-12-2022
1722,VYANKTESH VOGUE,PRADIPKUMAR B VASANI,"Kanchan, Govardhan nagar, Jetpur, Rajkot-360370 Rajkot 360370",Commercial,vyankteshvoguerera@gmail.com,9376120345,PR/GJ/RAJKOT/RAJKOT/Others/CAA11376/040323,Rajkot,04-03-2023
1723,GOLDEN PLAZA,GOLDEN INFRA,"16, Pushkar Bunglows, Opp. Shivam Sundaram Bunglows Nikol-Naroda Road, Nikol Ahmedabad 382350",Commercial,goldenplazarera2022@gmail.com,9106391117,PR/GJ/AHMEDABAD/AHMEDABAD CITY/Ahmedabad Municipal Corporation/CN233AA10133/211022,Ahmedabad,21-10-2022
1724,THE SANKALP,DEVARSHI INFRACON,"1, GROUND FLOOR, VEDANT AEON, OPP.LUBI PUMP, S.P.RING ROAD, NANA CHILODA, AHMEDABAD Ahmedabad 382330",Commercial,thesankalp1995@gmail.com,7575024242,PR/GJ/AHMEDABAD/AHMEDABAD CITY/AUDA/CAA11057/211222,Ahmedabad,21-12-2022
1725,SHLOK 02,SAMAST INFRA,"A/201, SHLOK BUSSNESS HUB , SWAMINARAYAN MANDIR ROAD NEAR ASLAI BRIDGE ,ASLALI Ahmedabad 382427",Commercial,infrasamast@gmail.com,7698674912,PR/GJ/AHMEDABAD/DASKROI/AUDA/CAA11431/130323,Ahmedabad,13-03-2023
1726,GOLDEN SQUARE,VRAJ DEVELOPERS,"206, 2ND FLOOR, FORTUNE PLAZA, M G ROAD, OPP SANTOOR RESTAURANT, Junagadh 362001",Commercial,goldensquare2573@gmail.com,9824187900,PR/GJ/JUNAGADH/JUNAGADH/Others/CAA11525/290323,Junagadh,29-03-2023
1727,SOLARIS ATHENA,H R INFRA,"SOLARIS ATHENA, CITY SURVEY NO. 689 TO 693, WARD NO. 13/1 (ATHWA) BESIDES DHIRAJ SONS MEGA STORE, OPPOSITE TRI STAR HOSPITAL, ATHWALINES, SURAT-395001 Surat 395001",Commercial,athena.solarisgroup@gmail.com,7666181000,PR/GJ/SURAT/SURAT CITY/SUDA/CAA10749/071022,Surat,07-10-2022
1728,SOMNATH HEIGHTS,DIGVIJAYSINH DASHRATHSINH CHUDASMA,"47 CHANDRAMAULI SOCIETY B/H TATA SHOWROOM, FULSAR, BHAVNAGAR. BHAVNAGAR Bhavnagar 364004",Commercial,somnathheights09@gmail.com,9327263040,PR/GJ/BHAVNAGAR/BHAVNAGAR/Bhavnagar Municipal Corporation/CAA13851/150724/311226,Bhavnagar,15-07-2024
1729,FARM FRESH 365,JAYNI PROJECTS LIMITED,"302, Shreyas Complex, Nr. Dinesh Hall Income Tax, Ashram Road Ahmedabad 380009",Commercial,jayniprojects2006@gmail.com,9979876856,PR/GJ/AHMEDABAD/AHMEDABAD CITY/AUDA/CAA11095/291222,Ahmedabad,29-12-2022
1730,THE PROFIT,WISDOM CORP,"231, Second Floor, Monarch, Gauravpath Road Adajan Surat Surat 394510",Commercial,info@tbco.in,9512088999,PR/GJ/SURAT/CHORASI/SUDA/CAA10722/A1C/020324/311225,Surat,01-10-2022
1731,ARYAA BUSINESS CENTER,SUNDARAM INFRASTRUCTURE,"4TH FLOOR , SHOPPERS PLAZA-2 NEAR GIRISH COLDRINCKS, C G ROAD Ahmedabad 380009",Commercial,sundaraminfrastructure@gmail.com,9313214412,PR/GJ/AHMEDABAD/AHMEDABAD CITY/AUDA/CAA10645/090922,Ahmedabad,09-09-2022
1732,73 EAST AVENUE CORPORATE,NEPTUNE INFRA-BUILD LLP,"NEPTUNE CAMPUS, NEAR ATLANTIS HEIGHTS SARABHAI MARG, VADI WADI Vadodara 390007",Commercial,73eastavenuecorporate@gmail.com,9824479903,PR/GJ/VADODARA/VADODARA/Others/CAA11212/280223,Vadodara,28-02-2023
1733,SHIV KRUPA-2 INDUSTRIAL ESTATE,SHREE SHUBHLAXMI DEVELOPERS,"R.S. NO. 212, F.P. NO. 82/2, T.P.S. NO. 131 KATHWADA, B/H BHUVALDI 2, SINGARVA Ahmedabad 382430",Commercial,shivkrupa2indestate@gmail.com,9825889692,PR/GJ/AHMEDABAD/DASKROI/AUDA/CAA10985/291122,Ahmedabad,29-11-2022
1734,DASARAM PRIME 3 & 4,DASARAM CONSTRUCTION,"SHOP NO G 11, DWARIKA PLAZA 1 ZANZARDA ROAD Junagadh 362001",Commercial,dasaramconstruction0639@gmail.com,9909310170,PR/GJ/JUNAGADH/JUNAGADH/Junagadh Municipal Corporation/CAA14329/251024/311227,Junagadh,25-10-2024
1735,YOGI FLORENCIA,HARI DEVELOPERS,"“YOGI EDHAS”, F. P. - NO - 134, R. S. NO – 588, NEAR D - MART, BEHIND VOLTAMP COMPANY, JAMBUA, VADODARA, – 390013 Vadodara 390013",Commercial,yogiedhas@gmail.com,9824088073,PR/GJ/VADODARA/VADODARA/Others/CAA11250/010323,Vadodara,01-03-2023
1736,ASHWAMEGH THE EMPIRE,ASHWAMEGH FOUNDATIONS,"SURVEY NO 2309, FP NO 322 NEAR NEHRU CHOKDI, DEHGAM Gandhinagar 382305",Commercial,ashwameghfoundation123@gmail.com,9898807979,PR/GJ/GANDHINAGAR/DEHGAM/AUDA/CAA11218/280223,Gandhinagar,28-02-2023
1737,CENTRAL BUSINESS HUB,SHREENATHJI CONCEPTS LLP,"55, CENTRAL BAZAR OPP VIDHYAKUNJ SCHOOL, GANDEVI ROAD Navsari 396445",Commercial,centralbusinesshub1@gmail.com,8141300200,PR/GJ/NAVSARI/NAVSARI/Others/CAA11348/030323,Navsari,03-03-2023
1738,KSHITIJ AARIKA,SHILP BUILDCON,"321, 3rd Floor, ISCON ARCADE C.G ROAD, NAVRANGPURA Ahmedabad 380009",Commercial,shilpbuildcon19@gmail.com,9879845452,PR/GJ/AHMEDABAD/AHMEDABAD CITY/AUDA/CAA11135/030123,Ahmedabad,03-01-2023
1739,ANTILA THE BUSINESS POINT,VIJAY AMRUTBHAI BHANDERI Prop. Khodal Developers,"PLOT NO 114/A, STREET NO.3 EWA PARK-1, LALPUR ROAD, OPP BHANUPETROL PUMP Jamnagar 361005",Commercial,info.khodaldevelopers@gmail.com,9723646868,PR/GJ/JAMNAGAR/JAMNAGAR/Jamnagar Municipal Corporation/CN270AA10170/061222,Jamnagar,06-12-2022
1740,KRUSHNAM SKYLINE,KANHA BUILDCON,"S 28, KRUSHNAM SKYWALK RADHANPUR HIGHWAY, MEHSANA Mehsana 384002",Commercial,kanhabuildconrera@gmail.com,9824109611,PR/GJ/PATAN/PATAN/Patan Area Development Authority/CN321AA10221/090323,Patan,09-03-2023
1741,APPLEWOOD PRIME,DIVYA INFINITY,"PLOT NO. A3, BLOCK NO 3 SHREE GIRNAR Co. Op. Ho. So Ltd Junagadh 362001",Commercial,rera71.applewoodprime@gmail.com,9825222110,PR/GJ/JUNAGADH/JUNAGADH/Others/CAA11907/030623,Junagadh,03-06-2023
1742,KALP UPVAN BUSINESS HUB,ISHAN ICON,"SHOP NO E 5 FIRST FLOOR, NATH COMPLEX TAPOVAN PARK, NEAR ZANZARDA BYPASS CHOKADI, Junagadh 362001",Commercial,kalpupvanbusinesshub@gmail.com,8140504538,PR/GJ/JUNAGADH/JUNAGADH/Others/CAA12594/061123,Junagadh,06-11-2023
1743,THE GATEWAY,SHIKHAR INFRA,"SURVEY NO.514, NEAR PARIKH HOSPITAL OPP TORRENT POWER SUB STATION, NIKOL Ahmedabad 382350",Commercial,shikharinfra878@gmail.com,8128868068,PR/GJ/AHMEDABAD/AHMEDABAD CITY/Ahmedabad Municipal Corporation/CN325AA10225/200323,Ahmedabad,20-03-2023
1744,V.R. INDUSTRIAL PARK,VAHANVATI DEVELOPERS,"V.R. INDUSTRIAL PARK, KATHWADA SINGARVA ROAD KATHWADA GAM Ahmedabad 382430",Commercial,vrindustrial3475@gmail.com,9687613475,PR/GJ/AHMEDABAD/AHMEDABAD CITY/AUDA/CAA12697/161123,Ahmedabad,16-11-2023
1745,Shyam Trade Center,SHYAM INFRA,"B - 10, VIKRAMADITYA SOCIETY OPP BAJRANG ASHRAM, TB NAGAR Ahmedabad 382350",Commercial,shyamtrade.rera@gmail.com,9574767071,PR/GJ/AHMEDABAD/DASKROI/Ahmedabad Municipal Corporation/CN299AA10199/130123,Ahmedabad,13-01-2023
1746,MANIBHADRA ICON,MANIBHADRA DEVELOPERS,"SURVEY NO 548 PAIKI, UNJA TRAN RASTA, NR CANAL, Patan 384265",Commercial,manibhadraicon68@gmail.com,9924555987,PR/GJ/PATAN/PATAN/Others/CAA11047/A1C/260923,Patan,17-12-2022
1747,NEW CITY MALL,NEW CITY ENTERPRISE,"REVENUE SURVEY NO 16 P1 P2 PLOT NO 10TO 13,JAMNAGAR ROAD Rajkot 360007",Commercial,thecitymall.reraa@gmail.com,8141522417,PR/GJ/RAJKOT/RAJKOT/Others/CAA10868/051122,Rajkot,05-11-2022
1748,DASARAM PRIME 5,DASARAM BUILDERS,"SHOP NO 159 FIRST FLOOR, UNIQ PRIZAM COMPLEX, OPP.BUS STATION, JUNAGADH, GUJARAT-362001 Junagadh 362001",Commercial,dasaramprime2@gmail.com,9825220270,PR/GJ/JUNAGADH/JUNAGADH/Junagadh Municipal Corporation/CAA12981/200224/311227,Junagadh,20-02-2024
1749,Fortune East Industrial Park,MARUTINANDAN DEVELOPERS,"Block No. 25/B/2, FP No. 20/2, TPS No. 243, Opp. Fortune North Nr. 220 KV Substation, 200 Ft. Ring Road, Ranasan Gandhinagar 383305",Commercial,fortuneeastrera@gmail.com,9979853005,PR/GJ/GANDHINAGAR/GANDHINAGAR/AUDA/CAA10996/031222,Gandhinagar,03-12-2022
1750,SHRIMAT ARCADE,JALVIJ REALTY,"1186 Gandhipole, Karamsad Anand 388325",Commercial,jay.jp5546@gmail.com,9913206919,PR/GJ/ANAND/ANAND/Anand VallabhVidhyanagar Karmsad Urban Development Authority/CN332AA10232/110423,Anand,11-04-2023
1751,ISHAN SQUARE,SHREE CORPORATION,"1-DURGAKRUPA SOCIETY, NR. KIRTIDHAM DERASAR, CHANDKHEDA Ahmedabad 382424",Commercial,ishansquare2022@gmail.com,9924442507,PR/GJ/AHMEDABAD/AHMEDABAD CITY/AUDA/CAA11092/281222,Ahmedabad,28-12-2022
1752,Business Icon,MONA ASHISHBHAI PATEL PROPRIETOR OF SHREEJI DEVELOPERS,Radhe Van Panchvati Flat No. 201 Parnkuti Police Chowki Rajkot 360001,Commercial,rera.businessicon@gmail.com,9824224434,PR/GJ/RAJKOT/RAJKOT/Others/CAA11726/060523,Rajkot,06-05-2023
1753,PRINCE CUBE,PARESHWAR BUILDCON,"SF/212, LOTUS ELITE, NEAR COLABERA GOTRI SEVASI MAIN ROAD, GOTRI Vadodara 390021",Commercial,pareshwarbuildcon@gmail.com,9106204698,PR/GJ/VADODARA/VADODARA/Others/CAA11532/290323,Vadodara,29-03-2023
1754,SANAY 70,SANAY INFRASTRUCTURE,"A/01 SANAY LANDMARK, NEAR NILKANTH DUPLEX, OPP. RATANRAJ DUPLEX, ZUNDAL Gandhinagar 382424",Commercial,girishkumar.makwana@yahoo.in,9925607000,PR/GJ/GANDHINAGAR/GANDHINAGAR/Gandhinagar Municipal Corporation/MN281AA10181/261222,Gandhinagar,26-12-2022
1755,MURLIDHAR TRIANGLE,HARJIBHAI MEETHABHAI PARSANA,"Krishna, Plot No.41/42, Murlidhar Park-A, Opp. Kothariya Gam Gate, Kothariya Rajkot 360022",Commercial,murlidhartriangle@gmail.com,9879599472,PR/GJ/RAJKOT/RAJKOT/Rajkot Municipal Corporation/CAA13426/020524/300925,Rajkot,02-05-2024
1756,VACANZA HARRODS,VACANZA HARRODS LLP,"SHOP NO 238, PALLADIUM OPP VIP PLAZA VESU Surat 395007",Commercial,vacanzagroup007@gmail.com,8141717943,PR/GJ/SURAT/CHORASI/SUDA/CAA11274/020323,Surat,02-03-2023
1757,PRISM COMPLEX,LILAVANTI ESTATES,"aavkar Bunglaw Street No 4 kamdar colony main road , shankar tekri Jamnagar 361005",Commercial,prismjamnagar@gmail.com,9974099133,PR/GJ/JAMNAGAR/JAMNAGAR/Others/CAA13138/160324/310325,Jamnagar,16-03-2024
1758,SHIV INDUSTRIAL PARK,SHIVAM INFRA,"K-60, AYUSH TENAMENT -99,OPP JIVAN TWIN BUNGLOWS NEAR YOGESHWAR ,NIKOL Ahmedabad 382350",Commercial,shivaminfra123@gmail.com,7600267200,PR/GJ/AHMEDABAD/DASKROI/AUDA/CAA11124/311222,Ahmedabad,31-12-2022
1759,MANIBHADRA HEIGHTS,Patel Dilipkumar Amthalal proprietor Of Priya Developers,"17A, Suvidhanath Society, Nr Rani ki vav, Patan 384265",Commercial,manibhadraheights18@gmail.com,9924555987,PR/GJ/PATAN/PATAN/Others/CAA11217/280223,Patan,28-02-2023
1760,VICTORIA CORPORATE,RACHANA BUILDERS,"SHOP NO 319,3RD FLOOR,EVA SURBHI COMPLEX WAGHAWADI ROAD BHAVNAGAR Bhavnagar 364001",Commercial,victoriacorporate0@gmail.com,9327787878,PR/GJ/BHAVNAGAR/BHAVNAGAR/Others/CAA11681/270423,Bhavnagar,27-04-2023
1761,SURAT TEXTILE BOURSE PHASE-I (PART-A),THE BARODA RAYON CORPORATION LIMITED,P.O. FATEHNAGAR UDHAN Surat 394220,Commercial,brcsurat@gmail.com,9925650000,PR/GJ/SURAT/SURAT CITY/Surat Municipal Corporation/CN283AA10183/261222,Surat,26-12-2022
1762,GENIUS HOUSE,SPARK DEVELOPERS,"5TH FLOORSKY HIGH BUILDING, OPP MEHTA PETROL PUMP KATARGAM, SURAT Surat 395004",Commercial,spark_developers@yahoo.com,9687461789,PR/GJ/SURAT/SURAT CITY/Surat Urban Development Authority/CN358AA10258/070723,Surat,07-07-2023
1763,RADHE KRISHNA GOLD COMMERCIAL AND INDUSTRIAL ESTATE,SHREE RADHE INFRA,"F - 204, SHREEDHAR FLORA NR. AMAR JAWAN CIRCLE, NIKOL Ahmedabad 382350",Commercial,shreeradheinfragold@gmail.com,8320903411,PR/GJ/AHMEDABAD/DASKROI/AUDA/CAA11268/010323,Ahmedabad,01-03-2023
1764,THE GALLERIA BUSINESS HUB 2,SHREEJI INFRA,"FP NO 105/A TP 60 BLOCK NO 338 MAHAVIR CHOWK, UMARWADA PUNAGAM SURAT Surat 395010",Commercial,shreejiinfra239@gmail.com,9638000238,PR/GJ/SURAT/SURAT CITY/SUDA/CAA11186/110123,Surat,11-01-2023
1765,VINAYAK INDUSTRIAL ESTATE 4,HEET INFRA,"D-102 PARIMAL HEIGHTS, OPP. GOKUL BUNGLOWS, CANAL ROAD,NIKOL Ahmedabad 382350",Commercial,vinayakindestate4rera@gmail.com,9998843273,PR/GJ/AHMEDABAD/AHMEDABAD CITY/AUDA/CAA11535/290323,Ahmedabad,29-03-2023
1766,SHREE SHAKTI INDUSTRIAL HUB,SHREE SHAKTI DEVELOPERS,"FP NO-41P, B/H DEVASHRAY INDUSTRIAL PARK, LALGEBI CIRCLE RING ROAD, HATHIJAN Ahmedabad 382445",Commercial,shreeshaktiindhubrera2023@gmail.com,9099000058,PR/GJ/AHMEDABAD/AHMEDABAD CITY/AUDA/CAA11630/180423,Ahmedabad,18-04-2023
1767,BEST INDUSTRIAL PARK,BEST DEVELOPERS,"""Best Industrial Park"" Final Plot No.42/2, Survey No.28/A/2, TPS: 243(Ranasan-Muthiya-Nana Chiloda), Near Nana Chiloda Circle, Gandhinagar 382330",Commercial,bestdevelopers.bestindupark@gmail.com,7600750177,PR/GJ/GANDHINAGAR/GANDHINAGAR/AUDA/CAA11614/180423,Gandhinagar,18-04-2023
1768,TRIVIA ONE,ARC INFRASTRUCTURE,"C-909, GANESH MERIDIAN, OPP GUJARAT HIGH COURT, KARGIL PETROL PUMP, S.G. HIGHWAY, AHMEDABAD Ahmedabad 380060",Commercial,arcinfrastructure08@gmail.com,6352350549,PR/GJ/AHMEDABAD/AHMEDABAD CITY/AUDA/CAA11418/060323,Ahmedabad,06-03-2023
1769,Lilamani Industrial Park,LILAMANI DEVELOPERS,"203, Shashwat Complex, Opp. HDFC House Nr. Mithakhali Six Road, Navrangpura Ahmedabad 380009",Commercial,rera.lilamanidevelopers@gmail.com,6354187687,PR/GJ/AHMEDABAD/AHMEDABAD CITY/Ahmedabad Municipal Corporation/CAA13474/080524/311226,Ahmedabad,08-05-2024
1770,MONEY PLANT JUNCTION,V SQUARE RIDDHI PROJECTS,"Survey No.216, 2 6 7, F.P. No.478,479, Moneyplant Junction, Bhuyangdev Cross road, Naranpura, Ahmedabad Ahmedabad 380013",Commercial,v2riddhi@gmail.com,9925233227,PR/GJ/AHMEDABAD/AHMEDABAD CITY/AUDA/CAA11331/030323,Ahmedabad,03-03-2023
1771,SATYA BUSINESS PARK,RUSHABHDEV DEVELOPERS,"F.P No. 196/1/P1, Nr Sumel Business Park-2 Rajpur-Hirpur, Maninagar, Ahmedabad-380022 Ahmedabad 380022",Commercial,sbp.rushabdev@gmail.com,9925171258,PR/GJ/AHMEDABAD/AHMEDABAD CITY/AUDA/CAA11107/311222,Ahmedabad,31-12-2022
1772,SOLARIS KODE,AARYAN INFRA,"SOLARIS KODE, F.P. NO 44, T.P.S NO:- 13(BHARTHANA-VESU), NEAR KHATUSHYAM TEMPLE, VIP ROAD, SURAT- 395007. Surat 395007",Commercial,kode.solarisgroup@gmail.com,7666181000,PR/GJ/SURAT/SURAT CITY/SUDA/CAA11123/311222,Surat,31-12-2022
1773,RADHE ICON,BHAVESHKUMAR MANIBHAI PATEL,"ROOM NO. 1, S.F. 218,RAJ VALENCIA NEAR ASHTHA HOME SCIENCE CITY ROAD, SOLA, Ahmedabad 380060",Commercial,radheiconnadiad@gmail.com,9825060092,PR/GJ/KHEDA/NADIAD/Others/CAA11303/020323,Kheda,02-03-2023
1774,SHREE MADHAV THE BUSINESS HUB,MADHAV CONSTRUCTION,"M.WARD NO.-10, TIKA NO.-91, C.S.NO.-3792/K, R.S.NO.-199/2/1+2+ 3+ 4 PAIKY, T.P.S. NO.-2, O.P.NO.-17, F.P.NO.-34 AT MOJE : NAVSARI CITY OPPOSITE TO COURT, NAVSARI, TAL. : NAVSARI, DIST. : NAVSARI Navsari 396445",Commercial,shreemadhavthebusinesshubrera@gmail.com,9824199581,PR/GJ/NAVSARI/NAVSARI/Others/CAA11373/040323,Navsari,04-03-2023
1775,SHOOLIN SQUARE,SHIVANSH REALTY,"1ST FLOOR, NIRMAN COMPLEX, SHIVANSH REALTY, NR. UMIYA CIRCLE. VISNAGAR ROAD. UNJHA Mehsana 384170",Commercial,shivanshrealtyrera@gmail.com,9825581012,PR/GJ/MEHSANA/MAHESANA/Others/CAA11556/050423,Mehsana,05-04-2023
1776,Saffron Industrial Park - 2,SAFFRON INFRA,"15, Dharti Tenament, Opp. Ratanba School Thakkarbapanagar, Ahmedabad - 382350 Ahmedabad 382350",Commercial,saffronind31@gmail.com,9825195621,PR/GJ/AHMEDABAD/DASKROI/AUDA/CAA11370/040323,Ahmedabad,04-03-2023
1777,KESHAV INDUSTRIAL PARK,KEDAR BUILDCON,"SF-208, ARTH BUSINESS CENTER OPP.TORRENT SUB STATION, NIKOL RING ROAD, NIKOL, AHMEDABAD Ahmedabad 382350",Commercial,kedarbuildcon2022@gmail.com,9376671071,PR/GJ/AHMEDABAD/AHMEDABAD CITY/AUDA/CAA12117/070723,Ahmedabad,07-07-2023
1778,HERITAGE INDUSTRIAL HUB,STAR BUILDCON,HERITAGE INDUSTRIAL HUB KATHWADA GIDC ROAD Ahmedabad 380038,Commercial,starbuild98@gmail.com,8000620038,PR/GJ/AHMEDABAD/AHMEDABAD CITY/AUDA/CAA09856/A1C/160123,Ahmedabad,25-02-2022
1779,Victoria Elegant,ORCHID & CO.,"551/B-1 NEW MANEKWADI,NEAR SHIVSHAKTI HALL Bhavnagar 364001",Commercial,victoriaplatinum9545@gmail.com,8141500600,PR/GJ/BHAVNAGAR/BHAVNAGAR/Others/CAA11663/EX1/110225/311225,Bhavnagar,26-04-2023
1780,MOUNT BIZPARK,SADASHIV INFRA,"SHOP NO. 03, ANMOL BUNGALOWS, NEW RANIP Ahmedabad 382480",Commercial,sadashivinfra107@gmail.com,9714042400,PR/GJ/AHMEDABAD/AHMEDABAD CITY/AUDA/CAA11293/A1C/090224/311226,Ahmedabad,02-03-2023
1781,THE GATEWAY,SYNERGY CORPORATION,"SURVEY/BLOCK NO. 1440, NEAR CHALA PRIMARY SCHOOL, OPP. SHOPPER’S GATE, VAPI DAMAN MAIN ROAD, CHALA, VAPI Valsad 396191",Commercial,legal.synergycorporation@gmail.com,9724712020,PR/GJ/VALSAD/VALSAD/Others/CAA11285/020323,Valsad,02-03-2023
1782,GJ CENTRAL,GJ BUILDCON LLP,"216 to 223 Second Floor, Tower C Kanha City ,Opp Kailas party Plot, Ajwa Road, Vadodara Vadodara 390025",Commercial,gjcentral7@gmail.com,9898028246,PR/GJ/VADODARA/VADODARA/Others/CAA11600/150423,Vadodara,15-04-2023
1783,RUVAPARI ESTATE,SHOAIBARIFBHAILOHIYA,"MOTI SHERI,CHABUTARANI SAME VADVA,KACHHIYAWAD,BHAVNAGAR Bhavnagar 364002",Commercial,ruvapariestate8@gmail.com,7069505050,PR/GJ/BHAVNAGAR/BHAVNAGAR/Others/CAA11867/290523,Bhavnagar,29-05-2023
1784,VISION,ANAND INFRA,"Final Plot.No.70, TP-31, Opp.Shall Petrol Pump,L.P.Savani Road, ADAJAN Surat 395009",Commercial,vision@kppatel.in,9978954136,PR/GJ/SURAT/SURAT CITY/SUDA/CAA11464/160323,Surat,16-03-2023
1785,The Orion,HARI HARAY INFRASPACE,"A-101, S.G. BUSSINESS HUB,S.G. HIGHWAY GOTA Ahmedabad 382481",Commercial,hariharayinfraspacerera@gmail.com,9428974639,PR/GJ/AHMEDABAD/AHMEDABAD CITY/AUDA/CAA11314/030323,Ahmedabad,03-03-2023
