Sr.No.,Project Name,Promoter Name,Promoter Address,Project Type,Email Id,Mobile No,Project Registration No.,District,Approved on
538,BOSKY - THE CITY MALL,BOSKY RUDRAKSH DEVELOPERS,"SHOP No. 201-204, RADHIKA COMPLEX,PETHAPUR CROSS ROAD,PETHAPUR,GANDHINAGAR PETHAPUR CROSS ROAD,PETHAPUR,GANDHINAGAR Gandhinagar 382610",Commercial,arvindslp@yahoo.com,8758230648,PR/GJ/GANDHINAGAR/GANDHINAGAR/Others/CAA01704/EX1/030919,Gandhinagar,20-02-2018
539,COMMERCE SIX,G.M.DEVELOPERS,"COMMERCE SIX,Near Samved Hospital Navrangpura Road Ahmedabad 380006",Commercial,avnishjain@hotmail.com,9979590080,PR/GJ/AHMEDABAD/AHMEDABAD CITY/AUDA/CAA01802/EX1/241219,Ahmedabad,01-03-2018
540,SHIVEN SHOPPERS,Shiven Enterprise,"Shiven Shoppers, Opp Gangeshwar Temple Adajan, SURAT Surat 395009",Commercial,shivengroup@yahoo.com,9998669804,PR/GJ/SURAT/SURAT CITY/SUDA/CAA00126/A1C/EX1/211019,Surat,11-09-2017
541,RUDRAX SQUARE,Rise Developers,"Opp. Municipal Library Nr. Bandar Road, Veraval Gir Somnath 362265",Commercial,rera5.rudraxsquare@gmail.com,9913592165,PR/GJ/GIR SOMNATH/VERAVAL/Others/CAA03441/180918,Gir Somnath,18-09-2018
542,Turquoise 2,Ratnabhumi Builspace LLP,"207, Turquoise, Panchvati Cross Roads, C G Road, Ahmedabad 380006",Commercial,rera@ratnagroup.co.in,9427022214,PR/GJ/AHMEDABAD/AHMEDABAD CITY/AUDA/CAA00988/A1C/EX1/261119,Ahmedabad,12-12-2017
543,AVADH SHOPPING CENTER,BABU S SAKARIYA,"KISHAN, NATRAJ NAGAR STREET NO-1, OPP G K DHOLAKIYA, UNIVERSITY ROAD, RAJKOT Rajkot 360005",Commercial,avadhshoppingcenter@gmail.com,9913800707,PR/GJ/RAJKOT/RAJKOT/Others/CAA03717/EX1/280519,Rajkot,16-10-2018
544,PAVILLION PLAZA,ANADH ENTERPRISE,"BLOCK-306 ,SHREE SAI PLAZA DINDOLI Surat 394210",Commercial,plazashreesai@gmail.com,9737918000,PR/GJ/SURAT/SURAT CITY/SUDA/CAA01472/010218,Surat,01-02-2018
545,SHIKHAR AVENUE - BLOCK E,SHIVAM BUILDCON,"12 ASHRAY BUNGLOWS , B/H MANIBA SCHOOL SARDAR CHOWK , KRUSHNANAGAR Ahmedabad 382345",Commercial,shikharavenue@gmail.com,9879475988,PR/GJ/AHMEDABAD/AHMEDABAD CITY/AUDA/CAA02715/EX1/161220,Ahmedabad,22-05-2018
546,WHITE HOUSE,Sanskrut Infraspace LLP,"103, Parthmilan complex, 38, SARDAR PATEL NAGAR Nr.IDFC Bank, GIRISH COLDRINKS CROSS ROADS, ELLISEBRIDGE Ahmedabad 380006",Commercial,whitehousebapunagar@gmail.com,9825471007,PR/GJ/AHMEDABAD/AHMEDABAD CITY/AUDA/CAA01887/A1C/EX1/201022,Ahmedabad,06-03-2018
547,EVENTI,SETU PROCON,"SETU SCARLET CHANDKHEDA, AHMEDABAD Ahmedabad 382424",Commercial,info.setugroups@gmail.com,9825091801,PR/GJ/AHMEDABAD/DASKROI/AUDA/CAA01723/220218,Ahmedabad,22-02-2018
548,KRISH-RUDRAX PROJECTS,Krish-Rudrax Projects,"Shop No. 102, 1st Floor, C-block, Shivalic Business Centre, Opp. Gulf Academy ground b/h rajpath club, off. S.G. Highway, Bodakdev, Ahmedabad – 380054 Ahmedabad 380054",Commercial,tandonvishesh@gmail.com,9825007488,PR/GJ/AHMEDABAD/AHMEDABAD CITY/AUDA/CAA00603/061117,Ahmedabad,06-11-2017
549,WHITE HOUSE,Sanskrut Spacelink LLP,"203, Parthmilan complex, 38, SARDAR PATEL NAGAR Nr.IDFC Bank, GIRISH COLDRINKS CROSS ROADS, ELLISEBRIDGE Ahmedabad 380006",Commercial,whitehousesanskrut@gmail.com,9825471007,PR/GJ/GANDHINAGAR/GANDHINAGAR/Others/CAA00834/EX1/180220,Gandhinagar,27-11-2017
550,AUTOGRAPH THE COMMERCIAL HUB,AANGI DEVELOPERS,"OPP. RAJHANS OLYMPIA, NR. OLD L B CINEMA MAJURA – BHATAR MAIN ROAD Surat 395007",Commercial,autograph.bhatar@gmail.com,9825105455,PR/GJ/SURAT/SURAT CITY/SUDA/CAA04941/A1C/EX1/170821,Surat,28-02-2019
551,FORTUNE HIGHSTREET,SOKU DEVELOPERS,"202, ROYAL RESIDENCY VANIYA SHERI, MAHIDHARPURA, SURAT Surat 395003",Commercial,sokudevelopers.highstreet@gmail.com,9824327891,PR/GJ/SURAT/SURAT CITY/SUDA/CAA08185/EX1/011022,Surat,17-03-2021
552,WALK WAY THE MALL,M/S. BHAKTI INFRACON LLP,"""Walk way the mall"", Nr TGB Restaurant , L.p savani road, Adajan, Surat Surat 395009",Commercial,bhaktigroup34@gmail.com,9913211559,PR/GJ/SURAT/SURAT CITY/SUDA/CAA02185/270318,Surat,27-03-2018
553,RADHEY SQUARE,GOYAL INFRACON PRIVATE LIMITED,"5-6 , NIRDESH TENAMENTS, VISHWAMITRI RAILWAY STATION MANJALPUR, VADODARA Vadodara 390011",Commercial,mk.goyalenterprise@gmail.com,9824153845,PR/GJ/VADODARA/VADODARA/Others/CAA04560/020119,Vadodara,02-01-2019
554,PEHEL,J.R.Patel & co.,"No 4 Vithhalbhai bhavan, Near Usmanpura Underbridge Usmanpura Ahmedabad 380013",Commercial,jrpatelco@gmail.com,9601744066,PR/GJ/GANDHINAGAR/GANDHINAGAR/AUDA/CAA00096/A1C/EX1/160121,Gandhinagar,07-09-2017
555,SANKALP INDUSTRIAL PARK,DEVERSHI DEVELOPERS,OPP CNG PUMP NR S P RING ROAD N H 8 NANA CHILODA AHMEDABAD Ahmedabad 382330,Commercial,nirav.rudani@gmail.com,9898199511,PR/GJ/AHMEDABAD/AHMEDABAD CITY/AUDA/CAA00777/A1C/161018,Ahmedabad,20-11-2017
556,Times Square,SANKALP ENTERPRISE,"Times Square, TP-13, FP No.112+113 Near Capital Green Opp. Money Arcade, Canal Road, Vesu Surat 395007",Commercial,timessquaresurat@gmail.com,9825116371,PR/GJ/SURAT/SURAT CITY/SUDA/CAA01068/201217,Surat,20-12-2017
557,SWASTIK SQUARE,MR.DARSHAN B SHAH (PROP.OF SWASTIK DEVELOPERS),"SWASTIK SQUARE, PLOT NO.606-1/2 KALANALA KALUBHA ROAD Bhavnagar 364001",Commercial,shrenikshah_bvn@yahoo.com,9376858687,PR/GJ/BHAVNAGAR/BHAVNAGAR/Others/CAA00315/031017,Bhavnagar,03-10-2017
558,BAPUNAGAR ONE,CORUS INFRASTRUCTURE PVT LTD,PLOT NO 249 SECTOR 22 GANDHINAGAR Gandhinagar 382022,Commercial,info@corusinfra.com,9725000421,PR/GJ/AHMEDABAD/AHMEDABAD CITY/AUDA/CAA01738/230218,Ahmedabad,23-02-2018
559,SUN AVENUE ONE,SUN INFRASTRUCTURE,"SUN BUILDERS TRANSITION SPACE, OPP. SATYAM CORPORATE SQUARE, SINDHUBHAVAN ROAD BODAKDEV Ahmedabad 380059",Commercial,sunavenueone@gmail.com,9227219595,PR/GJ/AHMEDABAD/AHMADABAD CITY/AUDA/CAA00025/290817,Ahmedabad,29-08-2017
560,SHIV HEIGHTS,OMDEVSINH P JADEJA,"OPP. RIVER SIDE PALACE, NEAR COLLEGE CHOWK, AKSHAR MANDIR MAIN ROAD, GONDAL Rajkot 360311",Commercial,shivheights9696@gmail.com,9825409696,PR/GJ/RAJKOT/GONDAL/Others/CAA05819/010819,Rajkot,01-08-2019
561,Shreekar Avenue,Sunil Prahladbhai Sevani (Proprietor of M/S Sewani Construction),"4th Floor, Shoppers Plaza - V, Opp. Navrangpura Municipal Market, Navrangpura, C.G. Road, Ahmedabad 380009",Commercial,infsewaniconstruction@hotmail.com,9925353000,PR/GJ/AHMEDABAD/AHMEDABAD CITY/AUDA/CAA01914/070318,Ahmedabad,07-03-2018
562,GOPAL CHARAN IND ZON,LAXMINARAYAN INFRASTRUCTURE,"17-20 FIRST FLOOR,TRIMURTI COMPLEX, NEAR DEVRAJ MALL,INDIACOLONY,AHMEDABAD-382350 Ahmedabad 382350",Commercial,gopalcharanindzone@gmail.com,9712709795,PR/GJ/AHMEDABAD/AHMEDABAD CITY/AUDA/CAA01635/EX1/200922,Ahmedabad,16-02-2018
563,ISHWAR ARCADE,MAULIK CONSULTANCY,"1 RATNA COMPLEX, ISANPUR HIGHWAY CROSS ROAD ISANPUR, AHMEDABAD Ahmedabad 382443",Commercial,ishwararcaderera@gmail.com,9925003700,PR/GJ/AHMEDABAD/DASKROI/AUDA/CAA08495/250521,Ahmedabad,25-05-2021
564,STAR AYODHYA TEXTILE MARKET,7 STAR EMPIRE LIMITED,"STAR AYODHYA TEXTILE MARKET,BLOCK NO.60-61, FP-37,41-42,TP-19, PARVAT-MAGOB,DIST-SURAT Surat 395002",Commercial,sevenstarcompany7@gmail.com,9898213220,PR/GJ/SURAT/SURAT CITY/SUDA/CAA00390/EX3/221222,Surat,09-10-2017
565,Saffron Business Park,Saanvy Infrastructure Development Company,"45 KHOKHRA-MEHMDAVAD,GHODASAR, TP NO 1 SURVEY NO 64P, FP 121, JASODANAGAR Ahmedabad 382445",Commercial,sales@saanvy.in,9825470210,PR/GJ/AHMEDABAD/AHMEDABAD CITY/AUDA/CAA01840/A1C/151118,Ahmedabad,03-03-2018
566,Times Corner,MRP Corporation,"Plot No. 46/2, T.P. No. 29, Near Vesu Chokdi, Main V.I.P. Road, Vesu Surat 395007",Commercial,mrpcorporation17@gmail.com,9725155577,PR/GJ/SURAT/CHORASI/SUDA/CAA01672/170218,Surat,17-02-2018
567,RISING GLORY,ROSE ASSOCIATES,"SUREVY NO 38+39+40+41/2/2, SARKHEJ DHAL NR. ROYAL HOTEL LAL MARKET SARKHEJ ROAD, VEJALPUR AHMEDABAD Ahmedabad 380055",Commercial,risingglory2019@gmail.com,9824017754,PR/GJ/AHMEDABAD/AHMEDABAD CITY/AUDA/CAA06087/230919,Ahmedabad,23-09-2019
568,SHARANAM SMART SPACE,Sharanam Smart Space LLP,"3, First Floor, Parth Milan Building, Nr: Hotel Regenta,Girish Cold Drink Cross Road, C. G. Road,Ahmedabad- 380009 Ahmedabad 380009",Commercial,sharnamsmartspace@gmail.com,9998989688,PR/GJ/AHMEDABAD/AHMEDABAD CITY/AUDA/CAA01709/A1C/201120,Ahmedabad,20-02-2018
569,Milestone Fiesta,FIESTA CORPORATION,"F P 126 T P 31 Adajan Beside Woods Square , L P Savani Road Adajan , Surat , Chorasi , Surat , Gujarat 395009 Surat 395009",Commercial,fiesta@pradeepsinghi.com,9376444444,PR/GJ/SURAT/SURAT CITY/SUDA/CAA02424/EX2/091122,Surat,20-04-2018
570,LOTUS CORPORATE,Lotus Real Estate,"PLOT NO. 734/734A, VADVA RS. NO. 258 VIJAYRAJNAGAR Bhavnagar 364001",Commercial,ashishgautam2000@gmail.com,9898773388,PR/GJ/BHAVNAGAR/BHAVNAGAR/Others/CAA04745/EX1/161219,Bhavnagar,24-01-2019
571,ICON INDUSTRIAL PARK,JAY DEVELOPERS,"SURVAY NO. 580, OLD SURVAY NO. 231, F.P. NO. 92, DRAFT TPS- 131, B/H SOMNATH ESTATE, NR. ABHISHREE ESTATE, ODHAV CIRCLE TO VASTRAL RING ROAD, SINGARVA, AHMEDABAD- 382430. Ahmedabad 382430",Commercial,ansassociates84@gmail.com,7600004898,PR/GJ/AHMEDABAD/AHMEDABAD CITY/AUDA/CAA01670/170218,Ahmedabad,17-02-2018
572,Vardhman Arize,Vardhman Infra Works,"A-1, RUDRA, NANBHAWADI KALUBHA ROAD Bhavnagar 364002",Commercial,vardhmaninfraworks@hotmail.com,9825592508,PR/GJ/BHAVNAGAR/BHAVNAGAR/Others/CAA01400/A1C/120319,Bhavnagar,23-01-2018
573,Elite Square,Vihav Builders,"22, Greenwoods,Gotri-sevasi road New Alkapuri Vadodara 390021",Commercial,sagrawal914@gmail.com,9898610114,PR/GJ/VADODARA/VADODARA/Others/CAA02484/240418,Vadodara,24-04-2018
574,ORBIT,SVP BUILDCON LLP,"SUNBUILDERS TRANSITION SPACE, OPP. SATYAM CORPORATE SQUARE, SINDHUBHAVAN ROAD BODAKDEV Ahmedabad 380059",Commercial,orbitsvp2017@gmail.com,9227219595,PR/GJ/AHMEDABAD/AHMADABAD CITY/AUDA/CAA00193/200917,Ahmedabad,20-09-2017
575,EARTH ALPHA,BEACON REALTY,"EARTH ALPHA, OPP.NILAMBAR 1 VASNA BHAYLI ROAD Vadodara 390007",Commercial,earthalpha@yahoo.com,9033962664,PR/GJ/VADODARA/VADODARA/Others/CAA02406/190418,Vadodara,19-04-2018
576,K P EPITOME,KISH DEVELOPERS,"1004-1005, Shapath-V, Opp. Karnavati Club, S.G. Highway, Vejalpur, Ahmedabad 380051",Commercial,legal@kpinfra.com,9979857381,PR/GJ/AHMEDABAD/AHMEDABAD CITY/AUDA/CAA04204/A1C/100220,Ahmedabad,01-12-2018
577,SANGATH PLUS,MANPASAND INFRATECH,"25, Swagat Mahal, Near Swagat Status 2, Sabarmati, Ahmedabad Ahmedabad 380005",Commercial,bhavin.sangath@gmail.com,9879706060,PR/GJ/AHMEDABAD/AHMEDABAD CITY/AUDA/CAA03576/041018,Ahmedabad,04-10-2018
578,AKSHAR SQUARE,SHREE RAM CORPORATION,"AKSHAR SQUARE, FP 35, TP 35, DABHOLI KATARGAM, SURAT Surat 395009",Commercial,srcorp9954@gmail.com,9825523036,PR/GJ/SURAT/SURAT CITY/SUDA/CAA01826/EX2/080620,Surat,03-03-2018
579,Simandhar Sthapak,Sthapak Builders,"501, Setu Courtyard, Near Jalaram Temple, Paldi Ahmedabad 380007",Commercial,sthapakbuilders@gmail.com,9727131615,PR/GJ/AHMEDABAD/AHMEDABAD CITY/AUDA/CAA01669/170218,Ahmedabad,17-02-2018
580,Vardhman Enclave,Mahesh Badani,24/8-9 Satyanarayana Road Kalubha Road Bhavnagar 364002,Commercial,mdbadani@gmail.com,9825205494,PR/GJ/BHAVNAGAR/BHAVNAGAR/Others/CAA01651/EX1/A1C/150620,Bhavnagar,16-02-2018
581,VED ARCADE,TATVA DEVELOPERS,"1, VRAJ-VIHAR APARTMENT, GOPAL SOCIETY-2 BHIRAVNATH ROAD, MANINAGAR Ahmedabad 380008",Commercial,rudrabuildcon@yahoo.com,9924450242,PR/GJ/AHMEDABAD/AHMEDABAD CITY/AUDA/CAA02797/020618,Ahmedabad,02-06-2018
582,SHYAMJYOT BUSINESS PARK,OMKARA INFRASTRUCTURE,"19, Sneh Sukun Avenue, Kankaria, Ahmedabad - 380028 Ahmedabad 380028",Commercial,shyamjyotbusinessrera@gmail.com,9978955251,PR/GJ/AHMEDABAD/AHMEDABAD CITY/AUDA/CAA02386/A1C/250419,Ahmedabad,16-04-2018
583,AAGAM VIVIANNA,kshitij,"SKIP FLOOR, POOJA ABHISHEK COMPLEX, ATHWALINE SURAT-395007 SURAT Surat 395007",Commercial,aagamvivianna@gmail.com,9825149990,PR/GJ/SURAT/SURAT CITY/SUDA/CAA01143/A1C/220219,Surat,29-12-2017
584,ZIRCON PLUS,RUCHI ENTERPRISE,"ZIRCON PLUS,OPP-AVALON BUSINESS HUB AMABATALAVDI,KATARGAM Surat 395004",Commercial,zirconplus02@yahoo.com,9825149015,PR/GJ/SURAT/SURAT CITY/SUDA/CAA01083/211217,Surat,21-12-2017
585,SATYAMEV ELITE,SATYAMEV ELITE,"B-501, SATYAMEV COMPLEX OPP, NEW GUJARAT HIGH COURT Ahmedabad 380060",Commercial,rishildevelopers@hotmail.com,9925038850,PR/GJ/AHMEDABAD/AHMEDABAD CITY/AUDA/CAA03112/070718,Ahmedabad,07-07-2018
586,STAR PLATINUM,SILVER DEVELOPERS,"SHOP NO 122 C1 AND 125, SHUBH COMPLEX, SURVEY NO 30/1, ZANZARDA ROAD Junagadh 362001",Commercial,sureshpatel386@gmail.com,9925333453,PR/GJ/JUNAGADH/JUNAGADH/Others/CAA02462/230418,Junagadh,23-04-2018
587,ANJANEYA PRIME,ANJANEYA DEVELOPERS,S/3-A THIRD FLOOR TRADE CENTER KALANALA BHAVNAGAR Bhavnagar 364002,Commercial,anjaneyadevelopers123@gmail.com,9825188909,PR/GJ/BHAVNAGAR/BHAVNAGAR/Others/CAA05171/300319,Bhavnagar,30-03-2019
588,Pramukh Mastana,PRAMUKH MASTANA ASSOCIATES,"Survey No 59 Paikee, Dholakua, Post Sargasan, Gandhinagar 382421",Commercial,pmarcade59@gmail.com,9904083788,PR/GJ/GANDHINAGAR/GANDHINAGAR/Others/CAA04698/A1C/EX1/220421,Gandhinagar,19-01-2019
589,SHAIVAL IMPERIA,SHAIVAL COMCON LLP,"201, SHAIVAL PLAZA, NR GUJARAT COLLEGE ELLISBRIDGE Ahmedabad 380006",Commercial,sunnypshah76@gmail.com,9825409390,PR/GJ/AHMEDABAD/AHMEDABAD CITY/AUDA/CAA00453/EX1/180619,Ahmedabad,14-10-2017
590,Harikrishna Arcade,Ghanshyam Varsani,"1, Uday Nagar, Street no. 20 B/h Moonlight Marble, 150ft Ring Road Rajkot 360004",Commercial,harikrishna.arcade@gmail.com,9429472127,PR/GJ/RAJKOT/RAJKOT/Others/CAA03943/021118,Rajkot,02-11-2018
591,VIP INDUSTRIAL SHED B,SWARA CONSTRUCTION,PLOT NO 218 STREET NO 17 HILL TOP SOCIETY NEAR WATER TANK KALIYABID Bhavnagar 364002,Commercial,ravipatel9937@yahoo.in,9825206868,PR/GJ/BHAVNAGAR/BHAVNAGAR/Others/CAA04687/170119,Bhavnagar,17-01-2019
592,VIP INDUSTRIAL SHED A,SWARA CONSTRUCTION,PLOT NO 218 HILLTOP SOCIETY NEAR WATER TANK KALIYABID Bhavnagar 364001,Commercial,ravipatel9937@yahoo.in,9825206868,PR/GJ/BHAVNAGAR/BHAVNAGAR/Others/CAA04672/110119,Bhavnagar,11-01-2019
593,PRISM,SIGMA RUDRA INFRASTRUCTURE,"Opp,Manan Bajaj,Nr.Dahyabhai Park Society BRTS Road,Kankaria Ahmedabad 380021",Commercial,kipl2901@yahoo.in,9898020202,PR/GJ/AHMEDABAD/AHMEDABAD CITY/Others/CAA03935/021118,Ahmedabad,02-11-2018
594,VIBRANT MALL,KAMDHENU ENTERPRISE,124 TP58 FP25/6 Opp D Mart Bamroli Althan Road Surat 394210,Commercial,vrundavancorp@gmail.com,9227923629,PR/GJ/SURAT/SURAT CITY/SUDA/CAA03043/290618,Surat,29-06-2018
595,Artemus 2,RAJUL PROJECTS LLP,"207, Turquoise, Panchvati Cross Roads C G Road Ahmedabad 380006",Commercial,rera@ratnagroup.co.in,9427022214,PR/GJ/AHMEDABAD/AHMEDABAD CITY/AUDA/CAA01474/EX1/260919,Ahmedabad,01-02-2018
596,Sahitya Business park,Om Organizers,"Sahitya Business Park, Sr. No. 43/4, TP 111, FP (88+89)/4 Near S. P. Ring Road, Nikol Ahmedabad 382350",Commercial,omorganizers123@gmail.com,9925013710,PR/GJ/AHMEDABAD/AHMEDABAD CITY/AUDA/CAA03475/240918,Ahmedabad,24-09-2018
597,CITY GOLD PLAZA,SHIVAM BUILD CORN,"STREET NO. 2 KOTECHA NAGAR, KALAWAD ROAD Rajkot 360001",Commercial,shivambuildcorn.rera@gmail.com,9898984081,PR/GJ/RAJKOT/RAJKOT/Others/CAA02925/150618,Rajkot,15-06-2018
598,Shivaay Enclave,Shree Mahakaal Developers,"SN 82/1/2 OPp Excise police chowky Saijpur Bogha , Naroda Road Ahmedabad 382345",Commercial,shivaayenclave@gmail.com,9824019908,PR/GJ/AHMEDABAD/AHMEDABAD CITY/AUDA/CAA03202/200718,Ahmedabad,20-07-2018
599,R K PRIME,NARESH ORGANISERS PRIVATE LIMITED,OPP MASJIT NEAR PARABAZAR DANAPITH RAJKOT Rajkot 360001,Commercial,rkprimerera@gmail.com,9824040679,PR/GJ/RAJKOT/RAJKOT/Others/CAA01988/130318,Rajkot,13-03-2018
600,Shalin Square,Adinath Infrastructure,"274, Manekbaug Society, Lane No.22, Nr. Manekbaug Hall, Ambawadi,Ahmedabad Ahmedabad 380015",Commercial,account@adsapl.in,9825019881,PR/GJ/AHMEDABAD/AHMEDABAD CITY/AUDA/CAA00763/A2C/EX1/080622,Ahmedabad,18-11-2017
601,323 CORPORATE PARK,AEON BUILDCON LLP,"CS 001/1, BASEMENT, MANSI APPARTMENT, USMANPURA Ahmedabad 380013",Commercial,aeonbuildconllp@gmail.com,9825606035,PR/GJ/AHMEDABAD/AHMEDABAD CITY/AUDA/CAA00597/EX3/A1C/161121,Ahmedabad,06-11-2017
602,TIMES SHOPPERS,RUGVED ENTERPRISE,"BLOCK NO. 73/A, T.P. NO. 38 (NANA VARACHHA) BESIDE AMIRAS HOTEL, SARTHANA JAKATNAKA Surat 395006",Commercial,brijyug8792@gmail.com,9377547434,PR/GJ/SURAT/SURAT CITY/SUDA/CAA02360/130418,Surat,13-04-2018
603,Tapas Elegance,Tapas Elegance LLP,"C/o Environs, F-03, Anand Complex, Opp. Shilp Complex, C. G Road, Ahmedabad 380009",Commercial,tapaselegancellp@gmail.com,9327566428,PR/GJ/AHMEDABAD/AHMEDABAD CITY/AUDA/CAA01036/EX1/180220,Ahmedabad,16-12-2017
604,CLUB 100 EMPIRE,CLUB 100 TRADECORP LLP,504 EXITTO COMMERCIAL HUB JAHANGIRPURA Surat 395005,Commercial,ca.himanshu1187@gmail.com,8866110777,PR/GJ/SURAT/CHORASI/SUDA/CAA01352/190118,Surat,19-01-2018
605,SETU SQUARE,SETU CONSTRUCTION,"SETU SCARLET, VISAT- GANDHINAGAR HIGHWAY, CHANDKHEDA, AHMEDABAD. Ahmedabad 382424",Commercial,chiloda.square@gmail.com,9825091801,PR/GJ/GANDHINAGAR/GANDHINAGAR/Others/CAA00731/161117,Gandhinagar,16-11-2017
606,Gala Hub ANX,Gala Builders,Safal Profitaire 9 th Floor Near Prahaladnagar Garden Corporate Road Ahmedabad 380015,Commercial,galahubanx@galainfra.com,8980977777,PR/GJ/AHMEDABAD/DASKROI/AUDA/CAA01015/A1C/300319,Ahmedabad,13-12-2017
607,PUSHKAR ICON,Param Developers,"23 Sardar Bunglows, Near Diamond mill Bapunagar Ahmedabad 382350",Commercial,pushkariconrera@gmail.com,9825042705,PR/GJ/AHMEDABAD/AHMEDABAD CITY/AUDA/CAA00947/A1C/010619,Ahmedabad,08-12-2017
608,SHLOK INFINITY,SHLOK PROPERTIES,"C/303-A,GANESH MERIDIAN S.G.HIGHWAY,SOLA Ahmedabad 380060",Commercial,shlokinfinity123@gmail.com,9898020152,PR/GJ/AHMEDABAD/AHMEDABAD CITY/AUDA/CAA00881/041217,Ahmedabad,04-12-2017
609,SUMERU CITY MALL PHASE-2,DIVYAM DEVELOPERS,"BLOCK NO. 205,206,207 MOTA VARACHHA Surat 394101",Commercial,janakdavariya9@yahoo.in,9925644044,PR/GJ/SURAT/SURAT CITY/SUDA/CAA04642/090119,Surat,09-01-2019
610,Pushti Crossroads,Pushti Cityscapes,"101 F.F. City Square Science City Road, Sola, Ahmedabad Ahmedabad 380060",Commercial,pushticityscapes@gmail.com,9374605574,PR/GJ/AHMEDABAD/AHMEDABAD CITY/AUDA/CAA01677/EX2/040322,Ahmedabad,17-02-2018
611,DEVBHUMI COMPLEX,VALLABHBHAI B LUNAGARIYA,RANCHHOD NAGAR SHERI NO 7 VEKARIYA ROAD Rajkot 360003,Commercial,devbhumicomplex@gmail.com,9427720955,PR/GJ/RAJKOT/RAJKOT/Others/CAA03176/180718,Rajkot,18-07-2018
612,Colour Stone,RADHE KRISHNA DEVELOPERS,"Colour Stone, Opp. Kalupur Commercial Co-operative Bank Nr. Inductotherm Limited, Bopal Road, Bopal, Ahmedabad Ahmedabad 380058",Commercial,sagar9314511@gmail.com,9974592040,PR/GJ/AHMEDABAD/DASKROI/AUDA/CAA02855/070618,Ahmedabad,07-06-2018
613,sanand square project,Sanand Square Project,"opp hajari mata temple viramgam road,sanand Ahmedabad 382110",Commercial,sanandsquareproject@gmail.com,9898047272,PR/GJ/AHMEDABAD/SANAND/AUDA/CAA06849/060320,Ahmedabad,06-03-2020
614,BANDHAN ARCADE,BANDHAN DEVELOPERS,"BANDHAN ARCADE,MEGHRAJ ROAD MODASA Aravalli 383315",Commercial,bandhanarcademodasa@gmail.com,9099696133,PR/GJ/ARAVALLI/MODASA/Others/CAA04031/151118,Aravalli,15-11-2018
615,VASHISTH VANIJYAM,MAITRY DEVELOPERS,"G-2, NAND JASHODA COMPLEX, NEAR R. K. CYCLE STORE, MOTA BAZAR, VALLABH VIDHYANAGAR Anand 388120",Commercial,dev6816@gmail.com,9824121582,PR/GJ/ANAND/ANAND/Others/CAA04515/291218,Anand,29-12-2018
616,Oberon,Sartha Building Co.,"R.S.NO.84, t.P. NO.13, F.P. NO.65,New Citylight Road, Beside Eco Futurz,Bharthana Surat 395017",Commercial,suken9@gmail.com,9825137557,PR/GJ/SURAT/SURAT CITY/SUDA/CAA01191/030118,Surat,03-01-2018
617,@ EIGHT,Arista Infrastructure,"901 to 904, Arista Business Space Sindhubhavan Road,Bodakdev,Ahmedabad Ahmedabad 380054",Commercial,aristabuildcon@gmail.com,9825060168,PR/GJ/AHMEDABAD/AHMEDABAD CITY/AUDA/CAA01750/230218,Ahmedabad,23-02-2018
618,DHARM PLAZA BUSINESS HUB,SHIV DEVELOPERS,DHARM PLAZA BUSINESS HUB NIKOL Ahmedabad 382350,Commercial,nkhirpara96@gmail.com,9033577880,PR/GJ/AHMEDABAD/AHMEDABAD CITY/AUDA/CAA02379/160418,Ahmedabad,16-04-2018
619,Sanay Caremark,SANAY INFRASTRUCTURE LLP,"274/1 Nr Nilkanth Duplex Opp Ratnraj Duplex,Chandkheda Ahmedabad Gujarat Ahmedabad 382415",Commercial,shairingirishkumar@gmail.com,9879134988,PR/GJ/AHMEDABAD/AHMEDABAD CITY/AUDA/CAA09554/251221,Ahmedabad,25-12-2021
620,WEST GATE,SWASTIK ENTERPRISE,"OFFICE NO.303, NAKSHTRA-1, 150 FEET RING ROAD CORNER, AMIN MARG, Rajkot 360005",Commercial,darshan.malani@gmail.com,9427213012,PR/GJ/RAJKOT/RAJKOT/Others/CAA01649/EX1/200219,Rajkot,16-02-2018
621,SANGAM SAPPHIRE,PARTH CORPORATION,"47-48, DHANJIKAKA NAGAR, OPP. : SAYONA CITY, R.C. TECHNICAL ROAD, CHANDLODIYA Ahmedabad 382481",Commercial,parthcorporation14@gmail.com,9825116007,PR/GJ/AHMEDABAD/AHMEDABAD CITY/AUDA/CAA00962/081217,Ahmedabad,08-12-2017
622,H R STONE,HIRENKUMAR PATEL PROPRIETOR OF H. R. DEVELOPERS,"OPP. MARUTI TWINS, NR KRISHNA ARCADE 80 FEET ROAD ANAND Anand 388001",Commercial,hrprime1234@gmail.com,9825100501,PR/GJ/ANAND/ANAND/Others/CAA03378/A1C/040419,Anand,07-09-2018
623,Swagat Texking,SWAGAT DEVELOPER,"G/17, Nariman Shopping Center, Citylight Road, Parle Point Surat Surat 395007",Commercial,swagattexking1@gmail.com,9925122213,PR/GJ/SURAT/CHORASI/SUDA/CAA01081/EX2/281024/290625,Surat,21-12-2017
624,VARDAN TEXTILE MARKET,m s corporation,"OPP. SAMRAT VIDHYALAY, CANAL ROAD DUMBHAI, PARVAT PATIYA, SURAT Surat 395010",Commercial,vardanmarket@gmail.com,9974011111,PR/GJ/SURAT/SURAT CITY/SUDA/CAA02902/A1C/140921,Surat,13-06-2018
625,kraft 7,krupa construction,"1 kunj bunglows,opp.municipal corporation office science city road,sola Ahmedabad 380060",Commercial,kraft7gota@gmail.com,7600064084,PR/GJ/AHMEDABAD/AHMEDABAD CITY/AUDA/CAA01414/240118,Ahmedabad,24-01-2018
626,SAFAL-1 INDUSTRIAL ESTATE,SHREEJI BUILDCON,"SAFAL-1 INDUSTRIAL ESTATE OPP.ZAWERI ESTATE,KATHWADA-SINGARVA ROAD,KATHWADA. Ahmedabad 382430",Commercial,safal1rera@gmail.com,9157525850,PR/GJ/AHMEDABAD/DASKROI/AUDA/CAA02746/300518,Ahmedabad,30-05-2018
627,SHIV ESTATE,SHIVAM DEVLOPERS,"A-14, SHAUM APPARTMENT B/H CHATRABHUJ HOSPITAL, SHAHIBAUG Ahmedabad 380004",Commercial,rajubhaistar@gmail.com,9574560065,PR/GJ/AHMEDABAD/AHMEDABAD CITY/AUDA/CAA05230/090419,Ahmedabad,09-04-2019
628,GOLDEN HEIGHTS,GOLDENHUB BUILDSPACE PRIVATE LIMITED,"PLOT NO 78, FIRST FLOOR, SECTOR-1/A, GANDHIDHAM Kutch 370201",Commercial,paresh.vanshbuilders@gmail.com,9825225557,PR/GJ/KUTCH/GANDHIDHAM/Others/CAA03434/170918,Kutch,17-09-2018
629,RISHABH ARCADE,SHREE RISHABH BUILDSPACE PRIVATE LIMITED,"PLOT NO. 345, WARD 12- B BEHIND YES BANK, GANDHIDHAM Kutch 370201",Commercial,rishabharcaderera@gmail.com,9825228714,PR/GJ/KUTCH/GANDHIDHAM/Others/CAA06943/220420,Kutch,22-04-2020
630,CITY HEART,Rudra Developers,"316, 3rd Floor, Avalon The Commercial Hub, Ambatalawadi, Katargam, Surat Surat 395004",Commercial,rudradevelopers90@gmail.com,9824180801,PR/GJ/SURAT/SURAT CITY/SUDA/CAA01965/EX1/211219,Surat,12-03-2018
631,UNITED CITY,RADHE BUILDSPACE LLP,"D-1007,ASHIRWAD PALACE,BHATAR ROAD NEAR JIVKORNAGAR,BHATAR SURAT CITY Surat 395007",Commercial,admin@unitedcity.in,9725615162,PR/GJ/SURAT/CHORASI/SUDA/CAA03546/290918,Surat,29-09-2018
632,JYOTI BUSINESS CENTER,MEHULKUMAR DUNGARSHIBHAI KAKADIYA PROPRIETOR OF JENNY DEVELOPERS,"31-32, Shreeramnagar Soc., Hirabaug Circle Surat 395009",Commercial,jennydevelopers@bpshah.com,9913820812,PR/GJ/SURAT/SURAT CITY/SUDA/CAA02751/300518,Surat,30-05-2018
633,VELOCITY,AAGAM INFRA,"TP NO. 31, FP NO. 102-103, OPP. WOOD SQUARE LP SAVANI ROAD, ADAJAN Surat 395009",Commercial,chintan8009patel@gmail.com,9925018126,PR/GJ/SURAT/SURAT CITY/SUDA/CAA03653/A1C/260419,Surat,10-10-2018
634,GAJANAN INDUSTRIAL ESTATE 2,VINAY ENTERPRISE,"GAJANAN INDUSTRIAL ESTATE-2 OPP. BHAGIRATHAVILLA, B/H. ZAVERI ESTATE, SINGARVA - KATHWADA ROAD, KATHWADA, AHMEDABAD . Ahmedabad 382415",Commercial,gajananind.estate2@gmail.com,9727204060,PR/GJ/AHMEDABAD/AHMEDABAD CITY/AUDA/CAA02621/090518,Ahmedabad,09-05-2018
635,RAJ HARMONY,PUSPA ASSOCIATES,"PLOT NO.79, T.P. -5, OPP. BHAGWAN MAHAVIR COLLEGE VESU Surat 395007",Commercial,harmonyra2018@gmail.com,9979112026,PR/GJ/SURAT/SURAT CITY/SUDA/CAA03480/A1C/291020,Surat,24-09-2018
636,MD'S DREAM LANDMARK,DREAMLAND CORPORATION,201 202 MD PALACE NR JAMNANAGAR BUS STAND GHODDOD ROAD Surat 395007,Commercial,landmarkempires@yahoo.in,9825118409,PR/GJ/SURAT/SURAT CITY/SUDA/CAA01076/EX2/EX3/061124/270625,Surat,21-12-2017
637,SANKALP SQUARE III,SANKALP IN,"SANKALP SQUARE, NR.KAMLA KAMDHENU HALL, DRIVE IN ROAD, GURUKUL, Ahmedabad 380052",Commercial,account@sankalponline.com,9825084606,PR/GJ/AHMEDABAD/AHMEDABAD CITY/AUDA/CAA01882/A1C/290720,Ahmedabad,06-03-2018
638,SAI SAPPHIRE SQUARE,SHRI MAHAVIR DEVELOPERS,"55, TIRUPATI COMPLEX DANAPITH, KALUPUR Ahmedabad 380002",Commercial,dewanibuildcon@gmail.com,9974022584,PR/GJ/AHMEDABAD/AHMEDABAD CITY/AUDA/CAA01696/A1C/160320,Ahmedabad,19-02-2018
639,REEGUS BUSINESS CENTRE,GOPALKUMAR DOKANIA,"97,NEHRU NAGAR,NEAR-ICHHANATH TEMPLE ATHWALINES,SURAT Surat 395001",Commercial,reegusbusinesscentre02@yahoo.com,9638938383,PR/GJ/SURAT/SURAT CITY/SUDA/CAA01524/A1C/EX1/060320,Surat,05-02-2018
640,Rotec Corner,Nilkanth Infra Project,"29/30 Madhuvan Park 80-fit road, Mavdi, Rajkot Rajkot 360004",Commercial,nilkanthproject@gmail.com,9913004132,PR/GJ/RAJKOT/RAJKOT/Others/CAA02822/EX2/A1C/230919,Rajkot,04-06-2018
641,RAJHANS MOTESSA,RAJHANS INFRACON (INDIA) PRIVATE LIMITED,"Rajhans Empire, Beside Le Meridien Hotel, Near Airport Dumas Road, Surat Surat 395007",Commercial,rajhans.golflink@gmail.com,9824253843,PR/GJ/SURAT/SURAT CITY/SUDA/CAA03532/EX2/EX1/010621,Surat,29-09-2018
642,RAJVI SHOPPING,RAJVI DEVELOPERS,"56, KAVITA ROW HOUSE, VALAK ROAD, SARTHANA JAKATNAKA, VARACHA ROAD Surat 395006",Commercial,rajvishopping01@gmail.com,9106653371,PR/GJ/SURAT/SURAT CITY/SUDA/CAA03980/061118,Surat,06-11-2018
643,RIDDHI COMPLEX,LAXMIKANT MAGAN DOBARIYA,"GOVINDNAGAR SOCIETY-3 KOTHARIYA ROAD,RAJKOT Rajkot 360002",Commercial,riddhicomplexrera@gmail.com,9724162929,PR/GJ/RAJKOT/RAJKOT/Others/CAA03517/270918,Rajkot,27-09-2018
644,3rd Eye Three,CALICA BUILDWELL PRIVATE LIMITED,"53, NIRANT PARK SOCIETY OPP SUN -N-STEP CLUB, Thaltej Ahmedabad 380054",Commercial,patel.calicagroup@gmail.com,9825062708,PR/GJ/AHMEDABAD/AHMEDABAD CITY/AUDA/CAA03118/EX1/080620,Ahmedabad,09-07-2018
