27 OF 2017 DATED 28.08.2017,HABITAT,PRIME INFRASTRUCTURE PVT. LTD,"99-A, VILLAGE DHANKOT, GURUGR
AM",GURUGRAM,152.6,218,41.4,300,168.8,22.9,70.5,25,48,0,16,0,0,357.1,5.95625 (Acre),22-01-2021,2,"IMPORTED STONE FLOORING IN LIVING & DINNING, WOODEN FLOORING IN BEDROOMS AND TILE IN TOILET, KITCHEN, UTILITY AREA AND BALCONY.",STONE COUNTER TOP WITH 2FEET HIGH CERAMIC TILES ABOVE THE COUNTER AND CERAMIC TILE ON FLOOR 396 X 396 MM.,DOOR FRAMES - WOODEN WINDOW FRAMES - UPVC.,NA,"TOTAL 17 NOS LIFTS , 07 ARE STRETCHER LIFTS AND 10 ARE PASSENGER LIFTS.",ISI MARKED,"PLASTIC EMULSION, OBD, ENAMEL & WHITE WASH."
186 OF 2017 DATED 14.09.2017,GROUP HOUSING COLONY,GATEVIDA DEVELOPERS PRIVATE LIMITED,"SECTOR 112/113, VILLAGE BAJGH
ERA, GURUGRAM",GURUGRAM,124.88,116.92,43.84,71.63,80.24,12.35,0,4.52,44.70,0,0,0,0,129.64,4.038 (Acre),15-02-2019,100,"MARBLE, LAMINATED WOOD, ENGINEERED WOOD, TILES","VITRIFIED TILE FLOORING, 600MM HIGH TILE DADO ON WALLS, STAINLESS STEEL SINK, EXHAUST FAN","EXTERNAL WINDOWS/DOORS –ALUMINIUM , INTERNAL DOORS WOODEN PAINTED/POLISHED DOOR FRAMES",MODULAR SWITCHES,BRANDED LIFTS,MODULAR SWITCHES,PLASTICEMULSION/ OBD PAINT
GGM/647/379/2022/122 DATED 20.12.2022,SAMSARA VILASA & SAMSARA ARYA,ADANI BRAHMA SYNERGY PRIVATE LIMITED,"PLOT NO. 83, SECTOR-32, GURUG
RAM",GURUGRAM,0,0,0,0,0,0,0,0,0,0,0,0,0,0,1.8256 (Acre),Not available,Not available,IMPORTED MARBLE/VITRIFIED TILES/CERAMIC TILES,MODULAR KITCHEN WITH HOB,ALUMINIUM DOORS & WINDOWS,MODULAR SWITCH & SOCKET,5/6 PASSENGERS,N.A.,EXTERNAL GRADE PAINT
GGM/410/142/2020/26 DATED 21.09.2020,"SOBHA CITY, PHASE-5",SOBHA LIMITED,"REVENUE ESTATE OF BABUPUR VIL
LAGE, VILLAGE BABUPUR, SECTOR-108, GURUGRAM, HARYANA",GURUGRAM,125.83,145.21,59.62,0,80.84,27.62,0,4.39,0,0,0,0,0,0,5.10183 (Acre),Not available,Not available,NATURAL / ENGINEERED STONE FLOORING AND SKIRTING/ LAMINATED WOODEN FLOORING AND SKIRTING / VITRIFIED TILE FLOORING AND SKIRTING /CERAMIC TILE.,"CERAMIC TILE FLOORING, WALL TILING & PLASTIC EMULSION PAINT FOR CEILING.",FRAME – TIMBER FRAME & SHUTTERS – WITH BOTH SIDE MASONITE SKIN.,FITTING OF REPUTED MAKE APPROVED BY ISI & IS SPECIFICATION.,CAPACITY - 1 NO. OF 15 PASSENGER & 2 NOS. OF 8 PASSENGER LIFT OF REPUTED MAKE.,NA,PLASTIC EMULSION PAINT FOR WALLS & CEILING.
GGM/506/238/2021/74 DATED 03.11.2021,SMARTWORLD ORCHARD,SUPOSHAA REALCON PRIVATE LIMITED,"SECTOR -61, GURUGRAM MANESAR
URBAN COMPLEX, GURUGRAM, HARYANA.",GURUGRAM,903.51,156.2,222.96,372.0,180.0,76.96,5.00,34.44,0,0,0,0,0,44.78,20.60902 (Acre),Not available,Not available,VITRIFIED TILE / LAMINATED WOODEN FLOORING / CERAMIC TILE,GRANITE COUNTER WITH SS SINK,HARDWOOD DOOR FRAME WITH LAMINATED FLUSH/WOODEN DOOR,AS PER APPROVED MAKE,4 TO 6 PASSENGER LIFTS AS PER NORMS,AS PER APPROVED MAKE,NA
GGM/604/336/2022/79 DATED 17.08.2022,WHITELAND BLISSVILLE,WHITELAND CORPORATION PRIVATE LIMITED,SECTOR- 76,GURUGRAM,117.83,114.67,103.94,0,54.80,0,0,3.11,0,0,0,0,0,116.52,1.9256 (Acre),Not available,Not available,NA,NA,NA,NA,NA,NA,NA
GGM/783/515/2024/10 DATED 07.02.2024,DE-LUXE DXP,SIGNATUREGLOBAL BUSINESS PARK PRIVATE LIMITED,"VILLAGE - GADAULI KALAN, SECT
OR-37D, GURUGRAM, HARYANA",GURUGRAM,550.00,553.40,311.00,0,316.74,52.00,0,20.00,0,0,0,0,0,0,16.65625 (Acre),Not available,Not available,MARBLE/VITRIFIED TILES/ PORCELEIN TILES,MARBLE/VITRIFIED TILES/ PORCELEIN TILES,ALUMINUM FRAMES WITH TOUGHENED GLASS,ISI MARKED,4 NOOF FLATES & 4 LIFTS,ISI MARKED,ACRYLIC EMULSION PAINT
GGM/414/146/2020/30 DATED 08.10.2020,SIGNATURE GLOBAL PARK V,SIGNATUREGLOBAL HOMES PRIVATE LIMITED,"VILLAGE HARIYAHARA, SECTOR-36",GURUGRAM,239.96,173.88,116.25,0,98.61,40.40,0,0,0,0,0,0,0,272.62,2.15 (Acre),Not available,Not available,NA,NA,"WOODEN(DOOR FRAME), ALUMINIUMN/UPVC(WINDOW FRAME)",ISI MARKED,ISI MARKED,ISI MARKED,NA
GGM/596/328/2022/71 DATED 27.07.2022,BIRLA NAVYA (ANAIKA),AVARNA PROJECTS LLP,SECTOR 63A GURUGRAM,GURUGRAM,0,0,0,0,0,0,0,0,0,0,0,0,0,0,8331.72 (Sqr/mtrs),Not available,Not available,MARBLE / STONE / TILES / ANTI-SKID TILES / LAMINATED / EQUIVALENT,TILES / PLASTIC PAINT / ACRYLIC EMULSION / EQUIVALENT,"WOODEN / EQUIVALENT DOOR FRAMES FOR MAIN/ INTERNAL DOORS, ANODISED / POWDER COATED FRAMES FOR EXTERNAL DOOR WINDOWS",LED FOR ONLY THE COMMON AREAS,1 COMMON LIFT / PLOT + 1 ADDITIONAL LIFT IN 4BHK AS/ LAYOUT,ISI MARKED FOR ONLY THE COMMON AREAS,NA
GGM/475/207/2021/43 DATED 17.08.2021,INDEPENDENT FLOORS AT DLF GARDENCITY SECTOR 91/92,DLF UTILITIES LIMITED,"DLF GARDENCITY, SECTOR 91/92,
GURUGRAM, HARYANA",GURUGRAM,0,0,0,0,0,0,0,0,0,0,0,0,0,0,1.096 (Acre),Not available,Not available,IPS FLOORING / TILES / GRANITE,WHITE WASH / OBD,MS / AL,MODULAR FITTINGS,BRANDED MAKE,MODULAR FITTING (AS PER RAJAN),AS PER STANDARDS
219 OF 2017 DATED 18.09.2017,2.9812 ACRES COMMERCIAL PROJECT,PLUS PROJECTS PVT. LTD,"SECTOR-62, GURUGRAM",GURUGRAM,48.26,130.36,21.37,200,20,3.75,150,0.86,0,0,0,0,0,0,0.92 (Acre),30-06-2019,100,"GRANITE IN OPEN COURTYARD , PASSAGE , CORRIDORS & STAIRS , VITRIFIED TILES FLOORING","MODULAR TYPE AND OZONE CHANNELS , FLOORING CERAMIC TILES",CHOKHAT FRAME & WINDOW SHUTTER OF SAG WAN AND POLISHABLE WOOD,"GEYSER , FAN",4 LIFT,"GEYSER , FAN",POP AND PAINT
254 OF 2017 DATED 03.10.2017,URBAN HOMES,PYRAMID INFRATECH PVT. LTD.,"SECTOR 70A, GURUGRAM",GURUGRAM,308.50,340.09,118.98,0,279.43,37.89,0,6.81,0,0,0,0,0,0,9.875 (Acre),15-02-2020,100,I PS FLOORING,STONE COUNTER WITH TILE,EXTERNAL D/W M S- Z SECTION,AS PER STANDARD,AS PER STANDARD,AS PER STANDARD,TEXTURE PAINT
GGM/731/463/2023/75 DATED 10.07.2023,SS LINDEN -IV,SS GROUP PRIVATE LIMITED,"SECTOR -85, GURUGRAM",GURUGRAM,79.79,123.42,18.54,200,20,13,5,8.92,160,0,0,0,0,0,6.8468 (Acre),Not available,Not available,NA,NA,NA,NA,NA,NA,NA
GGM/598/330/2022/73 DATED 01.08.2022,WHITELAND BLISSVILLE,WHITELAND CORPORATION PRIVATE LIMITED,SECTOR- 76,GURUGRAM,117.83,114.67,103.94,0,153.6,16.85,0,3.11,0,0,0,0,0,116.52,7.3187 (Acre),Not available,Not available,NA,NA,NA,NA,NA,NA,NA
GGM/518/250/2021/86 DATED 20.12.2021,THE MILLENNIA-IV,STERNAL BUILDCON PRIVATE LIMITED,"VILLAGE GADAULI KALAN, SECTOR
37D, GURUGRAM-MANESAR, DIST. GURUGRAM, HARYANA",GURUGRAM,117.36,164.52,63.5,0,173.42,18.08,0,16.34,0,0,0,0,0,0,5.89 (Acre),Not available,Not available,VITRIFIED & CERAMIC TILES,ISI MARKED,"WOODEN (DOOR FRAME), MS / ALUMINIUMN/ UPVC (WINDOW FRAME)",ISI MARKED,ISI MARKED,ISI MARKED,NA
GGM/586/318/2022/61 DATED 04.07.2022,SS LINDEN RESIDENTIAL FLOORS - II,SS GROUP PRIVATE LIMITED,"SS LINDEN, SECTOR-84",GURUGRAM,0,0,0,0,0,0,0,0,0,0,0,0,0,0,1.8511 (Acre),Not available,Not available,ITALIAN MARBLE & VITRIFIED TILES,GLAZED 600MM HIGH TILES ABOVE COUNTER LEVEL & BALANCE ACRYLIC PAINT,SOLID HARDWOOD / UPVC FRAMES,MODULER TYPE,01 NO PASSENGER WITH 06 PERSONS CAPACITY,MODULER TYPE,ACRYLIC EMULSION PAINT
GGM/851/583/2024/78 DATED 30.07.2024,SIGNATURE GLOBAL PROXIMA-1 EXTN.,SIGNATUREGLOBAL (INDIA) LIMITED,"VILLAGE - HAYATPUR, SECTOR -8
9, GURUGRAM, HARYANA",GURUGRAM,6.77,47.25,12.91,0,10.42,3.08,0,0.73,0,0,0,0,0,0,0.44375 (Acre),Not available,Not available,VITRIFIED & CERAMIC TILES,OPEN KITCHEN,"WOODEN DOOR FRAME,ALUMINIUM/UPVC WINDOW",ISI MARKED,OTIS/FUGITE CH/EQUIVALENT,ISI MARKED,NA
GGM/443/175/2021/11 DATED 15.03.2021,INDEPENDENT FLOORS AT DLF GARDENCITY SECTOR 91/92,DLF UTILITIES LIMITED,"DLF GARDEN CITY, SECTOR 91 /
92,",GURUGRAM,0,0,0,0,0,0,0,0,0,0,0,0,0,0,0.969 (Acre),Not available,Not available,IPS FLOORING / TILES / GRANITE,WHITE WASH / OBD,MS / AL DOORS AND WINDOWS,MODULAR FITTINGS,BRANDED MAKE,MODULAR FITTING,NA
GGM/456/188/2021/24 DATED 15.06.2021,INDEPENDENT FLOORS AT DLF GARDENCITY SECTOR 91/92,DLF RESIDENTIAL PARTNERS LIMITED,"DLF GARDENCITY, SECTOR 91 / 9
2,",GURUGRAM,0,0,0,0,0,0,0,0,0,0,0,0,0,0,1.047 (Acre),Not available,Not available,IPS FLOORING / TILES / GRANITE,WHITE WASH / OBD,MS / AI,MODULAR FITTINGS,BRANDED MAKE,MODULAR FITTINGS,NA
GGM/626/358/2022/101 DATED 21.11.2022,ELAN THE PRESIDENTIAL,ELAN AVENUE LIMITED (FORMERLY KNOWN AS AIRMID DEVELOPERS LIMITED),"SITUATED IN SECTOR 106 IN THE
REVENUE ESTATE OF VILLAGE PAWALA KHUSRUPUR TEHSIL KADIPUR DISTRICT GURUGRAM, HARYANA",GURUGRAM,30.79,65.95,54.91,200,15.33,12.00,67.5,186.82,0,0,24.00,133.37,0,0,12.767 (Acre),Not available,Not available,"VITRIFIED TILE, LAMINATE WOODEN FLOORING",SINGLE LEVER COUNTER TOP,FULL HEIGHT WINDOWS- ALUMINIUM PODER COATED SECTIONS AND WOODEN FRAME WITH FLUSH DOOR WITH VENEER FINISH (ON BOTH SIDES) & ARCHITRAVES,FAN AND ELECTRIC POINT,4 LIFTS IN ONE TOWER,"HEAVY DUTY CONDUTING MODULAR SWITCHES, C CURVE MCB",PREMIUM ACRYLIC DISTEMPER
GGM/648/380/2022/123 DATED 20.12.2022,SAMSARA AVASA,ADANI BRAHMA SYNERGY PRIVATE LIMITED,"BLOCK-L, SECTOR-63, VILLAGE-U
LLAHAWAS",GURUGRAM,0,0,0,0,0,0,0,0,0,0,0,0,0,0,1.2296 (Acre),Not available,Not available,IMPORTED MARBLE/VITRIFIED TILES/CERAMIC TILES,MODULAR KITCHEN WITH HOB,ALUMINIUM DOORS & WINDOWS,MODULAR SWITCH & SOCKET,5/6 PASSENGERS,N.A.,EXTERNAL GRADE PAINT
GGM/670/402/2023/14 DATED 16.01.2023,GODREJ ICON TOWER 4/E AND TOWER 5/F,OASIS LANDMARKS LLP,SECTOR 88A & 89A,GURUGRAM,76.49,54.73,39.93,0,21.13,12.63,33.75,12.14,0,0,7.33,0,0,0,1.424625 (Acre),31-12-2029,0,"VITRIFIED TILE OR EQV. IN LIVING/DINING, WOODEN FLOORING OR EQV. IN BEDROOMS, ANTI-SKID TILES OR EQV. IN TOILETS, KITCHEN, BALCONY & UTILITY",GRANITE COUNTER WITH SINK AND CP FITTINGS,"TEAK FRAME IN MAIN DOOR, RED MERANDI/ FLUSH DOOR IN INTERNAL DOORS, ALUMINIUM OR EQ. FRAME WITH GLASS FOR WINDOWS & SLIDING DOOR WINDOWS",PHILLIPS OR EQUIVALENT LED LIGHTS IN COMMON AREA,STONE ARCHITRAVE AND ITALIAN MARBLE/STONE FLOORING IN CAR BODY AND GRANITE CLADDING,LED LIGHTS IN COMMON AREA,AS MENTIONED BELOW
GGM/785/517/2024/12 DATED 09.02.2024,THE ESTATE RESIDENCES,ANANT RAJ LIMITED,SECTOR 63A GURUGRAM,GURUGRAM,86,70,80,850,90,10,400,15,0,0,60,0,0,244,5.43263 (Acre),Not available,Not available,TILES/MARBLES/GRANITE/LAMINATED WOOD,"MODULAR KITCHEN WITH APPLIANCES AS PER POINT 6.6 IN UNIT WISE SPECIFICATION, CABINE TRY AND SS SINK",MS/UVC/AL/WOOD/COMPOSITE MATERIAL,NA,BRANDED MAKE,"SWITCH BOX AND SOCKETS, HOME AUTOMATION IN SELECT AREAS AS PER DESIGN",NIL
GGM/801/533/2024/28 DATED 18.03.2024,PREMIER FLOORS,JMS INFRA REALITY PVT. LTD.,"SECTOR 95, VILLAGE-WAZIRPUR",GURUGRAM,0,0,0,0,0,0,0,0,0,0,0,0,0,0,937 (Sqr/mtrs),Not available,Not available,CERAMIC / VITRIFIED TILES,CERAMIC TILES,"FLUSH DOORS, ALUMINIUM/UPVC","ISI MARK, COPPER & ALUMINIUM",NA,ISI MARK,PAINT
137 OF 2017 DATED 28.08.2017,GREEN COURT,ASTER INFRAHOME PVT. LTD.,"SECTOR-90, VILLAGE- HAYATPUR,
GURUGRAM",GURUGRAM,192.12,279.54,131.21,0,258.27,38.41,0,7.80,20,1500,0,20,0,0,10.0125 (Acre),15-05-2020,15,CERAMIC TILES/ VITRIFIED TILES,NON MODULAR,HARDWOOD DOOR FRAMES WITH FLUSH PANEL/FLUSH DOOR/SKIN DOOR,ISI MARKED,2 IN EACH TOWER,ISI MARKED,DISTEMPER
367 OF 2017 DATED 24.11.2017,IREO SKYON,IREO PVT.LTD.,"SECTOR -60, VILLAGE ULLHAWAS,
GURUGRAM,HARYANA",GURUGRAM,0,0,0,0,0,0,0,0,0,0,0,0,0,0,0.695 (Acre),Not available,Not available,N.A,N.A,N.A,N.A,N.A,N.A,N.A
44 OF 2017 DATED 11.08.2017,"ASHIANA MULBERRY PHASE 1[TOWER 1,2, 3 & EWS]",ASHIANA DWELLINGS PVT. LTD.,"SEC 2, SOHNA, GURUGRAM",GURUGRAM,64,54,80,377,120,25,85,57,0,0,0,0,0,30,3.15 (Acre),30-06-2020,48,AS PER SCHEDULED SPECIFICATION AND FEATURES,AS PER SCHEDULED SPECIFICATION AND FEATURES,AS PER SCHEDULED SPECIFICATION AND FEATURES,AS PER SCHEDULED SPECIFICATION AND FEATURES,AS PER SCHEDULED SPECIFICATION AND FEATURES,AS PER SCHEDULED SPECIFICATION AND FEATURES,AS PER SCHEDULED SPECIFICATION AND FEATURES
190 OF 2017 DATED 14.09.2017,COMMERCIAL COLONY,ELAN BUILDCON PVT. LTD.,"SECTOR 84, VILLAGE HAYATPUR,
GURUGRAM",GURUGRAM,0,125,45,550,80,35,660,0,0,0,100,0,0,0,5.91875 (Acre),13-09-2023,42,VITRIFIED TILES,KITCHEN ATE COUNTER GRANITE & PLY CABINET WITH LAMINATE FINISH,WOODEN DOOR FRAMES ALUMINIUM FRAME WINDOWS,ABB/ L&T SCHNIDER,MITSUBISHI ( LIFT) OTLS ( ESCALATORS),NA,INTERNAL GRADE POINT
38 OF 2017 DATED 10.08.2017,2.425 ACRES COMMERCIAL COLONY,OJOS DEVELOPERS PVT. LTD.,"SECTOR 70, GURUGRAM",GURUGRAM,0,133.70,17.92,0,60.02,9.31,0,0,0,0,0,0,0,0,9813.611 (Sqr/mtrs),31-12-2020,100,BARE SHELL,NA,NA,NA,NA,NA,BARE SHELL
15 OF 2018 DATED 19.01.2018,10.5437 ACRES GROUP HOUSING COLONY,CHD DEVELOPERS LTD.,"SECTOR-71, GURUGRAM",GURUGRAM,Not available,Not available,Not available,Not available,Not available,Not available,Not available,Not available,Not available,Not available
119 OF 2017 DATED 28.08.2017,68 AVENUE,VSR INFRATECH PVT.LTD.,"VILLAGE BADSHAHPUR, SECTOR 68
,GURUGRAM",GURUGRAM,107.45,138.55,69.65,1055.00,165.00,26.20,110.00,620.00,600.00,67.79,0.00,0.00,0.00,4531.78,10.461 (Acre),31-12-2021,59.8,VITRIFIED TILES/CERAMIC/WOODEN FLOORING/ANTI-SKID,VITRIFIED/MARBAL/PAINT/BRANDED CP FITTINGS,FLUSH DOOR 32 MM,WIRE POLLYCAB/FILOLEX/HAVELLS NAD ABB,OTIS,ABB,APEX ASIAN
214 OF 2017 DATED 18.09.2017,5.09375 AFFORDABLE GROUP HOUSING COLONY,LOTUS REALTECH PVT. LTD,"SECTOR-111, GURUGRAM",GURUGRAM,252.44,68.20,56.29,250.00,128,19.53,100.25,5.92,46.44,250.00,18.92,0,0,318.11,5.09375 (Acre),31-12-2021,98,TILES,TILES UPTO 2 FEET HIGH ABOVE MARBLE COUNTER & OIL BOUND DISTEMPER IN BALANCE AREA,FLUSH DOORS SHUTTERS AND MS-Z SECTION WINDOWS,NOT PROVIDED,ONE IN EACH TOWER,NOT PROVIDED,OIL BOUND DISTEMPER
GGM/358/90/2019/52 DATED 20.09.2019,ULTIMA PHASE-II,DLF LIMITED,"VILLAGE LAKHNOLA, SECTOR 81,
GURUGRAM, HARYANA",GURUGRAM,1227,31,51,205,102,256,1102,51,1707,0,10,686,0,0,11.343 (Acre),30-11-2020,67,IPS FLOORING/ IMPORTED MARBLE,WHITE WASH/ TILES UP-TO 2’ ABOVE COUNTER & ACRYLIC EMULSION PAINT IN BALANCE AREA,"MS ANGLE & PRESSED MS DOOR FRAMES, MS Z-SECTION WINDOW FRAME, FLUSH DOOR SHUTTERS",MODULAR FITTINGS,OTIS,MODULAR FITTINGS,NA
GGM/427/159/2020/43 DATED 20.11.2020,SIGNATURE GLOBAL PARK-III,SIGNATUREGLOBAL HOMES PRIVATE LIMITED,"1309 13TH FLOOR DR. GOPAL DAS
BHAWAN 28 BARAKHAMBA ROAD NEW DELHI 110001",GURUGRAM,200.20,188.16,83.53,0,118.23,24.29,0,15.27,0,0,0,0,0,167.13,10.55625 (Acre),Not available,Not available,NA,NA,NA,NA,NA,NA,NA
GGM/553/285/2022/28 DATED 25.04.2022,BIRLA NAVYA (DRISHA 1B),AVARNA PROJECTS LLP,SECTOR 63A GURUGRAM,GURUGRAM,0,0,0,0,0,0,0,0,0,0,0,0,0,0,2908.1 (Sqr/mtrs),Not available,Not available,MARBLE / STONE / TILES / ANTI-SKID TILES / LAMINATED / EQUIVALENT,TILES / PLASTIC PAINT / ACRYLIC EMULSION / EQUIVALENT,"WOODEN / EQUIVALENT DOOR FRAMES FOR MAIN/ INTERNAL DOORS, ANODISED / POWDER COATED FRAMES FOR EXTERNAL DOOR WINDOWS",LED FOR ONLY THE COMMON AREAS,1 LIFT / PLOT,ISI MARKED FOR ONLY THE COMMON AREAS,ACRYLIC PAINT
GGM/704/436/2023/48 DATED 29.03.2023,M3M GOLF HILLS PHASE 1,LOON LAND DEVELOPMENT LIMITED,SECTOR 79/ 79B,GURUGRAM,1046.04,250.00,125.00,1080.00,250.00,110.00,595.00,70.00,0.00,0.00,0.00,0.00,0.00,1186.19,20.0438 (Acre),Not available,Not available,VITRIFIED TILES/LAMINATEDWOODEN FLOOR/CERAMIC TILE,NA,EXTERNAL ALUMINIUM WITH GLASSINTERNAL – WOODEN,AS PER APPROVED MAKE,LIFTS AS PER BUILDING PLANS,AS PER APPROVED MAKE,NA
GGM/861/593/2024/88 DATED 16.08.2024,THE LEGACY PHASE-I,SILVERGLADES HOMES LLP,"VILLAGE BEHRAMPUR, SECTOR 63A
, GURGAON",GURUGRAM,805.00,258.75,230,373.75,287.50,195.50,230.00,161.00,2570.34,0,460.00,0,0,172.50,9.950 (Acre),Not available,Not available,"COMBINATION OF LAMINATED WOODEN FLOORING , NATURAL STONE &TILES;","ANTISLIP VITRIFIED TILES;ACRYLIC EMULSION PAINT, GRANITE STONE COUNTER, SINGLE LEVER CP FITTINGS & DOUBLE BOWL SS SINK WITH DRAIN BOARD,HOB AND CHIMNEY, MODULAR KITCHEN CABINETRY",HARDWOOD DOOR FRAME FOR INTERNAL DOORS,MODULAR SWITCHES,12-18 PERSONS APPROX. EACH LIFT CAPACITY,MODULAR SWITCHES,"ACRYLIC EMULSION PAINT ON POP PUNNING, ACRYLIC EMULSION PAINT"
232 OF 2017 DATED 19.09.2017,10 ACRES (AFFORDABLE GROUP HOUSING PROJECT),GLS INFRATECH PVT.LTD,"SECTOR-4, KHAIKA, GURUGRAM",GURUGRAM,165,226.2,18.25,250.50,167,45,175,52,450,0,15.50,0,0,359,10 (Acre),10-04-2020,70,TILES,TILES,"PAINTED HARDWOOD WITH FLUSH DOOR, POWDER COATED UPVC DOOR/WINDOWS FRAME","USE OF ISI MARK PRODUCT OF SWITCHES, SOCKETS AND WIRES.",AS PER NBCC CODE,NA,OIL BOUND DISTEMPER
57(A) OF 2017 DATED 17.8.2017,M3M MARINA/M3M SIERRA 68 ( GROUP HOUSING COLONY),HANS PROPCON PVT. LTD,"SECTOR-68, GURUGRAM",GURUGRAM,616.56,432.32,563.88,1085.48,0,98.28,575.9,84.6,426.14,13.35,18.77,0,0,15.53,13.2118 (Acre),31-01-2022,36,VITRIFIED TILE/LAMINATED /CERAMIC TILE,NA,N.A.,BRANDED,NA,BRANDED,PLASTER WITH PAINT
36(A) OF 2017 DATED 05.12.2017,GURGAON GREENS,EMAAR MGF LAND LTD.,"SECTOR -102, VILLAGE DHANKOT,
GURUGRAM",GURUGRAM,261.06,132.27,127.00,55.90,94.15,110.95,460.32,500.21,415.96,53.31,22.70,49.45,0,0,13.531 (Acre),31-12-2019,100,VITRIFIED TILES / LAMINATED WOODEN FLOORING,NA,SEASONED HARDWOOD FRAME / UPVC,MODULAR SWITCHES,PROVIDED,MODULAR SWITCHES,NA
178 OF 2017 DATED 01.09.2017,AFFORDABLE GROUP HOUSING COLONY,PIVOTAL INFRASTRUCTURE PVT LTD,"SECTOR 62, ULLAHAWAS, GURUGRA
M",GURUGRAM,179.63,226.41,45.83,400,89.56,7.78,100,3.54,39.76,387.587,40,0,0,0,5.06875 (Acre),27-07-2021,45,TILES,TILES,PAINTED HARDWOOD WITH FLUSH DOOR AND POWDER COATED/ANODIZED ALUMINIUM FRAME WINDOWS,"USE OF ISI MARKED PRODUCTS FOR WIRING, SWITCHES AND CIRCUITS",SCHINDLER MAKE,NA,OBD
285 OF 2017 DATED 10.10.2017,SOVEREIGN PARK,VATIKA SOVEREIGN PARK PVT. LTD.,"SECTOR 99, GURUGRAM",GURUGRAM,186.61,55.29,69.11,103.67,62.20,41.47,13.82,34.56,0,0,0,0,0,0,21717.00 (Sqr/mtrs),30-03-2021,36,REFER SECTION BELOW,REFER SECTION BELOW,REFER SECTION 14,"IS COMPLIANT MODULAR SWITCHES / SOCKETS, SWITCH GEAR AND DISTRIBUTION BOXES FROM STANDARD MAKES AND BRAND.",SPACIOUS ELEVATORS WITH PLEASING INTERIORS. HIGH SPEED ELEVATORS FOR HIGH RISE TOWERS.,"IS COMPLIANT MODULAR SWITCHES / SOCKETS, SWITCHGEAR AND DISTRIBUTION BOXES FROM STANDARD MAKES AND BRAND.",REFER SECTION BELOW
186 OF 2017 DATED 14.09.2017,GROUP HOUSING COLONY,GATEVIDA DEVELOPERS PRIVATE LIMITED,"SECTOR 112/113, VILLAGE BAJGH
ERA, GURUGRAM",GURUGRAM,124.88,116.92,43.84,71.63,80.24,12.35,0,4.52,44.70,0,0,0,0,129.64,4.038 (Acre),15-02-2019,100,"MARBLE, LAMINATED WOOD, ENGINEERED WOOD, TILES","VITRIFIED TILE FLOORING, 600MM HIGH TILE DADO ON WALLS, STAINLESS STEEL SINK, EXHAUST FAN","EXTERNAL WINDOWS/DOORS –ALUMINIUM , INTERNAL DOORS WOODEN PAINTED/POLISHED DOOR FRAMES",MODULAR SWITCHES,BRANDED LIFTS,MODULAR SWITCHES,PLASTICEMULSION/ OBD PAINT
346 OF 2017 DATED 08.11.2017,"ENIGMA, PHASE-1",VARALI PROPERTIES LTD.,"SECTOR-110, VILLAGE PAWALA KH
USRUPUR, GURUGRAM, HARYANA",GURUGRAM,168.45,254.53,72.44,0,124.54,21.96,0,25.70,0,0,0,0,0,217.09,8.7 (Acre),31-12-2020,90,"ITALIAN/ EUROPEAN MARBLE, TILES / MARBLE",WALLS COMBINATION OF LACQUERED GLASS AND IMPORTED TILES FLOOR IMPORTED TILES DOORS AND WINDOWS TIMBER VENEERED AND ALUMINIUM OTHERS HIGH END EUROPEAN MODULAR KITCHEN,TIMBER VENEERED AND ALUMINIUM,"SWITCHES, WIRE, PANELS, GENSET",OTIS 4 PASSEGNER + 1 SERVICE LIFT IN EACH TOWER,SWITCHES,ACRYLIC WALL PAINT
GGM/455/187/2021/23 DATED 15.06.2021,DLF GARDENCITY,DLF UTILITIES LIMITED,"DLF GARDENCITY, SECTOR 91/92",GURUGRAM,303.97,41.77,51.83,327.83,29.24,0,0,415.21,0,0,0,0,0,0,16.25 (Acre),Not available,Not available,NA,NA,NA,NA,NA,NA,NA
53 OF 2017 DATED 17.08.2017,GODREJ OASIS,OASIS LANDMARKS LLP,"SECTOR 88-A & 89-A, HARSARU,
GURUGRAM",GURUGRAM,207.89,173.36,134.07,1368.39,134.07,0,164.89,4.17,0,0,0,0,0,0,4.40 (Acre),30-09-2019,100,VITRIFIED TILES IN LIVING DINING,KITCHEN FLOORING CERAMIC TILES,"""1)MAIN DOOR FRAME TEA WOOD 2)INTERNAL DOOR FRAME RED MARANDI 3) EXTERNAL FRAMES OF ANODISED ALUMINIUM""",NA,STONE ARCHITRAVE AND ITALIAN MARBLE FLOORING IN CAR BODY AND GRANITE CLADDING,PHILLIPS LED LIGHTS IN COMMON AREA,NA
19 OF 2017 DATED 06.07.2017,CHANDAN TOWER(TOWER-D),RAHEJA DEVELOPERS LTD.,"RAHEJA VANYA SECTOR-99-A, GUR
UGRAM",GURUGRAM,321,453.71,81.35,0,50,14.37,30.41,0,0,0,0,0,0,0,4.68 (Acre),Not available,Not available,NA,NA,NA,NA,NA,NA,NA
57 OF 2017 DATED 17.8.2017,AMB SELFIE SQUARE ( COMMERCIAL PROJECT),VS REALPROJECTS PVT.LTD,"SECTOR-37D, HARSARU, GURUGRAM",GURUGRAM,200,500,700,975,200,200,300,0,0,0,100,0,0,0,3.775 (Acre),31-12-2021,0,VITREOUS TILES,ANTI SKID TILES,ALUMINIUM,HAVELLS,OTIS,HAVELLS OR EQUIVALENT,NA
GGM/575/307/2022/50 DATED 13.06.2022,SHREE VARDHMAN MANTRA(RESI.)/ SHOPPING MART,SHREE VARDHMAN BUILDPROP PVT LTD,"SECTOR-67,VILLAGE BADSHAPUR,G
URUGRAM",GURUGRAM,310.43,264.30,124.48,56.00,175.92,43.19,0,7.57,48.22,0,0,0,0,0,11.262 (Acre),31-12-2024,30,CERAMIC TILES/ MARBAL FLOORING,MARBLE COUNTER WITH 2 DADO,HARDWOOD/FLUSH DOORS,ISI MARKED,MARBELE FLOORING/ KOTA STONE,ISI MARKED,OBD
351 OF 2017 DATED 20.11.2017,ENIGMA,ATHENA INFRASTRUCTURE LTD.,"SECTOR-110, VILLAGE PAWALA KH
USRUPUR, GURUGRAM, HARYANA",GURUGRAM,185.88,106.19,70.79,444.13,135.69,11.39,147.49,1.76,0,0,5.69,0,0,0,80354.381 (Sqr/mtrs),31-08-2018,100,IMPORTED MARBLE / WOODEN FLOORING / ANTI SKID VITRIFIED TILES / ANTI SKID PREMIUM CERAMIC TILES / ANTI SKID TILES,GRANITE COUNTER TOP WITH BACK SPLASH IN GRANITE SS DOUBLE SINK AND IMPORTED CP FITTINGS.,GLAZED SLIDING SHUTTERS WITH UPVC / FRAMES WITH CLEAR / FROSTED GLASS,MODULAR SWITCHES.,PASSENGER AND SERVICE LIFTS,ISI APPROVED MAKES,AS SPECIFIED EARLIER
219 OF 2017 DATED 18.09.2017,2.9812 ACRES COMMERCIAL PROJECT,PLUS PROJECTS PVT. LTD,"SECTOR-62, GURUGRAM",GURUGRAM,48.26,130.36,21.37,200,20,3.75,150,0.86,0,0,0,0,0,0,0.92 (Acre),30-06-2019,100,"GRANITE IN OPEN COURTYARD , PASSAGE , CORRIDORS & STAIRS , VITRIFIED TILES FLOORING","MODULAR TYPE AND OZONE CHANNELS , FLOORING CERAMIC TILES",CHOKHAT FRAME & WINDOW SHUTTER OF SAG WAN AND POLISHABLE WOOD,"GEYSER , FAN",4 LIFT,"GEYSER , FAN",POP AND PAINT
GGM/386/118/2020/02 DATED 06.01.2020,SIGNATUREGLOBAL PROXIMA 2,SIGNATURE INFRABUILD PRIVATE LIMITED,"VILLAGE HAYATPUR, SECTOR 89 G
URUGRAM-MANESAR URBAN COMPLEX, HARYANA",GURUGRAM,107.17,136.98,66.41,0,164.78,14.52,0,13.57,0,0,0,0,0,161.14,4.73125 (Acre),Not available,Not available,VITRIFIED & CERAMIC TILES,ISI MARKED,"WOODEN(DOOR FRAME), ALUMINIUMN/UPVC(WINDOW FRAME)",ISI MARKED,ISI MARKED,ISI MARKED,NA
GGM/501/233/2021/69 DATED 25.10.2021,M3M SOULITUDE,AAWAM RESIDENCY PRIVATE LIMITED,"SECTOR-89, GURUGRAM MANESAR U
RBAN COMPLEX, GURUGRAM, HARYANA.",GURUGRAM,0,0,0,0,0,0,0,0,0,0,0,0,0,0,27292.28 (Sqr/mtrs),Not available,Not available,VITRIFIED TILE / LAMINATED WOODEN FLOORING / CERAMIC TILE,GRANITE COUNTER WITH SS SINK,HARDWOOD DOOR FRAME WITH LAMINATED FLUSH/WOODEN DOOR,AS PER APPROVED MAKE,4 TO 6 PASSENGER LIFTS AS PER NORMS,AS PER APPROVED MAKE,NA
GGM/831/563/2024/58 DATED 03.06.2024,SIGNATUREGLOBAL TITANIUM SPR,SIGNATUREGLOBAL (INDIA) LIMITED,"VILLAGE- FAZILPUR JHARSA, SEC
TOR-71, GURUGRAM, HARYANA",GURUGRAM,418.53,662.50,222.25,0,274.43,55.19,0,48.06,0,0,0,0,0,0,14.3825 (Acre),Not available,Not available,IMPORTED MARBLE,IMPORTED MARBLE,"HIGH LAMINATED SHUTTER, FLUSH DOOR SHUTTERS",AS/ SELECTION,"PASSENGER LIFT, SERVICE LIFT, PENTHOUSE INTERNAL LIFT, PRIVATE LIFT FOR EACH TOWER / WING",AS/SELECTION,NA
GGM/837/569/2024/64 DATED 14.06.2024,LUSHLANDS,ADANI INFRASTRUCTURE AND DEVELOPERS PRIVATE LIMITED,"VILLAGE GWAL PAHARI, SECTOR 0
2, GURUGRAM",GURUGRAM,354.25,59.94,110.89,167.67,60.23,41.68,11.55,154.26,1770.39,0,0,0,0,0,8.349 (Acre),30-06-2029,10,"MARBLE, LAMINATED FLOORING AND WOODEN FLOOR",MARBLE (GREY WILLIAN//EQ UIVALENT)CORIAN COUNTER MODULAR KITCHEN/ EQUIVALENT,DOORS - PANELED DOORS &SS; HARDWARE,ISI STANDARD,AS PER APPLICABLE NORMS,ISI STANDARDS,PAINT FINISH
GGM/457/189/2021/25 DATED 15.06.2021,INDEPENDENT FLOORS AT DLF GARDENCITY SECTOR 91/92,DLF PROJECTS LIMITED,"DLF GARDEN CITY, SECTOR 91 /
92,",GURUGRAM,0,0,0,0,0,0,0,0,0,0,0,0,0,0,1.007 (Acre),Not available,Not available,IPS FLOORING / TILES / GRANITE,WHITE WASH / OBD,MS / AL,MODULAR FITTINGS,BRANDED MAKE,MODULAR FITTINGS,NA
GGM/844/576/2024/71 DATED 01.07.2024,M3M ANTALYA HILLS 3,LOON LAND DEVELOPMENT LIMITED,"SECTOR 79 & 79B, GURUGRAM",GURUGRAM,202.20,62.23,27.54,0,33.56,27.46,54.74,43.71,0,0,0,0,0,0,4.17 (Acre),Not available,Not available,VITRIFIED TILES/LAMINATE WOODEN FOR BEDROOM ; ANTISKID CERAMIC TILES FOR TOILET,"VITRIFIED TILES, PLASTER AND OBD",UPVC / ALUMINIUM POWDER COATED FOR EXTERNAL,AS PER APPROVED MAKE,4 TO 6 PASSENGER LIFTS AS PER NORMS,AS PER APPROVED MAKE,PLASTER AND OBD
GGM/622/354/2022/97 DATED 27.10.2022,SIGNATURE GLOBAL CITY 37D-(2),SIGNATUREGLOBAL DEVELOPERS PVT. LTD.,"VILLAGE GADULI KALAN, SECTOR-
37D, GURUGRAM",GURUGRAM,0,0,0,0,0,0,0,0,0,0,0,0,0,0,4.16 (Acre),Not available,Not available,VITRIFIED & CERAMIC TILES,ODB,FRAME- RED MARANDI/HAR DWOOD SHUTTER-32M M FLUSH DOOR LAMINATED,NA,OTIS/FUGITE CH,NA,NA
