GGM/620/352/2022/95 DATED 19.10.2022,"SOBHA CITY, PHASE-6",SOBHA LIMITED,"REVENUE ESTATE OF BABUPUR VIL
LAGE, VILLAGE BABUPUR, SECTOR-108, GURUGRAM, HARYANA",GURUGRAM,204.03,235.46,96.68,0,131.08,44.78,0,6.82,0,0,0,0,0,0,16.3995 (Acre),Not available,Not available,NATURAL / ENGINEERED STONE FLOORING AND SKIRTING/ LAMINATED WOODEN FLOORING AND SKIRTING / VITRIFIED TILE FLOORING AND SKIRTING /CERAMIC TILE,"CERAMIC TILE FLOORING, WALL TILING & PLASTIC EMULSION PAINT FOR CEILING",FRAME – TIMBER FRAME & SHUTTERS – WITH BOTH SIDE MASONITE SKIN,FITTING OF REPUTED MAKE APPROVED BY ISI & IS SPECIFICATION,3 LIFTS IN EACH TOWER,FITTING OF REPUTED MAKE APPROVED BY ISI & IS SPECIFICATION,PLASTIC EMULSION PAINT FOR WALLS & CEILING
GGM/828/560/2024/55 DATED 27.05.2024,SOBHA ALTUS,SOBHA LIMITED,"REVENUE ESTATE OF VILLAGE PAW
ALA KHUSRUPUR, SECTOR-106, GURUGRAM",GURUGRAM,133.47,320.44,74.62,0,165.64,12.69,0,8.32,2319.33,0,0,0,0,0,5.51 (Acre),Not available,Not available,CERAMIC/VITRIFIED,CERAMIC/VITRIFIED,ALUMINIUM/UPVC/GLASS,"SWITCHES, SOCKET, SWITCH BOARD, SWITCH BOARD BOXES,MCB, EXHAUST FAN",SCHINDLER/KONE/OTIS/EQUIVALENT,"SWITCHES, SOCKET, SWITCH BOARD, SWITCH BOARD BOXES,MCB, EXHAUST FAN",PLASTIC EMULSION
GGM/295/2018/27 DATED 29.11.2018,JOYVILLE GURUGRAM-I,JOYVILLE SHAPOORJI HOUSING PVT LTD,"VILLAGE-KHERKI MAJRA, SECTOR-
102, TEHSIL-GURUGRAM, DISTRICT-GURUGRAM, HARYANA",GURUGRAM,37,10,15,20,37,10,37,0,0,0,0,0,0,0,0.97 (Acre),Not available,Not available,VITRIFIED OR LAMINATED WOODEN FLOORING OR CERAMIC TILE.,KITCHEN COUNTER TOP – BLACK GRANITE. SINK – S.S. SINK WITHOUT DRAINBOARD.,DOOR FRAME : RED MIRANTI WITH PAINT WINDOW FRAME : ALUMINIUM - POWDER - COATED,ALL SWITCHES AND SOCKETS WILL BE OF MODULAR TYPE - ANCHOR ROMA OR EQUIVALENT,2NOS. PASSENGER AND 1 NOS. SERVICE ELEVATOR,ALL SWITCHES AND SOCKETS WILL BE OF MODULAR TYPE - ANCHOR ROMA OR EQUIVALENT,AS ABOVE DETAILED.
GGM/694/426/2023/38 DATED 02.02.2023,WESTERLIES PHASE-2,EXPERION DEVELOPERS PRIVATE LIMITED,SECTOR 108,GURUGRAM,1305.98,397.91,194.97,0,303.11,71.24,0,27.44,0,0,0,0,0,0,44.178 (Acre),22-03-2018,100,NOT APPLICABLE,NOT APPLICABLE,NOT APPLICABLE,NOT APPLICABLE,NOT APPLICABLE,NOT APPLICABLE,NOT APPLICABLE
GGM/735/467/2023/79 DATED 24.07.2023,THE ANTALYAS,NAVRAJ INFRATECH PVT LTD,SECTOR 37 D,GURUGRAM,216.99,164.50,132.80,0,111.05,50.00,8.58,9.67,0,0,0,0,0,0,5.43 (Acre),Not available,Not available,VITRIFIED & CERAMIC TILES/ ITALIAN STONE,ISI MARKED,"WOODEN(DOOR FRAME), ALUMINIUMN/UPVC(WINDOW FRAME)",ISI MARKED,ISI MARKED,ISI MARKED,ACRLYLIC EMULSION
GGM/598/330/2022/73 DATED 01.08.2022,WHITELAND BLISSVILLE,WHITELAND CORPORATION PRIVATE LIMITED,SECTOR- 76,GURUGRAM,117.83,114.67,103.94,0,153.6,16.85,0,3.11,0,0,0,0,0,116.52,7.3187 (Acre),Not available,Not available,NA,NA,NA,NA,NA,NA,NA
GGM/821/553/2024/48 DATED 29.04.2024,M3M ALTITUDE,MANGLAM MULTIPLEX PRIVATE LIMITED,"SECTOR 65, GURUGRAM",GURUGRAM,321.19,127.03,80.30,369.37,144.54,32.12,205.88,64.24,0.00,0.00,0.00,0.00,0.00,0.00,2.79 (Acre),Not available,Not available,LAMINATED WOODEN FLOORING / VITRIFIED TILES / CERAMIC TILE,"STONE OVER KITCHEN COUNTER, SS SINK","""MAIN DOOR - MODULAR DOORS WITH HARDWARES. BED ROOMS / TOILETS / KITCHEN DOORS: - MODULAR DOORS WITH HARDWARES.""",COMMON AREA LIGHT FIXTURES,HIGH SPEED ELEVATORS (PASSENGER & SERVICE),COMMON AREA LIGHT FIXTURES,AS STATED ABOVE
GGM/531/263/2022/06 DATED 02.02.2022,M3M CAPITAL,UNION BUILDMART PRIVATE LIMITED,"SECTOR -113, GURUGRAM MANESAR
URBAN COMPLEX, GURUGRAM, HARYANA.",GURUGRAM,205.11,300.32,110.33,48.38,140.06,57.68,645.85,8.36,0,0,49.48,0,0,0,4.856 (Acre),Not available,Not available,VITRIFIED TILES/LAMINATED WOODEN FLOOR/CERAMIC TILE,N.A.,EXTERNAL ALUMINIUM WITH GLASS INTERNAL – WOODEN,AS PER APPROVED MAKE,3 LIFT PER TOWER,AS PER APPROVED MAKE,NA
GGM/518/250/2021/86 DATED 20.12.2021,THE MILLENNIA-IV,STERNAL BUILDCON PRIVATE LIMITED,"VILLAGE GADAULI KALAN, SECTOR
37D, GURUGRAM-MANESAR, DIST. GURUGRAM, HARYANA",GURUGRAM,117.36,164.52,63.5,0,173.42,18.08,0,16.34,0,0,0,0,0,0,5.89 (Acre),Not available,Not available,VITRIFIED & CERAMIC TILES,ISI MARKED,"WOODEN (DOOR FRAME), MS / ALUMINIUMN/ UPVC (WINDOW FRAME)",ISI MARKED,ISI MARKED,ISI MARKED,NA
GGM/444/176/2021/12 DATED 22.03.2021,INDEPENDENT FLOORS AT DLF GARDENCITY SECTOR 91/92,DLF LUXURY HOMES LIMITED,"DLF GARDEN CITY, SECTOR 91 /
92,",GURUGRAM,0,0,0,0,0,0,0,0,0,0,0,0,0,0,0.986 (Acre),Not available,Not available,IPS FLOORING / TILES / GRANITE,WHITE WASH / OBD,MS / AL DOORS AND WINDOWS,MODULAR FITTINGS,BRANDED MAKE,MODULAR FITTING,NA
GGM/586/318/2022/61 DATED 04.07.2022,SS LINDEN RESIDENTIAL FLOORS - II,SS GROUP PRIVATE LIMITED,"SS LINDEN, SECTOR-84",GURUGRAM,0,0,0,0,0,0,0,0,0,0,0,0,0,0,1.8511 (Acre),Not available,Not available,ITALIAN MARBLE & VITRIFIED TILES,GLAZED 600MM HIGH TILES ABOVE COUNTER LEVEL & BALANCE ACRYLIC PAINT,SOLID HARDWOOD / UPVC FRAMES,MODULER TYPE,01 NO PASSENGER WITH 06 PERSONS CAPACITY,MODULER TYPE,ACRYLIC EMULSION PAINT
GGM/812/544/2024/39 DATED 08.04.2024,KRISUMI WATERSIDE RESIDENCES,KRISUMI CORPORATION PVT. LTD.,"SECTOR- 36A, GURUGRAM, HARYAN
A",GURUGRAM,2092.02,692.04,238.97,596.58,497.15,99.43,696.01,123.29,0,0,0,0,0,0,5.0951 (Acre),Not available,Not available,NA,NA,NA,NA,NA,NA,NA
GGM/818/550/2024/45 DATED 22.04.2024,PARQ,KEYWEST EDUINFRA & SERVICES PRIVATE LIMITED,"VILLAGE NAURANGPUR, SECTOR-80",GURUGRAM,164.66,429.71,83.83,60.00,107.29,32.23,41.00,8.57,2708.3,33.3,60,0,0,0,5.6 (Acre),Not available,Not available,MARBLE/ PREMIUM QUALITY TILES/ EQUIVALENT,FLOOR TILES & PAINT,DOUBLE/SINGLE GLASS,LED FIXTURES,PASSENGER/SERVICE/FIREMAN LIFT,LED FIXTURES,PAINT SURFACE
GGM/865/597/2024/92 DATED 04.09.2024,TARC ISHVA,TARC LIMITED,SECTOR 63A GURUGRAM,GURUGRAM,2055.81,710.79,258.80,2499.31,0,57.59,120.72,931.50,1740.54,185.67,60.95,0,0,0,6.9500 (Acre),Not available,Not available,TILE/WOODEN FLOORING/MARBLE,SINGLE LEVER COUNTER TOP,WINDOWS - ALUMINIUM POWDER-COATED SECTIONS AND FLUSH DOOR,FAN AND ELECTRIC POINT,2 PASSENGER LIFTS SERVING EVERY APARTMENT,"HEAVY DUTY CONDUTING MODULAR SWITCHES, C CURVE MCB",ACRYLIC EMULSION PAINT
GGM/443/175/2021/11 DATED 15.03.2021,INDEPENDENT FLOORS AT DLF GARDENCITY SECTOR 91/92,DLF UTILITIES LIMITED,"DLF GARDEN CITY, SECTOR 91 /
92,",GURUGRAM,0,0,0,0,0,0,0,0,0,0,0,0,0,0,0.969 (Acre),Not available,Not available,IPS FLOORING / TILES / GRANITE,WHITE WASH / OBD,MS / AL DOORS AND WINDOWS,MODULAR FITTINGS,BRANDED MAKE,MODULAR FITTING,NA
GGM/581/313/2022/56 DATED 27.06.2022,SIGNATURE GLOBAL CITY 63A (1),SIGNATUREGLOBAL (INDIA) LIMITED,VILLAGE KADARPUR SECTOR 63,GURUGRAM,185.03,112.51,37.56,0,60.19,7.69,0,10.57,0,0,0,0,0,0,5.0125 (Acre),Not available,Not available,MARBLE / STONE I TILES I ANTI-SKID TILES / LAMINATED I EQUIVALENT,TILES / ACRYLIC EMULSION / EQUIVALENT,"WOODEN / EQUIVALENT DOOR FRAMES, ANODISED / POWDER COATED FRAMES FOR WINDOWS/ UPVC","LED FOR ONLY THE COMMON AREAS, ISI MARKED",1 LIFT / PLOT,ISI MARKED FOR ONLY THE COMMON AREAS,OBD / TILES EQUIVALENT
GGM/579/311/2022/54 DATED 27.06.2022,ASHIANA ANMOL PHASE III & PLAZA PH II,ASHIANA HOUSING LIMITED,VILL. DHUNELA SEC 33 SOHNA,GURUGRAM,216.51,102.70,17.86,162.69,0,13.54,205.26,3.28,0,0,12.43,0,0,0,6.7879 (Acre),Not available,Not available,LIVING/ DINING / LOBBY : DOUBLE CHARGED VITRIFIED TILES BEDROOM: DOUBLE CHARGED VITRIFIED TILES KITCHEN. OF HOUSE DOUBLE CHARGED VITRIFIED TILES BATHROOM & BALCONY : CERAMIC TILES,"DOUBLE CHARGED VITRIFIED TILES, 600MM HIGH CERAMIC TILES DADO ABOVE PLATFROM AND PLASTIC PLASTIC EMULSION OF PLEASING SHADE. KITCHEN PLATFORM IN QUALITY QUARTZIGRANITE STONE WITH STAINLESS STEEL SINK WITH STAINLESS, SHINK DRAIN AND PROVISION FOR HOT AND COLD WATER SUPPLY.",FOLDED STEEL SECTION,"CONVENIENT PROVISION AND DISTRIBUTION OF LIGHTS AND ELECTRIC FITTINGS POWER PLUGS; PROVISION FOR ELECTRICAL CHIMNEY ABOVE PLATFORM, GAS PIPELINE AND WATER PURIFIER POINT IN KITCHEN.",TWO GEARLESS HIGH SPEED AUTOMATIC LIFTS IN EACH BLOCK WITH DG BACKUP.,NA,NA
GGM/612/344/2022/87 DATED 28.09.2022,M3M CAPITAL PHASE -2,UNION BUILDMART PRIVATE LIMITED,"SECTOR -113, GURUGRAM MANESAR
URBAN COMPLEX, GURUGRAM, HARYANA.",GURUGRAM,443.0,230.86,101.73,548.53,429.55,59.84,464.48,547.0,0,0,0,0,0,0,7.7139 (Acre),Not available,Not available,RETAIL (TYPICAL FLOOR)- RCC BASE SLAB OFFICE (LOBBY)FINISHED GRND FLOOR LOBBY & RCC BASE SLAB FOR TYPICLFLOOR LOBBIES. OFFICE (UNIT FLOOR FINISH) RCC BASE SLAB,N.A.,ALUMINIUM FRAME,COMMON AREAS & TOILETS TO BE PROVIDED WITH LED LIGHTFIXTURES.,STANDARD MAKE ELEVATORS,PROVISION OF CABLE UP TO DISTRIBUTION BOARD ISI /BISAPPROVED,PAINT/GLASS
GGM/626/358/2022/101 DATED 21.11.2022,ELAN THE PRESIDENTIAL,ELAN AVENUE LIMITED (FORMERLY KNOWN AS AIRMID DEVELOPERS LIMITED),"SITUATED IN SECTOR 106 IN THE
REVENUE ESTATE OF VILLAGE PAWALA KHUSRUPUR TEHSIL KADIPUR DISTRICT GURUGRAM, HARYANA",GURUGRAM,30.79,65.95,54.91,200,15.33,12.00,67.5,186.82,0,0,24.00,133.37,0,0,12.767 (Acre),Not available,Not available,"VITRIFIED TILE, LAMINATE WOODEN FLOORING",SINGLE LEVER COUNTER TOP,FULL HEIGHT WINDOWS- ALUMINIUM PODER COATED SECTIONS AND WOODEN FRAME WITH FLUSH DOOR WITH VENEER FINISH (ON BOTH SIDES) & ARCHITRAVES,FAN AND ELECTRIC POINT,4 LIFTS IN ONE TOWER,"HEAVY DUTY CONDUTING MODULAR SWITCHES, C CURVE MCB",PREMIUM ACRYLIC DISTEMPER
GGM/619/351/2022/94 DATED 04.10.2022,SIGNATURE GLOBAL CITY 63A(2),SIGNATUREGLOBAL (INDIA) LIMITED,"VILLAGE-KADARPUR, SECTOR-63A,
GURUGRAM",GURUGRAM,0,0,0,0,0,0,0,0,0,0,0,0,0,0,1.2395 (Acre),Not available,Not available,VITRIFIED & CERAMIC TILES,ISI MARKED,"WOODEN (DOOR FRAME), MS / ALUMINIUMN/ UPVC (WINDOW FRAME)",ISI MARKED,ISI MARKED,ISI MARKED,NA
GGM/670/402/2023/14 DATED 16.01.2023,GODREJ ICON TOWER 4/E AND TOWER 5/F,OASIS LANDMARKS LLP,SECTOR 88A & 89A,GURUGRAM,76.49,54.73,39.93,0,21.13,12.63,33.75,12.14,0,0,7.33,0,0,0,1.424625 (Acre),31-12-2029,0,"VITRIFIED TILE OR EQV. IN LIVING/DINING, WOODEN FLOORING OR EQV. IN BEDROOMS, ANTI-SKID TILES OR EQV. IN TOILETS, KITCHEN, BALCONY & UTILITY",GRANITE COUNTER WITH SINK AND CP FITTINGS,"TEAK FRAME IN MAIN DOOR, RED MERANDI/ FLUSH DOOR IN INTERNAL DOORS, ALUMINIUM OR EQ. FRAME WITH GLASS FOR WINDOWS & SLIDING DOOR WINDOWS",PHILLIPS OR EQUIVALENT LED LIGHTS IN COMMON AREA,STONE ARCHITRAVE AND ITALIAN MARBLE/STONE FLOORING IN CAR BODY AND GRANITE CLADDING,LED LIGHTS IN COMMON AREA,AS MENTIONED BELOW
GGM/573/305/2022/48 DATED 06.06.2022,SIGNATUEGLOBAL PARK V (2),SIGNATUREGLOBAL HOMES PRIVATE LIMITED,"VILLAGE DHUNELA, SECTOR 36, S
OHNA DISTRICT,GURUGRAM",GURUGRAM,0,0,0,0,0,0,0,0,0,0,0,0,0,0,1.7756 (Acre),Not available,Not available,MARBLE / STONE I TILES I ANTI-SKID TILES / LAMINATED I EQUIVALENT,TILES / ACRYLIC EMULSION / EQUIVALENT,"WOODEN / EQUIVALENT DOOR FRAMES, ANODISED / POWDER COATED FRAMES FOR WINDOWS/ UPVC","LED FOR ONLY THE COMMON AREAS, ISI MARKED",1 LIFT / PLOT,ISI MARKED FOR ONLY THE COMMON AREAS,OBD / TILES EQUIVALENT
GGM/665/397/2023/09 DATED 13.01.2023,SIGNATURE GLOBAL CITY 92-2,SIGNATURE INFRABUILD PVT. LTD.,"VILLAGE MEVKA, WAZIRPUR, SECT
OR-92, GURUGRAM",GURUGRAM,242.60,100.2,151.94,0,349.68,55.6,0,35.13,0,0,0,0,0,0,8.3125 (Acre),Not available,Not available,VITRIFIED & CERAMIC TILES,OPEN KITCHEN,WOODEN / UPVC/ALUMIN UM,NA,OTIS/FUGITE CH,NA,NA
GGM/785/517/2024/12 DATED 09.02.2024,THE ESTATE RESIDENCES,ANANT RAJ LIMITED,SECTOR 63A GURUGRAM,GURUGRAM,86,70,80,850,90,10,400,15,0,0,60,0,0,244,5.43263 (Acre),Not available,Not available,TILES/MARBLES/GRANITE/LAMINATED WOOD,"MODULAR KITCHEN WITH APPLIANCES AS PER POINT 6.6 IN UNIT WISE SPECIFICATION, CABINE TRY AND SS SINK",MS/UVC/AL/WOOD/COMPOSITE MATERIAL,NA,BRANDED MAKE,"SWITCH BOX AND SOCKETS, HOME AUTOMATION IN SELECT AREAS AS PER DESIGN",NIL
GGM/801/533/2024/28 DATED 18.03.2024,PREMIER FLOORS,JMS INFRA REALITY PVT. LTD.,"SECTOR 95, VILLAGE-WAZIRPUR",GURUGRAM,0,0,0,0,0,0,0,0,0,0,0,0,0,0,937 (Sqr/mtrs),Not available,Not available,CERAMIC / VITRIFIED TILES,CERAMIC TILES,"FLUSH DOORS, ALUMINIUM/UPVC","ISI MARK, COPPER & ALUMINIUM",NA,ISI MARK,PAINT
GGM/358/90/2019/52 DATED 20.09.2019,ULTIMA PHASE-II,DLF LIMITED,"VILLAGE LAKHNOLA, SECTOR 81,
GURUGRAM, HARYANA",GURUGRAM,1227,31,51,205,102,256,1102,51,1707,0,10,686,0,0,11.343 (Acre),30-11-2020,67,IPS FLOORING/ IMPORTED MARBLE,WHITE WASH/ TILES UP-TO 2’ ABOVE COUNTER & ACRYLIC EMULSION PAINT IN BALANCE AREA,"MS ANGLE & PRESSED MS DOOR FRAMES, MS Z-SECTION WINDOW FRAME, FLUSH DOOR SHUTTERS",MODULAR FITTINGS,OTIS,MODULAR FITTINGS,NA
GGM/427/159/2020/43 DATED 20.11.2020,SIGNATURE GLOBAL PARK-III,SIGNATUREGLOBAL HOMES PRIVATE LIMITED,"1309 13TH FLOOR DR. GOPAL DAS
BHAWAN 28 BARAKHAMBA ROAD NEW DELHI 110001",GURUGRAM,200.20,188.16,83.53,0,118.23,24.29,0,15.27,0,0,0,0,0,167.13,10.55625 (Acre),Not available,Not available,NA,NA,NA,NA,NA,NA,NA
GGM/553/285/2022/28 DATED 25.04.2022,BIRLA NAVYA (DRISHA 1B),AVARNA PROJECTS LLP,SECTOR 63A GURUGRAM,GURUGRAM,0,0,0,0,0,0,0,0,0,0,0,0,0,0,2908.1 (Sqr/mtrs),Not available,Not available,MARBLE / STONE / TILES / ANTI-SKID TILES / LAMINATED / EQUIVALENT,TILES / PLASTIC PAINT / ACRYLIC EMULSION / EQUIVALENT,"WOODEN / EQUIVALENT DOOR FRAMES FOR MAIN/ INTERNAL DOORS, ANODISED / POWDER COATED FRAMES FOR EXTERNAL DOOR WINDOWS",LED FOR ONLY THE COMMON AREAS,1 LIFT / PLOT,ISI MARKED FOR ONLY THE COMMON AREAS,ACRYLIC PAINT
GGM/704/436/2023/48 DATED 29.03.2023,M3M GOLF HILLS PHASE 1,LOON LAND DEVELOPMENT LIMITED,SECTOR 79/ 79B,GURUGRAM,1046.04,250.00,125.00,1080.00,250.00,110.00,595.00,70.00,0.00,0.00,0.00,0.00,0.00,1186.19,20.0438 (Acre),Not available,Not available,VITRIFIED TILES/LAMINATEDWOODEN FLOOR/CERAMIC TILE,NA,EXTERNAL ALUMINIUM WITH GLASSINTERNAL – WOODEN,AS PER APPROVED MAKE,LIFTS AS PER BUILDING PLANS,AS PER APPROVED MAKE,NA
GGM/575/307/2022/50 DATED 13.06.2022,SHREE VARDHMAN MANTRA(RESI.)/ SHOPPING MART,SHREE VARDHMAN BUILDPROP PVT LTD,"SECTOR-67,VILLAGE BADSHAPUR,G
URUGRAM",GURUGRAM,310.43,264.30,124.48,56.00,175.92,43.19,0,7.57,48.22,0,0,0,0,0,11.262 (Acre),31-12-2024,30,CERAMIC TILES/ MARBAL FLOORING,MARBLE COUNTER WITH 2 DADO,HARDWOOD/FLUSH DOORS,ISI MARKED,MARBELE FLOORING/ KOTA STONE,ISI MARKED,OBD
GGM/302/2018/34 DATED 07.12.2018,GODREJ AIR PHASE-III,GODREJ DEVELOPERS & PROPERTIES LLP,"SECTOR-85, GURUGRAM",GURUGRAM,186,67,49,213,46,41,131,57,461,0,10,0,0,0,2.312 (Acre),Not available,Not available,"VITRIFIED TILES IN LIVING/DINING, WOODEN FLOORING IN BEDROOMS, ANTI SKID TILES IN TOILETS, KITCHEN, BALCONY & UTILITY OR EQUIVALENT",COUNTER WITH SINK AND CP FITTINGS OR EQUIVALENT,"TEAK FRAME IN MAIN DOOR, RED MERANTI IN INTERNAL DOORS, ALUMINUM FRAME WITH GLASS FOR WINDOWS & SLIDING DOOR WINDOWS OR EQUIVALENT",ONLY SWITCHES,YES,ONLY SWITCH,N/A
GGM/386/118/2020/02 DATED 06.01.2020,SIGNATUREGLOBAL PROXIMA 2,SIGNATURE INFRABUILD PRIVATE LIMITED,"VILLAGE HAYATPUR, SECTOR 89 G
URUGRAM-MANESAR URBAN COMPLEX, HARYANA",GURUGRAM,107.17,136.98,66.41,0,164.78,14.52,0,13.57,0,0,0,0,0,161.14,4.73125 (Acre),Not available,Not available,VITRIFIED & CERAMIC TILES,ISI MARKED,"WOODEN(DOOR FRAME), ALUMINIUMN/UPVC(WINDOW FRAME)",ISI MARKED,ISI MARKED,ISI MARKED,NA
GGM/501/233/2021/69 DATED 25.10.2021,M3M SOULITUDE,AAWAM RESIDENCY PRIVATE LIMITED,"SECTOR-89, GURUGRAM MANESAR U
RBAN COMPLEX, GURUGRAM, HARYANA.",GURUGRAM,0,0,0,0,0,0,0,0,0,0,0,0,0,0,27292.28 (Sqr/mtrs),Not available,Not available,VITRIFIED TILE / LAMINATED WOODEN FLOORING / CERAMIC TILE,GRANITE COUNTER WITH SS SINK,HARDWOOD DOOR FRAME WITH LAMINATED FLUSH/WOODEN DOOR,AS PER APPROVED MAKE,4 TO 6 PASSENGER LIFTS AS PER NORMS,AS PER APPROVED MAKE,NA
GGM/819/551/2024/46 DATED 22.04.2024,DLF PRIVANA WEST,DLF LIMITED,SECTOR 76/77,GURUGRAM,1745.67,604.12,587.15,2120.71,614.09,253.72,0,2230.94,0,0,0,0,0,678.51,12.572 (Acre),Not available,Not available,TILES/MARBLE/GRANITE/LAMINATED WOODEN,MODULAR KICTHEN WITH APPLIANCES AS PERPOINT 6.6 CABINETRY AND SS SINK,MS/UPVC/ALWOOD/COMPOSITION MATERIAL,SWITCH BOX AND SOCKETS,BRANDED MAKE,SAME AS POINT 8,NA
GGM/831/563/2024/58 DATED 03.06.2024,SIGNATUREGLOBAL TITANIUM SPR,SIGNATUREGLOBAL (INDIA) LIMITED,"VILLAGE- FAZILPUR JHARSA, SEC
TOR-71, GURUGRAM, HARYANA",GURUGRAM,418.53,662.50,222.25,0,274.43,55.19,0,48.06,0,0,0,0,0,0,14.3825 (Acre),Not available,Not available,IMPORTED MARBLE,IMPORTED MARBLE,"HIGH LAMINATED SHUTTER, FLUSH DOOR SHUTTERS",AS/ SELECTION,"PASSENGER LIFT, SERVICE LIFT, PENTHOUSE INTERNAL LIFT, PRIVATE LIFT FOR EACH TOWER / WING",AS/SELECTION,NA
GGM/837/569/2024/64 DATED 14.06.2024,LUSHLANDS,ADANI INFRASTRUCTURE AND DEVELOPERS PRIVATE LIMITED,"VILLAGE GWAL PAHARI, SECTOR 0
2, GURUGRAM",GURUGRAM,354.25,59.94,110.89,167.67,60.23,41.68,11.55,154.26,1770.39,0,0,0,0,0,8.349 (Acre),30-06-2029,10,"MARBLE, LAMINATED FLOORING AND WOODEN FLOOR",MARBLE (GREY WILLIAN//EQ UIVALENT)CORIAN COUNTER MODULAR KITCHEN/ EQUIVALENT,DOORS - PANELED DOORS &SS; HARDWARE,ISI STANDARD,AS PER APPLICABLE NORMS,ISI STANDARDS,PAINT FINISH
GGM/823/555/2024/50 DATED 03.05.2024,SEASONS,KEYSTONE WORLD PVT LTD,"SECTOR 77, GURUGRAM",GURUGRAM,162.00,236.00,72.00,100.00,65.00,22.00,450.00,200.00,750,0,100.00,0,0,0,4.0350 (Acre),Not available,Not available,LIVING ROOM / DINING FAMILY LOUNGE - ITALIAN/ IMPORTED MARBLE BED ROOM-LAMINATED WOODEN FLOOR KITCHEN-TILES BATHROOMS - TILES BALCONIES / TERRACES- TILES SERVANT ROOM & TOILET-TILES APARTMENT LIFT LOBBIES (PRIVATE).-ITALIAN/ IMPORTED MARBLE,"CERAMIC TILES ABOVE KITCHEN PLATFORM UPTO APPROXIMATELY 2 FEET AND LOW VOC ACRYLIC EMULSION PAINT IN THE BALANCE AREA,CEILING - LOW VOC ACRYLIC EMULSION PAINT AND PART POP","DOORS - WOODEN FRAME WITH FLUSH DOOR WITH VENEER FINISH (ON BOTH SIDES) & ARCHITRAVES,UPVC FRAMED SINGLE GLAZING UNIT,WOODEN FRAME WITH FLUSH DOOR WITH BOTH SIDE LAMINATED FINISH & ARCHITRAVE",HEAVY DUTY/ MEDIUM DUTY,HIGH SPEED ELEVATORS,MODULAR,LOW VOC ACRYLIC EMULSION
GGM/463/195/2021/31 DATED 13.07.2021,SIGNATURE GLOBAL CITY 37D - 1,SIGNATUREGLOBAL DEVELOPERS PVT LTD,"VILLAGE GADULI KALAN, SECTOR-
37D, GURUGRAM",GURUGRAM,317.82,223.01,97.26,0,194.03,31.60,0,0,0,0,0,0,0,0,15.502 (Acre),Not available,Not available,VITRIFIED & CERAMIC TILES,ISI MARKED,"WOODEN(DOOR FRAME), ALUMINIUMN/UPVC(WINDOW FRAME)",ISI MARKED,ISI MARKED,ISI MARKED,NA
GGM/716/448/2023/60 DATED 08.05.2023,EMERALD HILLS - PHASE 2,EMAAR INDIA LIMITED,"VILLAGE BADSHAHPUR, MAIDAWAS,
NANGLI UMARPUR, SECTOR - 62 & 65, GURUGRAM",GURUGRAM,1611.74,366.26,811.8,563.68,0,0,29,275.26,0,0,0,0,0,0,50.61 (Acre),Not available,Not available,NOT APPLICABLE,NOT APPLICABLE,NOT APPLICABLE,NOT APPLICABLE,NOT APPLICABLE,NOT APPLICABLE,NOT APPLICABLE
GGM/808/540/2024/35 DATED 01.04.2024,SOBHA ARANYA PHASE-1,SOBHA LIMITED,"SECTOR-80, REVENUE ESTATE OF
VILLAGE NAURANGPUR, GURUGRAM",GURUGRAM,490.72,300.70,184.31,0,243.66,34.12,0,12.41,0,0,0,0,0,0,14.81747 (Acre),Not available,Not available,VERTIFIED/CERAMIC TILES,RAK OR EQUIVALENT,TIMBER WITH BOTH SIDE MASONITE SKIN,CLIPSAL- OPALE/EQUIVA LENT,4 FLATS PER FLOOR-D TOWER 3 FLATS PER FLOOR-Z TOWER 3 NO OF LIFTS PER FLOOR,CLIPSAL- OPALE/EQUIVA LENT,EXTERIOR PAINT
GGM/844/576/2024/71 DATED 01.07.2024,M3M ANTALYA HILLS 3,LOON LAND DEVELOPMENT LIMITED,"SECTOR 79 & 79B, GURUGRAM",GURUGRAM,202.20,62.23,27.54,0,33.56,27.46,54.74,43.71,0,0,0,0,0,0,4.17 (Acre),Not available,Not available,VITRIFIED TILES/LAMINATE WOODEN FOR BEDROOM ; ANTISKID CERAMIC TILES FOR TOILET,"VITRIFIED TILES, PLASTER AND OBD",UPVC / ALUMINIUM POWDER COATED FOR EXTERNAL,AS PER APPROVED MAKE,4 TO 6 PASSENGER LIFTS AS PER NORMS,AS PER APPROVED MAKE,PLASTER AND OBD
GGM/471/203/2021/39 DATED 27.07.2021,SIGNATURE GLOBAL CITY 92,SIGNATURE INFRBUILD PVT. LTD.,"VILLAGE MEVKA, WAZIRPUR, SECT
OR-92, GURUGRAM",GURUGRAM,257.71,188.81,58.26,0,106.59,15.81,0,0,0,0,0,0,0,0,7.806 (Acre),Not available,Not available,VITRIFIED & CERAMIC TILES,ISI MARKED,"WOODEN(DOOR FRAME), ALUMINIUMN/UPVC(WINDOW FRAME)",ISI MARKED,ISI MARKED,ISI MARKED,NA
GGM/477/209/2021/45 DATED 27.07.2021,SIGNATURE GLOBAL CITY 81,STERNAL BUILDCON PRIVATE LIMITED,"VILLAGE NAKHDOLA, SECTOR 81",GURUGRAM,213.44,159.73,51.82,0,127.33,18.38,0,0,0,0,0,0,0,261.50,11.9778 (Acre),Not available,Not available,NA,NA,NA,NA,NA,NA,NA
GGM/663/395/2023/07 DATED 12.01.2023,THE ASPEN,WHITELAND CORPORATION PRIVATE LIMITED,"DARBARIPUR ROAD, SECTOR 76",GURUGRAM,754.50,294.00,252.00,5292.0,294.00,192.00,2940.0,375.00,0,0,84.00,81.38,0,959.00,11.96 (Acre),Not available,Not available,NA,NA,NA,NA,NA,NA,NA
GGM/671/403/2023/15 DATED 23.01.2023,THE SIXTY THREE,DLF HOME DEVELOPERS LIMITED,"SECTOR 63, GURUGRAM, HARYANA-
122102",GURUGRAM,521.07,609.15,154.53,0,148.37,45.82,3498.60,127.33,0,0,35.70,0,0,0,25.087 (Acre),Not available,Not available,TILES / MARBLE / GRANITE / LAMINATED WOOD,"MODULAR KITCHEN WITH APPLIANCES AS PER POINT 6.6 IN UNIT WISE SPECIFICATIONS, CABINETRY AND SS SINK",MS / UPVC / AL / WOOD / COMPOSITE MATERIAL,NA,BRANDED MAKE,SWITCH BOX AND SOCKETS. HOME AUTOMATION IN SELECT AREAS AS PER DESIGN,NIL
GGM/682/414/2023/26 DATED 30.01.2023,SIGNATURE GLOBAL CITY 93,SIGNATURE BUILDERS PRIVATE LIMITED,"VILLAGE WAZIRPUR, SECTOR 93,
GURUGRAM, HARYANA",GURUGRAM,412.97,231.5,125.2,0.00,147.05,39.85,0.00,10.50,0.00,0.00,0.00,0.00,0.00,0.00,9.304 (Acre),Not available,Not available,VITRIFIED & CERAMIC TILE,OPEN KITCHEN,WOODEN / UPVC/ALUMIN UM,N/A,OTIS/FUGITE CH,N/A,N/A
GGM/799/531/2024/26 DATED 18.03.2024,GODREJ ZENITH,GODREJ PROPERTIES LTD,"SECTOR 89, GURUGRAM, HARYANA",GURUGRAM,558.72,1213.25,395.98,5553.79,75.98,226.44,3403.78,0,3194.14,0,0,1490.43,0,5055.34,14.20625 (Acre),Not available,Not available,VITRIFIED TILES / CERAMIC TILES,"FLOOR: VITRIFIED TILES WALL: CERAMIC TILES 2'-0"" ABOVE COUNTER & OIL BOUND DISTEMPER CEILING: OIL BOUND DISTEMPER",LAMINATE FINISH FLUSH DOORS/MOULDED SHUTTER WITH WOODEN FRAME)(PREHUNG- LVL WITH LAMINATE),AS PER BUILDING NORMS,3 IN EACH TOWER- 2 PASSENGER AND 1 SERVICE,AS PER BUILDING NORMS,"PROVIDING AND APPLYING 10 TO 12MM THICK PLASTER TO MASONRY AND RCC WALLS, COLUMNS ETC. IN CEMENT MORTAR 1:5"
GGM/797/529/2024/24 DATED 14.03.2024,ASHIANA AMARAH PHASE 3 & 3A,ASHIANA HOUSING LIMITED,"REVENUE ESTATE OF VILLAGE- WA
ZIRPUR, SECTOR 93, DISTT. GURUGRAM, HARYANA",GURUGRAM,507,164,112,211,141,31,104,8,0,0,11,0,0,0,4.5143 (Acre),Not available,Not available,"LIVING/DINING, ENTRANCE FOYER, CORRIDOR LEADING TO BEDROOMS: VITRIFIED TILES (600X600) OR (800X800) OR (600X1200) OR (800X1600), BEDROOMS AND STUDY ROOM: VITRIFIED TILES OR WOODEN TEXTURE TILE,(145 X 600) (600X600) OR (800X800) OR (600X1200),OPEN TERRACE: KOTA STONE/OTHER LOCAL STONE/CERAMIC TILES OF APPROPRIATE QUALITY/STONE MOSAIC FLOOR, STAIRCASE :CERAMIC TILES OR KOTA STONE OR COMBINATION LOCAL STONE OF APPROPRIATE SIZE.","1 STAINLESS STEEL SINK WITH ONE BOWL AND A DRAIN BOARD, 1 SWIVEL TYPE SINK MIXER, 2 CP ANGLE VALVE FOR IN AND OUT OF HOT WATER GEYSER, 1 CP ANGLE VALVE FOR WATER PURIFIER UNIT/RO, NO TAP IS PROVIDED BELOW SINK, PROVISION FOR PIPED LPG GAS WITH LPG METER WILL BE PROVIDED,KITCHEN CABINETS WITH HOB, CHIMNEY, DISHWASHER. GEYSER & EXHAUST FAN.",MAIN DOOR FRAME IN MS ARE EITHER ENAMEL PAINTED/POWDER COATED. AND OTHER MS DOOR FRAMES ARE ENAMEL PAINTED OR POWDER COATED .,"ALL ELECTRICAL WIRING IN CONCEALED CONDUITS WITH COPPER WIRES. CONVENIENT POSITION & DISTRIBUTION OF LIGHT AND POWER PLUGS AND PROVISION FOR ELECTRICAL CHIMNEY ABOVE PLATFORM AND WATER PURIFIER POINT IN KITCHEN. MODULAR ELECTRICAL SWITCHES WITH SOCKETS AND FAN REGULATORS OF SSK/ANCHOR/PANASONIC/NORTH WEST/LEGRAND OR EQUIVALENT,",NOT APPLICABLE.,ALL ELECTRICAL WIRING IN CONCEALED CONDUITS WITH COPPER WIRES. CONVENIENT POSITION & DISTRIBUTION OF LIGHT AND POWER PLUGS AND PROVISION FOR ELECTRICAL CHIMNEY ABOVE PLATFORM AND WATER PURIFIER POINT IN KITCHEN. MODULAR ELECTRICAL SWITCHES WITH SOCKETS AND FAN REGULATORS OF SSK/ANCHOR/PANASONIC/NORTH WEST/LEGRAND OR EQUIVALENT.,GRANITE AND/OR MARBLE AND/OR QUARTZ STONE AND /VITRIFIED TILES AND/OR CERAMIC TILES AND/OR CEMENT SAND PLASTER AND/OR OTHER LOCAL STONE AND/OR COMBINATION OF ANY TWO OR MORE ITEMS WITH EMULSION PAINT FINISH (WHEREVER APPLICABLE).
GGM/842/574/2024/69 DATED 24.06.2024,SMARTWORLD ONE DXP PHASE-2,NOURISH DEVELOPERS PRIVATE LIMITED,"SECTOR 113, VILLAGE CHAUMA,GU
RUGRAM",GURUGRAM,261.98,63.60,95.40,0.00,95.40,100.73,114.11,179.08,0.00,0.00,0.00,0.00,0.00,0.00,5.1055 (Acre),Not available,Not available,BARE R.C.C. SLAB,NA,ALUMINIUM FRAME,LED TYPE FITTINGS IN COMMON AREA ONLY,PASSENGER AND SERVICE LIFT AS PER VERTICAL TRAFFIC,LED TYPE FITTING COMMON AREA ONLY,GYPSUM PLASTER & PAINT
01 OF 2017 DATED 14.06.2017 (SUPERSEDED BY GGM/688/420/2023/32 DATED 02.02.2023),MIXED LAND USE COLONY FOR 14.4125 ACRES,MANGLAM MULTIPLEX PVT LTD,"VILLAGE BADSHAPUR AND MAIDAWA
S, SECTOR-65, GURUGRAM",GURUGRAM,1288,2641,65,2735,44,0,2630,171,1541,0,108,0,0,2725,14.4125 (Acre),Not available,Not available,RCC SLAB/TILE,N.A.,POWDER COATED ALUMINIUM FRAME/WOODEN FRAME,PUBLIC AREAS & TOILETS TO BE PROVIDED WITH LED LIGHT FIXTURES.,SCHINDLER / THYSSENKRUPP / FUJITEC / KONE,PROVISION OF WIRE / CABLE UP TO DISTRIBUTION BOARD ISI /BIS APPROVED,"ANTISKID TILES/IPS ON FLOOR, PAINT/WHITE WASH FINISH ON WALL & CEILING IN PUBLIC AREAS"
GGM/341/73/2019/35 DATED 18.06.2019,M3M URBANA,M3M INDIA PVT. LTD. & MARTIAL BUILDCOM PVT. LTD.,"SECTOR-67, GURUGRAM",GURUGRAM,119.44,223.01,223.01,298,149,15,537,12,0,0,50,0,0,166,11405 (Sqr/mtrs),30-09-2021,58,CEMENT CONCRETE FLOORING,NA,ALUMINIUM AND GLASS,OF REPUTED BRAND,PROVIDED OF REPUTED BRAND,OF REPUTED BRAND,PLASTER AND WHITEWASH
GGM/316/48/2019/10 DATED 21.02.2019,PYRAMID FUSION HOMES,PYRAMID INFRATECH PRIVATE LIMITED,VILLAGE PALRA SECTOR 70A,GURUGRAM,37,69.5,42.72,0,64.58,7.51,20.37,6,0,0,0,0,0,0,5.11875 (Acre),Not available,Not available,TILES/IPS,"2 FEET TILE ON WALL, OBD/COLOUR WASH ON REMAING WALL, TILE/STONE ON KITCHEN COUNTER.",HARDWOOD/ MS Z-SECTION/ FIBRE/ COMPOSITE/ ALUMINIUM/ FRAME WINDOWS ETC.,ISI MARK,2 LIFTS AS PER SANCTIONED PLAN,STANDARD,OBD/COLOUR WASH
