Project Name,Builder Name,Project Address,Avg Price psft,Completion date,Sizes,Project Area,RERA,Project Size - Tower Count,Project Size - Unit Count,Configurations,Amenities - Count,Amenities - List,Photos Count,Videos Count,Media Count,Review Count,Builder-Established Date,Builder-Project count,Builder description,Possession Status,Launch Date,Price trends
Adish Aradhra,ADISH PROPERTIES,"Chandapura, Near Hosur Highway, South Bangalore, Bangalore",₹5.25 K/sq.ft,"May, 2025",1292 - 1538 sq.ft.,1 Acres,PRM/KA/RERA/1251/308/PR/130622/004973,,57,"2, 3 BHK Apartments",12,"Children's Play Area, Partial Power Backup, Swimming Pool, Vastu Compliant, Landscaping & Tree Planting, Lift(s), 24x7 CCTV Surveillance, Gymnasium, Car Parking, Jogging Track, Multipurpose Hall, +6 more",Not Found,Not Found,Not Found,0,1,Not Found,"Adish Properties takes great pride in shaping aspirations and curating lifestyles through our exceptional real estate endeavors. With a sharp focus on innovation and an unwavering dedication to quality, we specialize in crafting premium apartments and meticulously planning layouts that redefine contemporary living in Bangalore.

OUR PHILOSOPHY
The passion to bring a quality lifestyle drives us. Our developments are finer in every aspect, commanding appreciation of value, and identity. Our endeavor is to maintain high-quality standards in architecture, that not only adapt in harmony with its surroundings but also promote life and happiness. Ours is a timeless way of building, designs that endure and quality that outlasts.

OUR VALUES
Adish Properties is built on core values of Passion, Persistence, Exacting standards of quality, and above all the highest degree of Commitment and Accountability.",Under Construction,"Jul, 2022",₹5.1K/sq.ft
DS Max Sky Sisira,DS-MAX PROPERTIES PRIVATE LIMITED,"Yelahanka, Bisuvanahalli Doddaballapura Road, North Bangalore, Bangalore",₹4.4 K/sq.ft,"Sep, 2030",1097 - 1736 sq.ft.,5 Acres,PRM/KA/RERA/1250/301/PR/251024/007178,,870,"2, 3 BHK Apartments",12,"Entrance Lobby, Closed Car Parking, Yoga / Meditation Area, Sauna Bath, Cycling & Jogging Track, Visitor Parking, Water Storage, 24x7 Security, 24x7 CCTV Surveillance, Gymnasium, Sewage Treatment Plant, +1 more",Not Found,Not Found,Not Found,0,2005,142,"DS Max Builders (DS-MAX Properties Pvt. Ltd) is an award-winning Real Estate development firm, based in Bangalore. The company is known for its innovation, quality management, attention to minute details, customer-centric approach and an uncompromising attitude towards quality in all spheres of development. Their properties come with most sought-after locations, competitive pricing and excellent services, thus making them a prestigious brand in the Real Estate industry. Over the years, the companies has grown exponentially and is expanding its sphere beyond Karnataka. Their Mantra for Excellence is “Analyse, Research, Innovate & Deliver” They have a highly qualified and competent team of professionals which has propelled their business growth to respectable heights. DS Max Builders is a one-stop solution for all housing needs - from identification of prime locations to delivering a perfect, enticing abode to our valued customers. Their quest to develop environmentally-friendly modern infrastructure is fueled by their vast understanding of the modern materials and technologies used in construction, the market niche and most importantly, understanding customers' requirements.",Under Construction,"Oct, 2024",Not Found
Sattva Aeropolis,SATTVA GROUP,"Udayagiri, Boovanahalli, North Bangalore, Bangalore",₹9.71 K/sq.ft,"Jul, 2026",666 - 1012 sq.ft.,10.32 Acres,PRM/KA/RERA/1250/303/PR/110522/004869,,1001,"1, 2, 3 BHK Apartments",12,"Children's Play Area, Yoga / Meditation Area, Swimming Pool, Lift(s), Party Hall, Badminton Court, 24x7 CCTV Surveillance, Gymnasium, Medical Facilities, Car Parking, Senior Citizen Siteout, +7 more",Not Found,Not Found,Not Found,0,1986,84,"Sattva Group is one of the promising builders in the field of Real Estate. All Sattva Group constructions have the highest standards of quality through the construction process. Green initiatives, advanced engineering ensure the best standards in construction since 1986. The group mainly focuses on delivering high-quality spaces and have been powering the goals of emerging as a leading name. The builder has created unparalleled projects for its customers with all sorts of amenities and services that meet the needs. Backed by the professional team of architects and designers who plan as per the current Real Estate trend, they always seek the betterment of their clients and guide them to the best path in the property related section of matters and affairs. Sattva Group aims to be a number one Real Estate constructor in India and showcase their talent worldwide.",Under Construction,"May, 2022",₹8.8K/sq.ft
Provident Sunworth City,PROVIDENT HOUSING LIMITED,"Near Mysore Road, Nyce Juction, Kumbalgodu, Mysore-Bangalore Road, Bangalore",₹8.26 K/sq.ft,"Mar, 2028",623 - 1287 sq.ft.,59 Acres (75% open),PRM/KA/RERA/1251/310/PR/190529/002585,,1440,"2, 3 BHK Apartments",12,"Cricket Pitch, Gazebo, Skating Rink, Fountains, Table Tennis, Medical Store/Pharmacy, Medical Facilities, Car Parking, 24X7 Water Supply, Multipurpose Room, Senior Citizen Siteout, +48 more",Not Found,Not Found,Not Found,0,2008,77,"Established in 2008, Provident Housing Limited is a large-scale community developer, offering the greatest value within the residential segment. The company caters to the diverse residential needs of buyers, with a focus on aspirational home ownership. Provident Housing carries a portfolio of remarkable residential developments across 9 cities, namely, Bengaluru, Kochi, Mumbai, Goa, Hyderabad, Mangalore, Chennai, Coimbatore, and Pune.
16+ Years of Trust
50,000+ Happy Customers
12.8 Mn Sq.Ft. Delivered
9 Cities
12,500+ Homes Delivered
11,000+ Homes in the Making",Under Construction,"Jan, 2013",₹6.1K/sq.ft
Engrace Vista,MODERN SPAACES,"Close Proximity to All the Landmarks of Sarjapur Main Road, Bangalore",Not Found,"Jun, 2027",2116 - 2200 sq.ft.,8 Acres,PRM/KA/RERA/1251/308/PR/060324/006691,,392,3 BHK Apartment,12,"Swimming Pool, Landscaping & Tree Planting, Table Tennis, Water Conservation, Rain water Harvesting, Gymnasium, Electrification(Transformer, Solar Energy etc), Squash Court, Closed Car Parking, Car Parking, 24X7 Water Supply, Multipurpose Room, +20 more",Not Found,Not Found,Not Found,0,2019,19,"Since 2019, Modern Spaaces has been crafting homes that go beyond architecture—designed to reflect your lifestyle and aspirations. From villas and apartments to plotted developments, every space is built with a commitment to quality, innovation, and technology. With over 1 million sq. ft. already delivered and 2 million sq. ft. under development, we’re on track to deliver more than 10 million sq. ft.—all built to the highest standards of design, quality, and comfort.",Under Construction,"Apr, 2024",₹7.6K/sq.ft
Nambiar District 25 Phase 1,NAMBIAR ENTERPRISES LLP,"Muthanallur Cross, Off Sarjapur Road, Dommasandra, Bangalore East , Bangalore",₹12 K/sq.ft,"Jan, 2030",750 - 2950 sq.ft.,8.76 Acres,PRM/KA/RERA/1251/308/PR/100125/007377,,796,"1, 2, 3, 3.5, 4 BHK Apartments",12,"Partial Power Backup, Amphitheater, Yoga / Meditation Area, Reflexology Park, Swimming Pool, Skating Rink, Lift(s), 24x7 CCTV Surveillance, Gymnasium, Fire Fighting System, Car Parking, +10 more",Not Found,Not Found,Not Found,0,2004,12,"Nambiar Builders Pvt Ltd's main motto is to fulfill the clients dream and to maintain a lasting and trustworthy relationship. The focus on the key ingredients of international quality standard, construction work and timely delivery of projects has made them to come up as prominent name in the Real Estate industry. The Nambiar Builders Pvt Ltd holds all professional architects as well as engineers who are well known from their talent and creativity. They have successfully completed their major projects in most parts of the Bangalore city. Apart from this the project gives best price offers which suits according to the clients pockets.",Under Construction,"Jan, 2025",₹10.8 K/sq.ft
SNR Safa,SNR SQUARE,"Sy No 4/1, At Chikkadunnasandra Village, Sarjapura Hobli, Anekal Taluk, Somapjra Gate, Anekal, Sarjapur Road, Bangalore",₹5.48 K/sq.ft,"Feb, 2025",960 - 1515 sq.ft.,1.3 Acres,PRM/KA/RERA/1251/308/PR/101122/005438,,100,"2, 3 BHK Apartments",12,"Solid Waste Management And Disposal, Vastu Compliant, Lift(s), Landscaping & Tree Planting, Water Conservation, Rain water Harvesting, 24x7 CCTV Surveillance, Electrification(Transformer, Solar Energy etc), Community Buildings, 24X7 Water Supply, Street Lighting, Gated Community, +10 more",Not Found,Not Found,Not Found,0,1979,9,"An ISO Certified, SNR Square is established with the intention of creating something better. With their dedication, integrity, value of time and experience they have become the most talked about names in the construction domain. The company takes proper care that no conciliation is done with comfort zones while incorporating luxury details. The real estate company always wants to help the people by their expert services and guidance to the clientele base while raising their bench mark of services through honesty, integrity and innovation. They always believe in keeping an eye on vendor quality services to assure genuine services. Further to know more you can go to their website www.snrsquare.com.",Ready to Move,"Jan, 2023",₹6.7 K/sq.ft
Sri Sai Nandana Royal,SRI NANDANA BUILDERS,"Near Treamis School, Kiadb Jigani Road, Electronic City Phase 1, South Bangalore, Bangalore",₹4.75 K/sq.ft,"Nov, 2024",1185 - 1680 sq.ft.,0.5 Acres,Rera Not Applicable,,85,"2, 3 BHK Apartments",10,"Car Parking, 24X7 Water Supply, Fire Sprinklers, Banquet Hall, Lift(s), Rain Water Harvesting, 24x7 Security, 24x7 CCTV Surveillance, Gymnasium, Power Backup",Not Found,Not Found,Not Found,0,5,Not Found,Sri Nandana Builders,Ready to Move,"Jan, 2023",₹4.8K/sq.ft
DS Max Samyak,DS-MAX PROPERTIES PRIVATE LIMITED,"Bheemana kuppe village, Kengeri Hobli, Bangalore West , Bangalore",₹6.13 K - 6.58 K/sq.ft,"Feb, 2026",738 - 1377 sq.ft.,3 Acres,PRM/KA/RERA/1251/310/PR/150223/005721,,601,"2, 3, 4 BHK Apartments",12,"Sauna Bath, Reflexology Park, Swimming Pool, Fire Sprinklers, Table Tennis, Gymnasium, 24X7 Water Supply, Car Parking, Jogging Track, Senior Citizen Siteout, Gated Community, +15 more",Not Found,Not Found,Not Found,0,2005,142,"DS Max Builders (DS-MAX Properties Pvt. Ltd) is an award-winning Real Estate development firm, based in Bangalore. The company is known for its innovation, quality management, attention to minute details, customer-centric approach and an uncompromising attitude towards quality in all spheres of development. Their properties come with most sought-after locations, competitive pricing and excellent services, thus making them a prestigious brand in the Real Estate industry. Over the years, the companies has grown exponentially and is expanding its sphere beyond Karnataka. Their Mantra for Excellence is “Analyse, Research, Innovate & Deliver” They have a highly qualified and competent team of professionals which has propelled their business growth to respectable heights. DS Max Builders is a one-stop solution for all housing needs - from identification of prime locations to delivering a perfect, enticing abode to our valued customers. Their quest to develop environmentally-friendly modern infrastructure is fueled by their vast understanding of the modern materials and technologies used in construction, the market niche and most importantly, understanding customers' requirements.",Under Construction,"Jan, 2023",₹5.0K/sq.ft
DS Max Shresta,DS-MAX PROPERTIES PRIVATE LIMITED,"Sy No. 93, Kogilu Cross, Bellahalli, North Bangalore, Bangalore",₹5.5 K/sq.ft,"Jul, 2026",940 - 1598 sq.ft.,2 Acres,PRM/KA/RERA/1251/309/PR/220223/005748,,281,"2, 3 BHK Apartments",12,"Children's Play Area, Changing Room, Swimming Pool, Party Hall, Landscaping & Tree Planting, Gymnasium, Squash Court, Closed Car Parking, High Speed Elevators, Senior Citizen Siteout, Power Backup, +2 more",Not Found,Not Found,Not Found,0,2005,142,"DS Max Builders (DS-MAX Properties Pvt. Ltd) is an award-winning Real Estate development firm, based in Bangalore. The company is known for its innovation, quality management, attention to minute details, customer-centric approach and an uncompromising attitude towards quality in all spheres of development. Their properties come with most sought-after locations, competitive pricing and excellent services, thus making them a prestigious brand in the Real Estate industry. Over the years, the companies has grown exponentially and is expanding its sphere beyond Karnataka. Their Mantra for Excellence is “Analyse, Research, Innovate & Deliver” They have a highly qualified and competent team of professionals which has propelled their business growth to respectable heights. DS Max Builders is a one-stop solution for all housing needs - from identification of prime locations to delivering a perfect, enticing abode to our valued customers. Their quest to develop environmentally-friendly modern infrastructure is fueled by their vast understanding of the modern materials and technologies used in construction, the market niche and most importantly, understanding customers' requirements.",Under Construction,"Feb, 2023",₹5.5K/sq.ft
Sattva Ashraya,SATTVA GROUP,"Lakshmisagara, Bidadi, Mysore-Bangalore Road, Bangalore",₹6.75 K/sq.ft,"Mar, 2025",785 - 994 sq.ft.,4.2 Acres,PRM/KA/RERA/1270/302/PR/210731/004204,,660,"2, 3 BHK Apartments",12,"Grocery Shop, Swimming Pool, Skating Rink, Landscaping & Tree Planting, Fire Fighting System, Gymnasium, Medical Facilities, 24X7 Water Supply, Car Parking, Jogging Track, Gated Community, +15 more",Not Found,Not Found,Not Found,0,1986,84,"Sattva Group is one of the promising builders in the field of Real Estate. All Sattva Group constructions have the highest standards of quality through the construction process. Green initiatives, advanced engineering ensure the best standards in construction since 1986. The group mainly focuses on delivering high-quality spaces and have been powering the goals of emerging as a leading name. The builder has created unparalleled projects for its customers with all sorts of amenities and services that meet the needs. Backed by the professional team of architects and designers who plan as per the current Real Estate trend, they always seek the betterment of their clients and guide them to the best path in the property related section of matters and affairs. Sattva Group aims to be a number one Real Estate constructor in India and showcase their talent worldwide.",Ready to Move,"Oct, 2021",₹7.6K/sq.ft
Shriram Solitaire,SHRIRAM PROPERTIES,"Yelahanka, North Bangalore, Bangalore",₹8.2 K/sq.ft,Ready to Move,1045 - 1235 sq.ft.,3.09 Acres,TOR/PRM/KA/RERA/1251/309/PR/221116/000068,,,"2, 2.5 BHK Apartments",12,"Children's Play Area, Amphitheater, Yoga / Meditation Area, Barbecue Area, Gazebo, Swimming Pool, Lift(s), Landscaping & Tree Planting, Badminton Court, Table Tennis, Kid's Pool, +10 more",Not Found,Not Found,Not Found,(1 reviews),1974,111,"We are one of the leading residential real estate development companies in South India, primarily focused on the mid-market and affordable housing categories. We are among the five largest residential real estate companies in South India, including specifically in Bengaluru and Chennai, in terms of number of aggregate units launched in the calendar years 2012 to 2017 and the six months ended June 30, 2018. We are also present in the mid-market premium and luxury housing categories, commercial and office space category as well as plotted development category.

We are part of the Shriram Group, which is a prominent business group with four decades of operating history in India and a well-recognized brand in the retail financial services sector and several other industries. We believe that our relationship with the Shriram Group provides us with strong brand recall and that we benefit, and will continue to benefit, from the trust and confidence that homebuyers, lenders, financial investors, landowners, development partners, contractors and other stakeholders place in the Shriram brand and its operational history.

We commenced operations in Bengaluru in the year 2000 and, have expanded our presence to other cities in South India, i.e., Chennai, Coimbatore and Visakhapatnam. In addition, we also have presence in Kolkata in East India, where we are developing a large mixed-use project. Bengaluru and Chennai are two key markets for us. These cities are two large residential housing markets in India, contributing to approximately 31.24% of the launches and 34.22% of the sold inventory in India’s seven cities (Bengaluru, Mumbai, Delhi, Chennai, Pune, Hyderabad and Kolkata), across calendar years 2016 to 2017 and the six months ended June 30, 2018.

As of November 30, 2018, we have 25 completed projects, representing 12.86 million square feet of Saleable Area, out of which our 20 completed projects in the cities of Bengaluru and Chennai accounted for 87.69% of our Saleable Area. Further, 81.88% of our total Saleable Area for completed projects were in the mid-market category and affordable housing category (with midmarket and affordable categories accounting for 48.02% and 33.86% respectively), and the remainder in the commercial and office space and luxury housing categories, as of November 30, 2018.



PART OF THE FINANCIAL CONGLOMERATE SHRIRAM GROUP
22000+ HAPPY FAMILIES
ECONOMIC TIMES BUSINESS EXCELLENCE AWARD 2020 WINNER: DEVELOPER OF THE YEAR (RESIDENTIAL)
PRIVATE EQUITY INVESTMENT BY GLOBAL PLAYERS MITSUBISHI, TPG KOTAK, WALTON STREET CAPITAL STARWOOD CAPITAL AND TATA CAPITAL




Most Trusted Real Estate Brand
Mid-Segment Project of the Year – Codename Yuva
Customer Service Excellence Award


Developer of the Year Residential


CXO of the Year
Integrated Township Project of the Year


Best Efficient & Sustainable – Smart Real Estate Project",Ready to Move,,₹7.6K/sq.ft
DS Max Sukruth,DS-MAX PROPERTIES PRIVATE LIMITED,"Attibele, Sarjapur Road, Bangalore",₹3.77 K/sq.ft,"Feb, 2026",849 - 1352 sq.ft.,2.54 Acres,PRM/KA/RERA/1251/308/PR/280222/004739,,312,"2, 3 BHK Apartments",12,"Children's Play Area, Swimming Pool, Fire Sprinklers, Lift(s), Party Hall, 24x7 CCTV Surveillance, Gymnasium, 24X7 Water Supply, Maintenance Staff, Banquet Hall, Rain Water Harvesting, +4 more",Not Found,Not Found,Not Found,0,2005,142,"DS Max Builders (DS-MAX Properties Pvt. Ltd) is an award-winning Real Estate development firm, based in Bangalore. The company is known for its innovation, quality management, attention to minute details, customer-centric approach and an uncompromising attitude towards quality in all spheres of development. Their properties come with most sought-after locations, competitive pricing and excellent services, thus making them a prestigious brand in the Real Estate industry. Over the years, the companies has grown exponentially and is expanding its sphere beyond Karnataka. Their Mantra for Excellence is “Analyse, Research, Innovate & Deliver” They have a highly qualified and competent team of professionals which has propelled their business growth to respectable heights. DS Max Builders is a one-stop solution for all housing needs - from identification of prime locations to delivering a perfect, enticing abode to our valued customers. Their quest to develop environmentally-friendly modern infrastructure is fueled by their vast understanding of the modern materials and technologies used in construction, the market niche and most importantly, understanding customers' requirements.",Under Construction,"Feb, 2022",₹5.8 K/sq.ft
Trendsquares Ortus 3,Not Found,By TRENDSQUARE CONSTRUCTIONS,10 K - ₹10.94 K/sq.ft,"Dec, 2023",955 - 2004 sq.ft.,4.5 Acres,PRM/KA/RERA/1251/472/PR/220922/005264,,360,"2, 3 BHK Apartments",12,"Club Rooftop, Amphitheater, Reading Lounge, Internet / Wi-Fi, Cricket Pitch, Tennis Court, Spa, Swimming Pool, Skating Rink, Fountains, Gymnasium, +35 more",Not Found,Not Found,Not Found,0,15-02-2008,3,"Trendsquares is one of Bangalore's front -ranking names with over a decade-long experience in outlining the cityscape. The company is led by techno crats who have perfected the science and art of creating benchmarks of excellence. Trendsquares has, over the past decade, cemented the foundation for success in premier residential offerings to discerning clients. The company’s reputation as being the Premier Builder of choice cannot be contested, as client speak bears testimony to a lifetime of successful real estate experiences. Trendsquares sets extraordinary standards in prime realty priced exclusively for the quality conscious investor. We extend to you our time-tested tradition of integrity, quality, and reliability. It is this coming together of old values and new innovation that sets Trendsquares distinctly apart.",Ready to Move,"Jan, 2020",₹9.3K/sq.ft
Sobha Neopolis,SOBHA LIMITED,"Near Panathur Main Road, Off Marathahalli-ORR, Bangalore East , Bangalore",Not Found,"Dec, 2028",660 - 2481 sq.ft.,25 Acres (70% open),"PRM/KA/RERA/1251/446/PR/200923/006269, PRM/KA/RERA/1251/446/PR/200923/006270, PRM/KA/RERA/1251/446/PR/200923/006271, PRM/KA/RERA/1251/446/PR/220923/006282, PRM/KA/RERA/1251/446/PR/220923/006283",,1875,"1, 3, 4 BHK Apartments",12,"Children's Play Area, Amphitheater, Yoga / Meditation Area, Cricket Pitch, Tennis Court, Reflexology Park, Swimming Pool, Skating Rink, Theme Park, Landscaping & Tree Planting, 24x7 CCTV Surveillance, +9 more",Not Found,Not Found,Not Found,0,1995,254,"Sobha Limited is one of fastest growing real estate companies in India with its operations spread across 13 states and 24 cities as well as in the Middle East. It was established in 1995 and has a market value of Rs 26 billion. The developer is headquartered in Bangalore and is engaged in the development of contractual and residential projects encompassing villas, row houses, plotted development, presidential apartments, luxury and super luxury apartments. Sobha Limited has attained ISO 14001:2004 and OHSAS 18001:2007 certifications for environmental, health and safety management systems. It has bagged various awards like ‘India’s Top 10 Builders Award’ by Construction World, ‘Builder of the Year’ and ‘Most Reliable Builder Award’ by CNBC, ‘Employer of the Year Award’ by Realty Plus and ‘Top Indian Real Estate Company’ by Dun & Bradstreet. Experience and Strengths",Under Construction,"Oct, 2023",₹14.1K/sq.ft
Sanjeevini Aarna,SANJEEVINI GROUP,"Dandupalya Village, Hoskote, Bangalore East , Bangalore",₹7.46 K/sq.ft,"Dec, 2025",940 - 1680 sq.ft.,2.37 Acres (75% open),PRM/KA/RERA/1250/304/PR/170524/006887,,224,"2, 2.5, 3 BHK Apartments",12,"Waiting Lounge, Gazebo, Swimming Pool, Skating Rink, Landscaping & Tree Planting, Mini Theatre, Gymnasium, Fire Fighting System, Car Parking, 24X7 Water Supply, Jogging Track, +22 more",Not Found,Not Found,Not Found,0,6,Not Found,"Throughout our journey, commitment to our Core Values has made Sanjeevini Group the ideal building partner for Bangalore’s most forward-thinking populous. Started in 2010, Sanjeevini Group continues to be a trusted partner in the commercial, residential and hospitality sectors, with an extensive portfolio of projects throughout Bangalore, with our core cluster in and around Whitefield.

WHY SANJEEVINIGROUPS
We undertake a variety of projects for a wide range of clientele and our unique and flexible project management systems ensure that a positive outcome is achieved regardless of size or nature of the project. Our success comes from a steadfast commitment to the client’s vision, a passion for collaborative building practices, and a culture of balance, integrity, leadership and loyalty. At Sanjeevini, we transform the construction experience through creation of an environment that fosters collaboration and project team engagement.

OUR PURPOSE
To Deliver Happiness

OUR VISION
With every brick we lay, we are raising our promise of giving you the very best. We not only committed in building homes, but rather engineering lifestyles that are modeled on luxury and charm, at the same time having an aspect of practicality and ease.

OUR MISSION
Our modus operandi lies in our ability to innovate, based on a customer-devoted approach and feedback. We ensure that our clients get truly international quality and amenities in a natural eco-friendly environment. Beyond the accolades, we believe your satisfaction and approval to be our unprecedented treasures.",Under Construction,"Apr, 2024",₹7.2K/sq.ft
