GGM/337/69/2019/31 DATED 24.05.2019,EMAAR DIGIHOMES,EMAAR MGF LAND LIMITED,"SECTOR 62, GURUGRAM",GURUGRAM,176,131,No,448,102,23,84,90,1228,73,25,809.365,0,373.99,Not Found,Not Found,22824.29 (Sqr/mtrs),Not available,Not available,IMPORTED MARBLE / VITRIFIED TILE / LAMINATED WOODEN FLOORING,ACRYLIC EMULSION + VITRIFIED / CERAMIC TILES,FACTORY FINISHED ENGINEERED DOOR AND UPVC WINDOW AND BALCONY DOORS,MODULAR SWITCHES,S.S. FINISH INSIDE LIFT CAR,MODULAR SWITCHES,ACRYLIC EMULSION,https://haryanarera.gov.in/assistancecontrol/view_corrigendum/ODEx,oc\GGM-337-69-2019-31 DATED 24.05.2019-OC_uploaded.pdf
GGM/334/66/2019/28 DATED 13.05.2019,THE BALCONY,PYRAMID PROPMOTO PVT. LTD.,"SECTOR-93, GURUGRAM",GURUGRAM,144.60,135.31,Yes,0,94.45,19.07,0,14.32,0,0,0,0,0,0.7555,Not Found,Not Found,5.0 (Acre),Not available,Not available,VITRIFIED & CERAMIC TILES,ISI MARKED,"WOODEN(DOOR FRAME), ALUMINIUMN /UPVC(WINDOW FRAME)",ISI MARKED,ISI MARKED,NA,NA,Not Found,Not Available
GGM/331/63/2019/25 DATED 13.05.2019,PYRAMID HEIGHTS,PYRAMID INFRATECH PVT. LTD.,"SECTOR-85, GURUGRAM",GURUGRAM,31.26,74.49,No,11.07,56.51,6.95,11.04,5.57,0,0,11.03,0,0,0,Not Found,Not Found,5.025 (Acre),Not available,Not available,I PS FLOORING,STONE COUNTER WITH TILE,EXTERNAL D/W M S- Z SECTION,AS PER STANDARD,AS PER STANDARD,AS PER STANDARD,NA,https://haryanarera.gov.in/assistancecontrol/view_corrigendum/MTA2OA==,oc\GGM-331-63-2019-25-OC_uploaded.pdf
GGM/325/57/2019/19 DATED 01.04.2019,ELEVATE PHASE I,HERITAGE MAX REALTECH PVT. LTD.,"SECTOR-59, GURUGRAM",GURUGRAM,181,192,No,596,106,14,36,14,876,0,23,0,0,3.04856,Not Found,Not Found,5.95 (Acre),Not available,Not available,TILES,FLOOR TILES PAINT ON CEILING,DOUBLE/SINGLE GLASS,LED FIXTURES,HIGH RISE : 4 NO.S – 13 PASSENGER LIFT & 1 NO.S – 15 PASSENGER SERVICE/FIREMAN LIFT MID RISE : 2 NO.S – 10 PASSENGER LIFT & 1 NO.S – 15 PASSENGER SERVICE/FIREMAN LIFT EWS : 1 NO.S – 15 PASSENGER SERVICE/FIREMAN LIFT COMMUNITY BUILDING : 1 NO.S - 13 PASSENGER LIFT & 1 NO.S – 13 PASSENGER SERVICE LIFT COMMERCIAL BLOCK: 1 NO.S - 10 PASSENGER LIFT HEALTH CLUB : 1 NO.S - 10 PASSENGER LIFT,LED,PAINT,Not Found,Not Available
GGM/324/56/2019/18 DATED 01.04.2019,TULIP PURPLE PHASE 2,TULIP INFRATECH PVT. LTD.,"SECTOR-69-70, GURUGRAM",GURUGRAM,44.65,19.5,Yes,26,22,15,100,50,0,-1,0,0,0,1091.90,224,0,17.9936 (Acre),31-12-2023,80,ANTI SKID TILES CERAMIC TILES/ VITRIFIED TILES OR EQUIVALENT,MARBLE/GRANITE COUNTER WITH SS SINK,UPVC/ HARDWOOD,SWITCHES ONLY (NO LIGHTS & FIXTURES),"2 NOS, CAPACITY10 & 13 PERSON, KONE OR EQUIVALENT",NOT APPLICABLE,PAINT FINISHES,Not Found,Not Available
GGM/316/48/2019/10 DATED 21.02.2019,PYRAMID FUSION HOMES,PYRAMID INFRATECH PRIVATE LIMITED,VILLAGE PALRA SECTOR 70A,GURUGRAM,37,69.5,No,0,64.58,7.51,20.37,6,0,0,0,0,0,1872.805,Not Found,Not Found,5.11875 (Acre),Not available,Not available,TILES/IPS,"2 FEET TILE ON WALL, OBD/COLOUR WASH ON REMAING WALL, TILE/STONE ON KITCHEN COUNTER.",HARDWOOD/ MS Z-SECTION/ FIBRE/ COMPOSITE/ ALUMINIUM/ FRAME WINDOWS ETC.,ISI MARK,2 LIFTS AS PER SANCTIONED PLAN,STANDARD,OBD/COLOUR WASH,https://haryanarera.gov.in/assistancecontrol/view_corrigendum/Mzkx,oc\GGM-316-48-2019-10-OC_uploaded.pdf
GGM/302/2018/34 DATED 07.12.2018,GODREJ AIR PHASE-III,GODREJ DEVELOPERS & PROPERTIES LLP,"SECTOR-85, GURUGRAM",GURUGRAM,186,67,No,213,46,41,131,57,461,0,10,0,0,0,Not Found,Not Found,2.312 (Acre),Not available,Not available,"VITRIFIED TILES IN LIVING/DINING, WOODEN FLOORING IN BEDROOMS, ANTI SKID TILES IN TOILETS, KITCHEN, BALCONY & UTILITY OR EQUIVALENT",COUNTER WITH SINK AND CP FITTINGS OR EQUIVALENT,"TEAK FRAME IN MAIN DOOR, RED MERANTI IN INTERNAL DOORS, ALUMINUM FRAME WITH GLASS FOR WINDOWS & SLIDING DOOR WINDOWS OR EQUIVALENT",ONLY SWITCHES,YES,ONLY SWITCH,N/A,Not Found,Not Available
GGM/301/2018/33 DATED 07.12.2018,GODREJ AIR PHASE-II,GODREJ DEVELOPERS & PROPERTIES LLP,SECTOR-85,GURUGRAM,150,33,No,103,22,20,64,28,224,0,5,0,0,0,Not Found,Not Found,1.727 (Acre),Not available,Not available,"VITRIFIED TILES IN LIVING/DINING, WOODEN FLOORING IN BEDROOMS, ANTI SKID TILES IN TOILETS, KITCHEN, BALCONY & UTILITY OR EQUIVALENT",COUNTER WITH SINK AND CP FITTINGS OR EQUIVALENT,"TEAK FRAME IN MAIN DOOR, RED MERANTI IN INTERNAL DOORS, ALUMINUM FRAME WITH GLASS FOR WINDOWS & SLIDING DOOR WINDOWS OR EQUIVALENT",ONLY SWITCHES,YES,ONLY SWITCH,N/A,https://haryanarera.gov.in/assistancecontrol/view_corrigendum/MTI3Mw==,oc\GGM-301-2018-33-OC_uploaded.pdf
GGM/300/2018/32 DATED 07.12.2018,GODREJ AIR PHASE-I,GODREJ DEVELOPERS & PROPERTIES LLP,"SECTOR-85, GURUGRAM",GURUGRAM,150,55,No,173,37,33,106,46,373,0,0,0,0,0,Not Found,Not Found,5.417 (Acre),Not available,Not available,"VITRIFIED TILES IN LIVING/DINING, WOODEN FLOORING IN BEDROOMS, ANTI SKID TILES IN TOILETS, KITCHEN, BALCONY & UTILITY OR EQUIVALENT",COUNTER WITH SINK AND CP FITTINGS OR EQUIVALENT,"TEAK FRAME IN MAIN DOOR, RED MERANTI IN INTERNAL DOORS, ALUMINUM FRAME WITH GLASS FOR WINDOWS & SLIDING DOOR WINDOWS OR EQUIVALENT",ONLY SWITCHES,YES,ONLY SWITCH,N/A,https://haryanarera.gov.in/assistancecontrol/view_corrigendum/MTI3NA==,oc\GGM-300-2018-32-OC_uploaded.pdf
GGM/295/2018/27 DATED 29.11.2018,JOYVILLE GURUGRAM-I,JOYVILLE SHAPOORJI HOUSING PVT LTD,"VILLAGE-KHERKI MAJRA, SECTOR-
102, TEHSIL-GURUGRAM, DISTRICT-GURUGRAM, HARYANA",GURUGRAM,37,10,No,20,37,10,37,0,0,0,0,0,0,0,Not Found,Not Found,0.97 (Acre),Not available,Not available,VITRIFIED OR LAMINATED WOODEN FLOORING OR CERAMIC TILE.,KITCHEN COUNTER TOP – BLACK GRANITE. SINK – S.S. SINK WITHOUT DRAINBOARD.,DOOR FRAME : RED MIRANTI WITH PAINT WINDOW FRAME : ALUMINIUM - POWDER - COATED,ALL SWITCHES AND SOCKETS WILL BE OF MODULAR TYPE - ANCHOR ROMA OR EQUIVALENT,2NOS. PASSENGER AND 1 NOS. SERVICE ELEVATOR,ALL SWITCHES AND SOCKETS WILL BE OF MODULAR TYPE - ANCHOR ROMA OR EQUIVALENT,AS ABOVE DETAILED.,https://haryanarera.gov.in/assistancecontrol/view_corrigendum/Mzgx,oc\GGM-295-2018-27-OC_uploaded.pdf
GGM/292/2018/24 DATED 13.11.2018,HERO HOMES,VIKAS PARK PVT LTD,"SECTOR-104, DHANWAPUR, GURUGR
AM",GURUGRAM,130.22,105.59,No,0,144.01,13.15,42.42,8.98,800,180,21.60,75,0,0,0,0,9.053 (Acre),31-08-2026,0,VITRIFIED TILES,CERAMIC TILES,HARDWOOD FRAMES FOR DOORS. UPVC WINDOWS.,SWITCH SOCKET PLUS DBS,PASSENGER PLUS STRETCHER LIFT ON EACH BUILDING,ALL WORKS COMPLETE UPTO SWITCH/SOCKET IN THE ENTIRE COMPLEX,CEMENT PLASTER WITH OBD/ACRYLIC EMULSION,https://haryanarera.gov.in/assistancecontrol/view_corrigendum/ODU0,oc\GGM-292-2018-24-OC_uploaded.pdf
GGM/290/2018/22 DATED 23.10.2018,ASHIANA MULBERRY,ASHIANA DWELLINGS PVT LTD,"SECTOR-2, SOHNA, GURUGRAM",GURUGRAM,20,20,No,40,20,0,5,20,300,30,0,0,0,643.07,180,42,2.81 (Acre),30-06-2023,7,AS PER ATTACHED SPECIFICATION & FEATURES,AS PER ATTACHED SPECIFICATION & FEATURES,AS PER ATTACHED SPECIFICATION & FEATURES,AS PER ATTACHED SPECIFICATION & FEATURES,AS PER ATTACHED SPECIFICATION & FEATURES,AS PER ATTACHED SPECIFICATION & FEATURES,AS PER ATTACHED SPECIFICATION & FEATURES,https://haryanarera.gov.in/assistancecontrol/view_corrigendum/OTI1,oc\GGM-290-2018-22 DATED 23.10.2018-OC_uploaded.pdf
GGM/286/2018/18 DATED 12.10.2018,ROSELIA-2,FOREVER BUILDTECH PVT LTD,"VILLAGE WAZIRPUR, SECTOR-95A,
TEHSIL-HARSARU, DISTRICT-GURUGRAM, HARYANA",GURUGRAM,87.61,90.63,Yes,0,54.26,8.77,0,2.18,0,0,0,0,0,0,431,416,2.5313 (Acre),30-10-2021,33.08,VITRIFIED & CERAMIC TILES,ISI MARKED,"WOODEN(DOOR FRAME), UPVC(WINDOW FRAME)",ISI MARKED,NA,ISI MARKED,NA,https://haryanarera.gov.in/assistancecontrol/view_corrigendum/OTQx,oc\GGM-286-2018-18 DATED 12.10.2018-OC_uploaded.pdf
GGM/280/2018/12 DATED 27.07.2018,"SOBHA CITY (PHASE-2, PART-1)",SOBHA LIMITED,"SECTOR-108, GURUGRAM",GURUGRAM,45.17,52.10,Yes,0,29,0,0,1.53,0,0,0,0,0,0.3192622,0,43,0.7906 (Acre),31-03-2021,14,NATURAL / ENGINEERED STONE FLOORING AND SKIRTING/ LAMINATED WOODEN FLOORING AND SKIRTING / VITRIFIED TILE FLOORING AND SKIRTING /CERAMIC TILE.,"CERAMIC TILE FLOORING, WALL TILING & PLASTIC EMULSION PAINT FOR CEILING.",FRAME – TIMBER FRAME & SHUTTERS – WITH BOTH SIDE MASONITE SKIN.,FITTING OF REPUTED MAKE APPROVED BY ISI & IS SPECIFICATION.,CAPACITY - 1 NO. OF 15 PASSENGER & 2 NOS. OF 8 PASSENGER LIFT OF REPUTED MAKE.,NA,PLASTIC EMULSION PAINT FOR WALLS & CEILING.,Not Found,Not Available
GGM/271/2018/03 DATED 08.05.2018,WATERFALL RESIDENCE,KRISUMI CORPORATION PRIVATE LIMITED,"VILLAGE SIHI & HARSARU,SECTOR
-36A,GURUGRAM-MANESAR",GURUGRAM,115,214,Yes,110,48,2.75,350,125,1079,22.82,10,0,0,0,0,0,27.48125 (Acre),30-06-2024,0.3,"ENGINEERED WOODEN FLOORING, PREMIUM QUALITY LAMINATED WOODEN FLOORING, VITRIFIED TILES","VITRIFIED TILES, TILES AND ACRYLIC EMULSION PAINT, ACRYLIC EMULSION PAINT ON FALSE CEILING, GRANITE STONE, MODULAR KITCHEN WITH HOB AND CHIMNEY, CP FITTINGS SINK WITH DRAIN BOARD.",NA,NA,"4 HIGH SPED PASSENGER ELEVATORS IN EACH TOWER. AS A SPECIAL SECURITY FEATURE, EACH TOWER HAS 2 ELEVATORS FROM THE BASEMENT.",MODULAR SWITCHES LED LIGHTING FIXTURE IN BALCONY TOILET KITCHEN AND CORRIDOR.,NA,https://haryanarera.gov.in/assistancecontrol/view_corrigendum/MTA1NQ==,oc\GGM-271-2018-03-OC_uploaded.pdf
GGM/820/552/2024/47 DATED 29.04.2024,BPTP THE AMAARIO,COUNTRYWIDE PROMOTERS PRIVATE LIMITED,37 D GURUGRAM,GURUGRAM,72.00,60.00,Yes,220.00,135.00,4.83,55.00,370.00,0,0,40.00,0,0,0,Not Found,Not Found,4.76 (Acre),Not available,Not available,"ENGGINERED WOODDEN, PERGO/LOTUS KALEEN/ACTION",GREENPLY/SOHA/SPACEWOOD/GREENLAM/ARCHIDPLY/MERINO/CENTURY/KITPLY/KUTTY/ANCHO/EURO OR EQUIVALENT MAKE,GLAZED WINDOWS WITH UPVC/AL/MS FRAMES ALUPLAST/DECUNIK/ENCRAFT/ASAHI/KOMMERLING/SHEDA/LG/SCHUCO/ALUK/ALUMIL/REYNAERS/MAHAVIR/HINDALCO/JINDAL/BHORUKA/EQUIVALENT,"SWITCH CONTROL FOR LIGHT, FAN GEYSER AND AC ETC. HOME AUTOMATION IN SELECT AREAS AS PER DESIGN",IP CAMERAS IN SELECTED AREAS OTIS/MITSUBISHI/KONE/THYSSENKRUPP OR EQUIVALENT,"SP MCB(6-20AMP) 10KA, 4P MCB(32-63AMP)16KA, LEGRAND/HAGER/ABB/SCHNEDIER/SIEMENS/HAVELLS/L&T OR EQUIVALENT MAKE","ACRYLIC EMULSION / OBD, ASIAN/BERGER/AKZONOBEL/JOTUN/KENAI NEROLAC OR EQUIVALENT MAKE",Not Found,Not Available
157 OF 2017 DATED 28.08.2017,AIPL JOY STREET,ADVANCE INDIA PROJECTS LTD.,"SECTOR-66, VILLAGE MEDAWAS &
BADSHAHPUR, GURUGRAM",GURUGRAM,169.91,382.10,No,420.98,110.93,24.36,162.41,0,0,0,0,0,0,0,634,602,3.95 (Acre),30-06-2021,70,NOT APPLICABLE,NOT APPLICABLE,NOT APPLICABLE,NOT APPLICABLE,"9 PASSENGER LIFTS, 3 SERVICE LIFT",NOT APPLICABLE,CEMENT PLASTER,https://haryanarera.gov.in/assistancecontrol/view_corrigendum/NzEw,oc\99 OF 2017-OC_uploaded.pdf
219 OF 2017 DATED 18.09.2017,2.9812 ACRES COMMERCIAL PROJECT,PLUS PROJECTS PVT. LTD,"SECTOR-62, GURUGRAM",GURUGRAM,48.26,130.36,No,200,20,3.75,150,0.86,0,0,0,0,0,0,53,49,0.92 (Acre),30-06-2019,100,"GRANITE IN OPEN COURTYARD , PASSAGE , CORRIDORS & STAIRS , VITRIFIED TILES FLOORING","MODULAR TYPE AND OZONE CHANNELS , FLOORING CERAMIC TILES",CHOKHAT FRAME & WINDOW SHUTTER OF SAG WAN AND POLISHABLE WOOD,"GEYSER , FAN",4 LIFT,"GEYSER , FAN",POP AND PAINT,Not Found,Not Available
12 OF 2017 DATED 03.07.2017,ANDOUR HEIGHTS,SARVPRIYA SECURITIES PVT.LTD.,"SECTOR-71, GURURGAM",GURUGRAM,52.17,139.24,Yes,0,114.18,8.29,0,7.56,0,0,0,0,0,0,980,1050,6.00 (Acre),14-03-2020,100,VITRIFIED & CERAMIC TILES,ISI MARKED,"WOODEN(DOOR FRAME), UPVC(WINDOW FRAME)",ISI MARKED,NA,ISI MARKED,NA,https://haryanarera.gov.in/assistancecontrol/view_corrigendum/NDg3,oc\96 OF 2017-OC_uploaded.pdf
391 OF 2017 DATED 22.12.2017,AANGAN,ALTON BUILDTECH INDIA PVT. LTD.,"SECTOR 88-A TO 89-A, SUB-TEHS
IL HARSARU, GURUGRAM, HARYANA",GURUGRAM,58,14,No,157,41,0,0,0,0,0,0,0,0,0.3519,420,234,1.8125 (Acre),15-12-2022,0,1 HABITABLE SPACES- VITRIFED TILE. 2 TOILET & BALCONY - CERAMIC TILE,1. KITCHEN PLATE FORM -GREEN MARBLE. 2 DADO ABOVE PLATFORM-CERAMIC (600 MM HEIGHT),1. DOOR FRAME -WOODEN 2 WINDOWS- M S Z SECTION,LED FITTING IN COMMON AREAS,TWO NOS IN EACH TOWER ( 1 PASSENGER & 1 STRETCHER CUM FIRE LIFT ),ELECTRICAL POINTS WITH SWTCH & SOCKET AND DB,OBD PAINT,Not Found,Not Available
190 OF 2017 DATED 14.09.2017,COMMERCIAL COLONY,ELAN BUILDCON PVT. LTD.,"SECTOR 84, VILLAGE HAYATPUR,
GURUGRAM",GURUGRAM,0,125,No,550,80,35,660,0,0,0,100,0,0,0,396,320,5.91875 (Acre),13-09-2023,42,VITRIFIED TILES,KITCHEN ATE COUNTER GRANITE & PLY CABINET WITH LAMINATE FINISH,WOODEN DOOR FRAMES ALUMINIUM FRAME WINDOWS,ABB/ L&T SCHNIDER,MITSUBISHI ( LIFT) OTLS ( ESCALATORS),NA,INTERNAL GRADE POINT,https://haryanarera.gov.in/assistancecontrol/view_corrigendum/ODUy,oc\90 OF 2017-OC_uploaded.pdf
391 OF 2017 DATED 22.12.2017,AANGAN,ALTON BUILDTECH INDIA PVT. LTD.,"SECTOR 88-A TO 89-A, SUB-TEHS
IL HARSARU, GURUGRAM, HARYANA",GURUGRAM,58,14,No,157,41,0,0,0,0,0,0,0,0,0.3519,420,234,1.8125 (Acre),15-12-2022,0,1 HABITABLE SPACES- VITRIFED TILE. 2 TOILET & BALCONY - CERAMIC TILE,1. KITCHEN PLATE FORM -GREEN MARBLE. 2 DADO ABOVE PLATFORM-CERAMIC (600 MM HEIGHT),1. DOOR FRAME -WOODEN 2 WINDOWS- M S Z SECTION,LED FITTING IN COMMON AREAS,TWO NOS IN EACH TOWER ( 1 PASSENGER & 1 STRETCHER CUM FIRE LIFT ),ELECTRICAL POINTS WITH SWTCH & SOCKET AND DB,OBD PAINT,Not Found,Not Available
28 OF 2017 DATED 28.07.2017,70 GRANDWALK,SHINE BUILDCON PVT. LTD.,"SECTOR-70, GURUGRAM",GURUGRAM,46.13,85.76,Yes,0,22.92,5.33,0,0,0,0,0,0,0,0,511,232,2.893 (Acre),30-06-2022,0,"GF CENTRAL PLAZA - PAVERS/ TILES, COMMON TOILETS - VITRIFIED / CERAMIC TILES, CORRIDORS / PASSAGE - VITRIFIED / CERAMIC TILES, RETAIL SHOPS - BARE SHELL, COMMON STAIRCASE - KOTA STONE, LIVING ROOM - VITRIFIED FLOORING / LAMINATED WOODEN FLOORING, BALCONY - ANTI-SKID CERAMIC TILES.","WALLS - CERAMIC TILE UP TO 2FT.ABOVE COUNTER AND OIL BOUND DISTEMPER IN THE BALANCE AREA, COUNTER: POLISHED GRANITE COUNTER TOP, FITTING/FIXTURES : CP FITTINGS, SINGLE BOWL STAINLESS STEEL SINK.","ENTRANCE DOORS - SEASONED WOODEN FRAME WITH HARDWOOD (POLISHED) DOOR SHUTTER, INTERNAL DOORS : SEASONED WOODEN FRAME WITH MOULDED SKIN DOOR SHUTTER, EXTERNAL DOOR /WINDOWS : UPVC/ALUMINIUM SLIDING/SWING GLASS SHUTTER.",BRANDED MODULAR SWITCHES AND SOCKETS.,7 PASSENGER 1 SERVICE,BRANDED MODULAR SWITCHES AND SOCKETS. COPPER WIRING,PLASTER WITH PAINT,Not Found,Not Available
184 OF 2017 DATED 14.09.2017,AFFORDABLE GROUP HOUSING COLONY,CHIRAG BUILDTEC PRIVATE LIMITED,"SECTOR 95, VILLAGE DHORKA, GR
UGRAM",GURUGRAM,41.44,176.20,Yes,10.91,69.74,7.69,12.24,0,0,0,0,0,0,0.3811,0,640,5.04375 (Acre),01-02-2018,45,CERAMIC/VITRIFIED TILES,"CERAMIC TILES, PAINT, GREEN MARBLE, SINK","BALCONY DOORS, WINDOWS- ALUMINIUM FRAMING WITH GLASS",LED LIGHTS IN COMMON AREA,12-13 PASSENGER WITH ARD,LED LIGHTS IN COMMON AREA,PAINT,https://haryanarera.gov.in/assistancecontrol/view_corrigendum/NDc2,oc\84 OF 2017-OC_uploaded.pdf
337 OF 2017 DATED 27.10.2017,83 METRO STREET,S.V HOUSING PVT. LTD.,"SETOR - 83, GURUGRAM",GURUGRAM,173.05,179.90,No,1364.92,71.95,16.12,620.49,0,0,0,90.00,0,0,4752.420,Not Found,Not Found,4.20 (Acre),Not available,Not available,STONE / TILE FLOORING IN COMMON AREAS,N/A,ALUMINIUM FRAMES WITH GLASS,ELECTRICAL FITTINGS & FIXTURES NOT PROVIDED,10 NOS,ELECTRICAL FITTINGS & FIXTURES NOT PROVIDED,CEMENT / GYPSUM PLASTER IN COMMON AREAS,Not Found,Not Available
219 OF 2017 DATED 18.09.2017,2.9812 ACRES COMMERCIAL PROJECT,PLUS PROJECTS PVT. LTD,"SECTOR-62, GURUGRAM",GURUGRAM,48.26,130.36,No,200,20,3.75,150,0.86,0,0,0,0,0,0,53,49,0.92 (Acre),30-06-2019,100,"GRANITE IN OPEN COURTYARD , PASSAGE , CORRIDORS & STAIRS , VITRIFIED TILES FLOORING","MODULAR TYPE AND OZONE CHANNELS , FLOORING CERAMIC TILES",CHOKHAT FRAME & WINDOW SHUTTER OF SAG WAN AND POLISHABLE WOOD,"GEYSER , FAN",4 LIFT,"GEYSER , FAN",POP AND PAINT,Not Found,Not Available
38 OF 2017 DATED 10.08.2017,2.425 ACRES COMMERCIAL COLONY,OJOS DEVELOPERS PVT. LTD.,"SECTOR 70, GURUGRAM",GURUGRAM,0,133.70,Yes,0,60.02,9.31,0,0,0,0,0,0,0,0,264,175,9813.611 (Sqr/mtrs),31-12-2020,100,BARE SHELL,NA,NA,NA,NA,NA,BARE SHELL,https://haryanarera.gov.in/assistancecontrol/view_corrigendum/NjUx,oc\75 OF 2017-OC_uploaded.pdf
57 OF 2017 DATED 17.8.2017,AMB SELFIE SQUARE ( COMMERCIAL PROJECT),VS REALPROJECTS PVT.LTD,"SECTOR-37D, HARSARU, GURUGRAM",GURUGRAM,200,500,No,975,200,200,300,0,0,0,100,0,0,0.4146,660,623,3.775 (Acre),31-12-2021,0,VITREOUS TILES,ANTI SKID TILES,ALUMINIUM,HAVELLS,OTIS,HAVELLS OR EQUIVALENT,NA,Not Found,Not Available
GGM/373/105/2019/67 DATED 06.11.2019,WESTERLIES,EXPERION DEVELOPERS PRIVATE LIMITED,SECTOR 108,GURUGRAM,25099000,1835000,Yes,4696000,4377000,0,0,4972000,0,0,0,0,0,0,0,0,10.04625 (Acre),30-07-2020,80,NOT APPLICABLE,NOT APPLICABLE,NOT APPLICABLE,NOT APPLICABLE,NOT APPLICABLE,NOT APPLICABLE,NOT APPLICABLE,https://haryanarera.gov.in/assistancecontrol/view_corrigendum/MzI3,oc\67 DATED 06.11.2019-OC_uploaded.pdf
57(A) OF 2017 DATED 17.8.2017,M3M MARINA/M3M SIERRA 68 ( GROUP HOUSING COLONY),HANS PROPCON PVT. LTD,"SECTOR-68, GURUGRAM",GURUGRAM,616.56,432.32,No,1085.48,0,98.28,575.9,84.6,426.14,13.35,18.77,0.31313,0,0.6918,1076,456,13.2118 (Acre),31-01-2022,36,VITRIFIED TILE/LAMINATED /CERAMIC TILE,NA,N.A.,BRANDED,NA,BRANDED,PLASTER WITH PAINT,https://haryanarera.gov.in/assistancecontrol/view_corrigendum/NTUw,oc\57(A) OF 2017-OC_uploaded.pdf
56 OF 2017 DATED 17.8.2017,M3M LATITUDE ( TOWER R-01),MANGLAM MULTIPLEX PVT. LTD AND OTHERS,"SECTOR-65, GURUGRAM, HARYANA",GURUGRAM,320.00,816.31,Yes,514.38,0,25.00,492.26,37.50,1329.99,0,0,0,0,0,160,109,1.2125 (Acre),31-01-2023,25.29,"LAMINATED WOODEN, IMPORTED MARBLE, ANTI SKID CERAMIC/VITRIFIED TILES",NA,"FLUSH SHUTTER WITH WOODEN DOOR FRAME , ALUMINIUM GLAZING POWDER COATED",BRANDED,HIGH SPEED ELEVATOR,BRANDED,"GRADE PAINT, GLAZINGS",https://haryanarera.gov.in/assistancecontrol/view_corrigendum/NTQ5,oc\56 OF 2017 DATED 17.8.2017-OC_uploaded.pdf
15 OF 2018 DATED 19.01.2018,10.5437 ACRES GROUP HOUSING COLONY,CHD DEVELOPERS LTD.,"SECTOR-71, GURUGRAM",GURUGRAM,Not Found,Not Found,Not Found,Not Found,Not Found,Not Found,Not Found,Not Found,Not Found,Not Found,Not Found,Not Found,Not Found,Not Found,Not Found,Not Found,Not available,Not available,Not available,Not available,Not available,Not available,Not available,Not available,Not available,Not available,Not Found,Not Available
54 OF 2017 DATED 17.08.2017,GODREJ ICON (ICONIC TOWER),OASIS LANDMARKS LLP,"SECTOR 88-A & 89-A, HARSARU,
GURUGRAM",GURUGRAM,521,373,Yes,1399,144,86,230,82,1300,106.07,50,500,0,10020.1,88,21,0.475 (Acre),08-09-2020,100,"VITRIFIED TILE OR EQUIVALENT IN LIVING/DINING, WOODEN FLOORING OR EQUIVALENT IN BEDROOMS, ANTI-SKID TILES OR EQUIVALENT IN TOILETS, KITCHEN, BALCONY & UTILITY",GRANITE COUNTER WITH SINK AND CP FITTINGS,"TEAK FRAME IN MAIN DOOR, RED MERANDI/ FLUSH DOOR IN INTERNAL DOORS, ALUMINIUM FRAME WITH GLASS FOR WINDOWS & SLIDING DOOR WINDOWS",PHILLIPS OR EQUIVALENT LED LIGHTS IN COMMON AREA,STONE ARCHITRAVE AND ITALIAN MARBLE FLOORING IN CAR BODY AND GRANITE CLADDING,LED LIGHTS IN COMMON AREA,ACRYLIC EMULSAN,https://haryanarera.gov.in/assistancecontrol/view_corrigendum/NTQ4,oc\54 OF 2017 DATED 17.08.2017-OC_uploaded.pdf
53 OF 2017 DATED 17.08.2017,GODREJ OASIS,OASIS LANDMARKS LLP,"SECTOR 88-A & 89-A, HARSARU,
GURUGRAM",GURUGRAM,207.89,173.36,Yes,1368.39,134.07,0,164.89,4.17,0,0,0,0,0,137.76,311,259,4.40 (Acre),30-09-2019,100,VITRIFIED TILES IN LIVING DINING,KITCHEN FLOORING CERAMIC TILES,"""1)MAIN DOOR FRAME TEA WOOD 2)INTERNAL DOOR FRAME RED MARANDI 3) EXTERNAL FRAMES OF ANODISED ALUMINIUM""",NA,STONE ARCHITRAVE AND ITALIAN MARBLE FLOORING IN CAR BODY AND GRANITE CLADDING,PHILLIPS LED LIGHTS IN COMMON AREA,NA,https://haryanarera.gov.in/assistancecontrol/view_corrigendum/NTQ3,oc\53 OF 2017 DATED 17.08.2017-OC_uploaded.pdf
50 OF 2017 DATED 12.08.2017,GODREJ ICON,OASIS LANDMARKS LLP,"SECTOR 88-A & 89-A, HARSARU,
GURUGRAM",GURUGRAM,306.61,10.05,Yes,917.56,10.05,22.16,77.19,78.65,1081.12,10,42.08,0,0,9779.21,0,0,14.684 (Acre),31-12-2021,40,VITRIFIED TILES IN LIVING DINING ICONIC TOWER:ITALIAN MARBLE IN LIVING DINNING AND STUDY ROOM,KITCHEN FLOORING CERAMIC TILES,"1)MAIN DOOR FRAME TEA WOOD 2)INTERNAL DOOR FRAME RED MARANDI 3) EXTERNAL FRAMES OF ANODISED ALUMINIUM ICONIC:""1)MAIN DOOR FRAME TEA WOOD 2)INTERNAL DOOR FRAME RED MARANDI 3) EXTERNAL FRAMES OF POWDER COATED ALUMINIUM",NA,STONE ARCHITRAVE AND ITALIAN MARBLE FLOORING IN CAR BODY AND GRANITE CLADDING,PHILLIPS LED LIGHTS IN COMMON AREA,NA,https://haryanarera.gov.in/assistancecontrol/view_corrigendum/NTQ2,oc\50 OF 2017 DATED 12.08.2017-OC_uploaded.pdf
47 OF 2017 DATED 26.10.2017,LUMINARE PHASE I(SIRIUS),MAHINDRA HOMES PVT. LTD,"SECTOR 59, VILLAGE BEHRAMPUR,
TEHSIL SOHNA, GURUGRAM",GURUGRAM,0,198.06,Yes,0,0,26.09,0,0,0,0,0,0,0,1.738,120,90,2.609 (Acre),22-01-2019,100,"ITALIAN MARBLE,LAMINATED WOODEN FLOOR, ANTI-SKID VITRIFIED TILES,","MODULAR KITCHEN CABINET WITH GRANITE COUNTER TOP/ HOB, CHIMNEY","DOORS- HARDWOOD FRAME WITH FLUSH DOOR WITH VENEER FINISH (ON BOTH SIDE) BOTH SIDE LAMINATED FINISH FLUSH DOOR WITH HARDWOOD FRAME, WINDOWS- UPVC FRAMED DOUBLE GLAZING UNIT",NA,HIGH SPEED ELEVATORS- BY THYSSENKRUPP,NA,LOW VOC ACRYLIC EMULSION,https://haryanarera.gov.in/assistancecontrol/view_corrigendum/NDU1,oc\47 OF 2017 DATED 26.10.2017-OC_uploaded.pdf
42 OF 2017 DATED 26.10.2017,LUMINARE PHASE 2(SOLARIS),MAHINDRA HOMES PVT. LTD.,"SEC 59, VILLAGE BEHRAMPUR, SO
HNA, GURUGRAM",GURUGRAM,0,198.06,Yes,0,0,26.09,0,0,0,0,0,0,0,1.679,0,40,2.77 (Acre),31-03-2021,59.24,"ITALIAN MARBLE, LAMINATED WOODEN FLOORING, ANTI-SKID VITRIFIED TILE,","MODULAR KITCHEN CABINET WITH GRANITE COUNTER TOP/ HOB, CHIMNEY","DOORS- HARDWOOD FRAME WITH FLUSH DOOR WITH VENEER FINISH (ON BOTH SIDE) BOTH SIDE LAMINATED FINISH FLUSH DOOR WITH HARDWOOD FRAME, WINDOWS- UPVC FRAMED DOUBLE GLAZING UNIT",NA,HIGH SPEED ELEVATORS- BY THYSSENKRUPP,NA,LOW VOC ACRYLIC EMULSION,https://haryanarera.gov.in/assistancecontrol/view_corrigendum/NDkw,oc\42 OF 2017 DATED 26.10.2017-OC_uploaded.pdf
379 OF 2017 DATED 22.12.2017,THE CORRIDORS (PHASE 3),IREO GRACE REALTECH PVT.LTD.,"SECTOR 67-A, VILLAGE DHUMASPU
R AND MAIDAWAS, TEHSIL SOHNA,GURUGRAM, HARYANA",GURUGRAM,1800,600,Yes,0,1800,50,110,30,0,0,110,0,0,0,328,13,8.63 (Acre),31-12-2023,0,STONE/ WOODEN/ TILES,"MODULAR KITCHEN WITH HOB, HOOD, SOLID SURFACE COUNTER TOP, STAINLESS STEEL SINK AND CP FITTINGS/VITRIFIES TILES/ACRYLIC EMULSION",POWDER-COATED ALUMINIUM WINDOWS & FRAMES,-,-,-,ACRYLIC EMULSION,Not Found,Not Available
378 OF 2017 DATED 07.12.2017,THE CORRIDORS (PHASE 1),IREO GRACE REALTECH PVT.LTD.,"SECTOR 67-A, VILLAGE DHUMASPU
R & MAIDAWAS, TEHSIL SOHNA, GURUGRAM, HARYANA",GURUGRAM,1200,950,No,5650,500,150,1400,200,4200,0,20,0,0,19745.678,658,394,13.152 (Acre),30-06-2021,90,STONE/ WOODEN/ TILES,"MODULAR KITCHEN WITH HOB, HOOD, SOLID SURFACE COUNTER TOP, STAINLESS STEEL SINK AND CP FITTINGS/VITRIFIES TILES/ACRYLIC EMULSION",POWDER-COATED ALUMINIUM WINDOWS & FRAMES,-,1 PASSANGER AND 1 SERVICE LIFT,-,ACRYLIC EMULSION,https://haryanarera.gov.in/assistancecontrol/view_corrigendum/OTY5,oc\378 of 2017-OC_uploaded.pdf
38 OF 2017 DATED 10.08.2017,2.425 ACRES COMMERCIAL COLONY,OJOS DEVELOPERS PVT. LTD.,"SECTOR 70, GURUGRAM",GURUGRAM,0,133.70,Yes,0,60.02,9.31,0,0,0,0,0,0,0,0,264,175,9813.611 (Sqr/mtrs),31-12-2020,100,BARE SHELL,NA,NA,NA,NA,NA,BARE SHELL,https://haryanarera.gov.in/assistancecontrol/view_corrigendum/NjUx,oc\37 OF 2017 DATED 10.08.2017-OC_uploaded.pdf
367 OF 2017 DATED 24.11.2017,IREO SKYON,IREO PVT.LTD.,"SECTOR -60, VILLAGE ULLHAWAS,
GURUGRAM,HARYANA",GURUGRAM,0,0,Yes,0,0,0,0,0,0,0,0,1663.868,0,0,Not Found,Not Found,0.695 (Acre),Not available,Not available,N.A,N.A,N.A,N.A,N.A,N.A,N.A,Not Found,Not Available
36(A) OF 2017 DATED 05.12.2017,GURGAON GREENS,EMAAR MGF LAND LTD.,"SECTOR -102, VILLAGE DHANKOT,
GURUGRAM",GURUGRAM,261.06,132.27,Yes,55.90,94.15,110.95,460.32,500.21,415.96,53.31,22.70,49.45,0,0.91,687,660,13.531 (Acre),31-12-2019,100,VITRIFIED TILES / LAMINATED WOODEN FLOORING,NA,SEASONED HARDWOOD FRAME / UPVC,MODULAR SWITCHES,PROVIDED,MODULAR SWITCHES,NA,https://haryanarera.gov.in/assistancecontrol/view_corrigendum/NjE=,oc\36(A) OF 2017 DATED 05.12.2017-OC_uploaded.pdf
27 OF 2017 DATED 28.08.2017,HABITAT,PRIME INFRASTRUCTURE PVT. LTD,"99-A, VILLAGE DHANKOT, GURUGR
AM",GURUGRAM,152.6,218,No,300,168.8,22.9,70.5,25,48,0,16,0,0,3833.991,816,804,5.95625 (Acre),22-01-2021,2,"IMPORTED STONE FLOORING IN LIVING & DINNING, WOODEN FLOORING IN BEDROOMS AND TILE IN TOILET, KITCHEN, UTILITY AREA AND BALCONY.",STONE COUNTER TOP WITH 2FEET HIGH CERAMIC TILES ABOVE THE COUNTER AND CERAMIC TILE ON FLOOR 396 X 396 MM.,DOOR FRAMES - WOODEN WINDOW FRAMES - UPVC.,NA,"TOTAL 17 NOS LIFTS , 07 ARE STRETCHER LIFTS AND 10 ARE PASSENGER LIFTS.",ISI MARKED,"PLASTIC EMULSION, OBD, ENAMEL & WHITE WASH.",https://haryanarera.gov.in/assistancecontrol/view_corrigendum/MTA2Ng==,oc\357 OF 2017-OC_uploaded.pdf
354 OF 2017 DATED 17.11.2017,"ENIGMA, PHASE-2",ATHENA INFRASTRUCTURE LTD.,"SECTOR-110, VILLAGE PAWALA KH
USRUPUR, GURUGRAM",GURUGRAM,449.21,216.63,No,890.41,276.81,22.83,300.88,4.26,1900.00,0,11.42,0.2,0,0,163,144,80354.381 (Sqr/mtrs),30-09-2020,85,IMPORTED MARBLE / WOODEN FLOORING / ANTI SKID VITRIFIED TILES / ANTI SKID PREMIUM CERAMIC TILES / ANTI SKID TILES,GRANITE COUNTER TOP WITH BACK SPLASH IN GRANITE SS DOUBLE SINK AND IMPORTED CP FITTINGS.,GLAZED SLIDING SHUTTERS WITH UPVC / FRAMES WITH CLEAR / FROSTED GLASS,MODULAR SWITCHES.,PASSENGER AND SERVICE LIFTS,ISI APPROVED MAKES,AS SPECIFIED EARLIER,Not Found,Not Available
353 OF 2017 DATED 20.11.2017,"ENIGMA, PHASE-1A",ATHENA INFRASTRUCTURES LTD.,"SECTOR-110, VILLAGE PAWALA KH
USRUPUR, GURUGRAM, HARYANA",GURUGRAM,495.68,183.18,No,744.22,234.06,19.08,254.42,4.70,101.06,113.85,9.54,0,0,0,126,112,80354.381 (Sqr/mtrs),31-03-2018,100,IMPORTED MARBLE / WOODEN FLOORING / ANTI SKID VITRIFIED TILES / ANTI SKID PREMIUM CERAMIC TILES / ANTI SKID TILES,GRANITE COUNTER TOP WITH BACK SPLASH IN GRANITE SS DOUBLE SINK AND IMPORTED CP FITTINGS.,GLAZED SLIDING SHUTTERS WITH UPVC / FRAMES WITH CLEAR / FROSTED GLASS,MODULAR SWITCHES.,PASSENGER AND SERVICE LIFTS,ISI APPROVED MAKES,AS SPECIFIED EARLIER,https://haryanarera.gov.in/assistancecontrol/view_corrigendum/NTA0,oc\353 OF 2017-OC_uploaded.pdf
