TOR/PRM/KA/RERA/1251/446/PR/230419/001674,DNR ARISTA PHASE 1,Partnership Firm,BENGALURU URBAN,INESA VENTURES LLP,Residential/Group Housing,12-12-2024,APPROVED,"Kaikondarahalli village , Varthur Hobli",3 bed - 4,104SqMtr,12SqMtr,12,10SqMtr,,,,
TOR/PRM/KA/RERA/1251/310/PR/230120/001682,KEYA SPRING,Society,BENGALURU URBAN,SPACIO APARTMENT OWNERS ASSOCIATION,Residential/Group Housing,08-05-2024,APPROVED,"Sy No 85/1 & 85/2, Arakere Village, Begur Hobli, Bangalore South Taluk, Bannerghatta Road",3BHK,2166SqMtr,0SqMtr,17,0SqMtr,,,,
TOR/PRM/KA/RERA/1251/309/PR/221116/000068,SHRIRAM SOLITAIRE,Company,BENGALURU URBAN,SHRIPROP HOMES PRIVATE LIMITED,Residential/Group Housing,15-05-2025,APPROVED,"Survey no 4/4 , Veerasagara village, Attur post, Yelahanka",Residential apartments,7316SqMtr,125SqMtr,106,269SqMtr,,,,
TOR/PRM/KA/RERA/1251/309/PR/211028/002104,NITESH NAPA VALLEY,Company,BENGALURU URBAN,TRUE-BLUE REALTY PRIVATE LIMITED,Residential/Group Housing,29-12-2022,APPROVED,"NITTE Meenakshi College Road Off Bellary Road near Ryan International School, Vadeyarapura Village Yelahanka",Villas,29139SqMtr,0SqMtr,75,1917SqMtr,,,,
TOR/PRM/KA/RERA/1250/301/PR/221116/001916,SHRIRAM PRISTINE ESTATES,Company,BENGALURU RURAL,SPL HOUSING PROJECTS PRIVATE LIMITED,Plotted Development,15-05-2025,APPROVED,"Siddenayakanahalli, Muthur, Raghunathapura village",PLOTS,74288SqMtr,0SqMtr,376,0SqMtr,,,,
PRM/KA/RERA/1251/309/PR/290822/005198,NEW HAVEN BENGALURU PHASE V,Company,BENGALURU URBAN,SMART VALUE HOMES (PEENYA PROJECT) PRIVATE LIMITED,Residential/Group Housing,30-09-2023,APPROVED,,,,,,,,,,
PRM/KA/RERA/1273/319/PR/080824/006966,HERITAGE HEIGHTS,Partnership Firm,UDUPI,DHARMA ASSOCIATE,Mixed Development,31-03-2027,APPROVED,"SADANANDA KAMATH ROAD , KOTE KOPPALA , Karkala , Udupi, Karnataka - 574104",,,,,,,,,
PRM/KA/RERA/1273/318/PR/220923/006288,ARCHANA SIGNATURE,Partnership Firm,UDUPI,ARCHANA PROJECTS,Residential/Group Housing,19-09-2028,APPROVED,,,,,,,,,,
PRM/KA/RERA/1270/302/PR/230522/004906,LTG AISHWARYA INDRAPRASTHA,Company,RAMANAGARA,LTG INFRASTRUCTURE LIMITED,Plotted Development,10-01-2027,APPROVED,,,,,,,,,,
PRM/KA/RERA/1270/302/PR/210731/004204,SALARPURIA SATTVA ASHRAYA,Other,RAMANAGARA,NEELANCHAL DWELLINGS LLP,Residential/Group Housing,15-03-2025,APPROVED,"Survey No 1 and Survey No 43/3, Lakshmisagara Village, Bidadi Hobli, Ramanagar Taluk",1BHK+1 TOI,516SqMtr,0SqMtr,83,29SqMtr,,,,
PRM/KA/RERA/1268/378/PR/180507/001617,BHIMA ASHVINI 2,Individual,MYSORE,SHIVAKUMAR,Plotted Development,30-08-2019,APPROVED,"SY NO 204/1, 204/3, 204/4, 205, 207/8, 207/9, 208/2, 208/5, 208/6, & 208/7. OF MANDAKALLI VILLAGE KASABA HOBLI MYSORE TQ & MYSORE DISTRICT, NA",,,,,,,,Not found,Not found
PRM/KA/RERA/1268/378/PR/171019/000373,ASTRUM GRANDVIEW MYSORE PHASE - I,Company,MYSORE,ASTRUM VALUE HOMES PRIVATE LIMITED,Residential/Group Housing,30-06-2020,APPROVED,"Bandipalya (Opp. APMC Yard), Nanjangud Road",,,,,,,,,
PRM/KA/RERA/1268/378/PR/091123/006396,SAHA FORTUNE,Company,MYSORE,ESS AND ESS INFRASTRUCTURE PRIVATE LIMITED,Plotted Development,04-09-2027,APPROVED,,,,,,,,,,
PRM/KA/RERA/1268/378/PR/091123/006385,SAHA ELITE - 2,Company,MYSORE,ESS AND ESS INFRASTRUCTURE PRIVATE LIMITED,Plotted Development,11-09-2028,APPROVED,,,,,,,,,,
PRM/KA/RERA/1268/378/PR/060424/006776,BHIMA VISHAKA,Partnership Firm,MYSORE,BHIMA ANANTHAPADMANABHA DEVELOPERS,Plotted Development,31-12-2024,APPROVED,"Survey No.112/2, 113 , Madaragalli Village, Varuna Hobli , MYSORE , Mysore, Karnataka - 571311",,,,,,,,,
PRM/KA/RERA/1267/374/PR/190204/002349,KBL SILICON CITY,Partnership Firm,MANDYA,KBL AND SONS,Plotted Development,31-12-2018,APPROVED,"Sy No. 2,3,4(P), 5(p), 8(p), 20(p), 21,24,25(p),26,27,28,29,30,31,32,33,34(p),35(p),37,41(p),42,43,44 and 45 , kUPPEDADA VILLAGE",Plots,0SqMtr,0SqMtr,1201,0SqMtr,,,,
PRM/KA/RERA/1267/374/PR/101023/006309,ZUARI GARDEN CITY - PLOTS,Company,MANDYA,ZUARI INFRAWORLD INDIA LIMITED,Plotted Development,31-03-2026,APPROVED,,,,,,,,,,
PRM/KA/RERA/1265/347/PR/151222/005525,CONCORDE EQUITY,Company,KOLAR,CONCORDE HOUSING CORPORATION PVT LTD,Plotted Development,31-12-2026,APPROVED,,,,,,,,,,
PRM/KA/RERA/1265/347/PR/071124/007201,TEMPLE BELLS,Partnership Firm,KOLAR,BRIGHT PROJECTS,Plotted Development,31-05-2027,APPROVED,"Sy No. 226, 242 & 244 of Alambadi Village, , Lakkur Hobli, Malur Taluk, , Maluru , Kolar, Karnataka - 563160",,,,,,,,,
PRM/KA/RERA/1257/334/PR/290423/005898,PRISTINE,Proprietorship Firm,DAKSHINA KANNADA,LAND TRADES BUILDERS AND DEVELOPERS,Mixed Development,30-05-2028,APPROVED,,,,,,,,,,
PRM/KA/RERA/1257/334/PR/260924/007081,SHAKTHI HEIGHTS,Company,DAKSHINA KANNADA,"NIDHI LAND INFRASTRUCTURE DEVELOPERS INDIA (P) LTD.,",Mixed Development,30-06-2031,APPROVED,,,,,,,,,,
PRM/KA/RERA/1257/334/PR/240822/005188,BHARATHI SOWPARNIKA,Proprietorship Firm,DAKSHINA KANNADA,BHARATHI BUILDERS AND DEVELOPERS,Residential/Group Housing,31-12-2029,APPROVED,"DETAILED PLAN SHOWING RESIDENTIAL/COMMERCIAL APARTMENT BUILDING IN AT , S.N 32/10P, 32/11P PADAVU VILLAGE, MANGALORE , Mangalore , Dakshina Kannada, Karnataka - 575001",,,,,,,,,
PRM/KA/RERA/1257/334/PR/211223/006506,SHALIMAR ALTIUS,Partnership Firm,DAKSHINA KANNADA,SHALIMAR REALTY HOLDINGS,Mixed Development,30-09-2028,APPROVED,,,,,,,,,,
PRM/KA/RERA/1257/334/PR/201106/003690,VAILANKANNI'S HEIGHTS,Partnership Firm,DAKSHINA KANNADA,SL INDUSTRIES,Residential/Group Housing,31-12-2024,APPROVED,"SY.NO.97/1,VAILANKANNI HEIGHTS, , ACHUKODY, BONDEL",RESIDENTIAL FLAT,13923SqMtr,1166SqMtr,184,1166SqMtr,,,,
PRM/KA/RERA/1257/334/PR/200219/003287,REDBRICKS PALM HILLS BLOCK B AND BLOCK C,Company,DAKSHINA KANNADA,REDBRICKS DWELLINGS AND INFRAPROJECTS PVT LTD,Residential/Group Housing,30-09-2032,APPROVED,"NH 169 KULSHEKAR CHOWKI, KULSHEKAR MANGALORE",,,,,,,,,
PRM/KA/RERA/1257/334/PR/190913/002849,ASHA CITY,Company,DAKSHINA KANNADA,YAMUNA HOMES AND DESIGN PRIVATE LIMITED,Plotted Development,28-11-2021,APPROVED,Asha City,,,,,,,,Not found,Not found
PRM/KA/RERA/1257/334/PR/180905/001999,THE MARIAN PARK,Partnership Firm,DAKSHINA KANNADA,MARIAN PROJECTS PVT LTD,Mixed Development,30-09-2024,APPROVED,"Kadri Village, Kadri",,,,,,,,,
PRM/KA/RERA/1257/334/PR/180823/006175,POORVI ESTELLA,Company,DAKSHINA KANNADA,POORVI HOUSING DEVELOPMENT COMPANY PVT. LTD.,Residential/Group Housing,29-02-2028,APPROVED,,,,,,,,,,
PRM/KA/RERA/1257/334/PR/171214/001457,GREENFIELD MEADOWS,Partnership Firm,DAKSHINA KANNADA,GREENFIELD LIFEPARK,Plotted Development,31-08-2019,APPROVED,"Behind NITK, Surathkal",,,,,,,,,
PRM/KA/RERA/1257/334/PR/171214/001428,REDBRICKS PALM HILLS BLOCK A,Company,DAKSHINA KANNADA,REDBRICKS DWELLINGS & INFRAPROJECTS PVT LTD,Mixed Development,30-06-2019,APPROVED,"Redbricks Palm Hills, NH169, Kulshekar Chowki, , Kulshekar, Mangalore",,,,,,,,Not found,Not found
PRM/KA/RERA/1257/334/PR/171021/000437,PRESTIGE VALLEY CREST PHASE 2,Company,DAKSHINA KANNADA,PRESTIGE ESTATES CONSTRUCTIONS LIMITED,Residential/Group Housing,30-07-2023,APPROVED,"SY NO 31-3, 31-4,31-5A, 31-1C2, 31-1D2, 31-1E2-, 31-1F2, 31-1G2, 31-1H1, 31-1H2, 31-1/1,31-1/3,32-1, KHADRI VILLAGESY NO 39-1,39-3, 39/3,39/8B,39-10,41-1A1, KODIALBAIL VILLAGE BEJAI MUSEUM ROAD, MANGALORE",APARTMENTQ,20561SqMtr,32SqMtr,250,1014SqMtr,,,,
PRM/KA/RERA/1257/334/PR/171014/000388,PRESTIGE VALLEY CREST PHASE I,Company,DAKSHINA KANNADA,PRESTIGE ESTATES PROJECTS LIMTED,Residential/Group Housing,30-03-2023,APPROVED,"SY NO 31-3, 31-4, 31-5A, 31-1C2, 31-1D2, 31-1E2, 31-1F2,31-1G2, 31-1H1, 31-1H2, 31-1/1, 31-1/3, 32-1, KADHIRI VILLAGE, AND SURVEY NUMBER 39-1,39-3,39/3,39/8B,39-10,41,41-1A1,KODIALBAIL VILLAGE, BEJAI-MUSEUM, MANGALORE-",APARTMENT,21386SqMtr,32SqMtr,260,1055SqMtr,,,,
PRM/KA/RERA/1257/334/PR/101122/005436,SANKALP,Company,DAKSHINA KANNADA,NIDHI LAND INFRASTRUCTURE DEVELOPERS INDIA PVT LTD,Mixed Development,26-05-2025,APPROVED,,,,,,,,,,
PRM/KA/RERA/1257/334/PR/101023/006310,LUCENT,Company,DAKSHINA KANNADA,M/S MOHTISHAM COMPLEXES PVT LTD,Residential/Group Housing,30-07-2027,APPROVED,,,,,,,,,,
PRM/KA/RERA/1257/334/PR/100222/004694,ALLEGRO AVENTUS,Proprietorship Firm,DAKSHINA KANNADA,ALLEGRO BUILDERS AND DEVELOPERS,Residential/Group Housing,31-12-2026,APPROVED,,,,,,,,,,
PRM/KA/RERA/1257/334/PR/040524/006849,MAHALAXMI,Proprietorship,DAKSHINA KANNADA,LAND TRADES BUILDERS AND DEVELOPERS,Mixed Development,01-06-2028,APPROVED,,,,,,,,,,
PRM/KA/RERA/1257/334/PR/011024/007106,SMRITHI HEIGHTS,Company,DAKSHINA KANNADA,"NIDHI LAND INFRASTRUCTURE DEVELOPERS INDIA (P) LTD.,",Mixed Development,30-06-2029,APPROVED,,,,,,,,,,
PRM/KA/RERA/1254/465/PR/220623/006010,VAIBHAV UPAVAN PHASE 2,Partnership Firm,CHIKKABALLAPURA,VYAS VAIBHAV VENTURES LLP,Plotted Development,31-12-2024,APPROVED,"Sy No. 5/3, 5/4, 5/7, 5/8, 5/9 Situated in Kariyanapura Village, , Jangamakote Hobli, Shidlagatta Taluk , Sidlaghatta , Chikkaballapura, Karnataka - 562105",,,,,,,,Not found,Not found
PRM/KA/RERA/1254/465/PR/200811/003509,VAIBHAV UPAVAN PHASE-1,Partnership Firm,CHIKKABALLAPURA,INFO.VAIBHAVUPAVAN@GMAIL.COM,Plotted Development,30-09-2024,APPROVED,"VAIBHAV UPAVAN PHASE-1, SY NO 12/1 & 12/2 OF KARIYANAPURA VILLAGE, JANGAMAKOTE HOBLI, SIDLAGHATTA TALUK, CHIKKABALLAPURA DIST",,,,,,,,Not found,Not found
PRM/KA/RERA/1254/465/PR/200224/006648,VAIBHAV UPAVAN PHASE 3,Partnership Firm,CHIKKABALLAPURA,SANVI VAIBHAV PROJECTS LLP,Plotted Development,30-06-2025,APPROVED,"SY NO 13/2, KARIYANAPURA VILLAGE, JANGAMAKOTE HOBLI , SHIDLAGHATTA , Sidlaghatta , Chikkaballapura, Karnataka - 562102",,,,,,,,,
PRM/KA/RERA/1254/460/PR/180521/001784,CONCORDE HILL CREST,Partnership Firm,CHIKKABALLAPURA,CONCORDE SYLVAN VIEW,Plotted Development,30-04-2022,APPROVED,"Sy No.3/4,3/6 and other of Reddy Gollavarahali village and Sy No.47/1, 47/2 and others of Byappanahalli village, Kasaba Hobli, Chikkaballapur Taluk",,,,,,,,Not found,Not found
PRM/KA/RERA/1254/460/PR/120922/005232,CONCORDE HILL CREST PHASE II,Partnership Firm,CHIKKABALLAPURA,CONCORDE SYLVAN VIEW,Plotted Development,31-10-2026,APPROVED,,,,,,,,,,
PRM/KA/RERA/1251/472/PR/280324/006742,AXIS OAKLYN,Company,BENGALURU URBAN,AXIS CONCEPT CONSTRUCTION PVT LTD,Residential/Group Housing,31-03-2027,APPROVED,,,,,,,,,,
PRM/KA/RERA/1251/472/PR/251024/007176,RANKA ANKURA,Company,BENGALURU URBAN,RANKA PROPERTIES PRIVATE LIMITED,Residential/Group Housing,31-12-2029,APPROVED,"RANKA ANKURA, KHATA NO. 7/83/2, 82/2, 84/2 , BELLAHALLI VILLAGE, THANISANDRA MAIN ROAD, BANGALORE , Yelahanka , Bengaluru Urban, Karnataka - 560064",,,,,,,,,
PRM/KA/RERA/1251/472/PR/250322/004785,ASSETZ SOHO & SKY,Company,BENGALURU URBAN,APG IMPERIAL HOMES PRIVATE LIMITED,Residential/Group Housing,30-09-2026,APPROVED,"SY.NO.14/1(P), 14/2(P), 15/1(P), 15/2, 15/3, 15/4, 15/5(P), 16/2(P), 61/1 AND 61/3 , SRIRAMPURA VILLAGE YELAHANKA HOBLI , Yelahanka , Bengaluru Urban, Karnataka - 560064",,,,,,,,,
PRM/KA/RERA/1251/472/PR/220922/005264,TRENDSQUARES ORTUS III,Partnership Firm,BENGALURU URBAN,M/S TRENDSQUARES CONSTRUCTIONS,Residential/Group Housing,31-12-2028,APPROVED,,,,,,,,,,
PRM/KA/RERA/1251/472/PR/220214/004695,LAND CAPITAL CALISTA,Partnership Firm,BENGALURU URBAN,LAND CAPITAL PROJECTS,Residential/Group Housing,31-12-2025,APPROVED,"KHATHA NO.552/57/1, ATTUR VILLAGE, YELAHANKA HOBLI,, BANGALORE NORTH TALUK,WARD NO -03",3 BHK,3677SqMtr,0SqMtr,48,366SqMtr,,,,
PRM/KA/RERA/1251/472/PR/210731/004208,NIKOO HOMES IV,Company,BENGALURU URBAN,BHARTIYA URBAN PRIVATE LIMITED,Residential/Group Housing,31-07-2025,APPROVED,"Khatha No.6/1, Sy No. 47, Chokkanahalli Village, Off. Thanisandra Main Road",Residential,57386SqMtr,0SqMtr,716,31576SqMtr,,,,
PRM/KA/RERA/1251/472/PR/210409/004117,ADARSH GREENS PHASE 2,Company,BENGALURU URBAN,ADARSH HAVEN PRIVATE LIMITED,Residential/Group Housing,31-05-2025,APPROVED,"KHATA NO.783, SURVEY NO. 3 & 9, GASTHI KEMPANAHALLI VILLAGE , YELAHANKA HOBLI, BENGALURU NORTH TALUQ.",2BHK,59SqMtr,0SqMtr,1042,5SqMtr,,,,
PRM/KA/RERA/1251/472/PR/200515/003406,ARVIND BEL AIR,Company,BENGALURU URBAN,ARVIND HEBBAL HOMES PRIVATE LIMITED,Residential/Group Housing,30-06-2026,APPROVED,"Survey no 52/3, Opp GKVK Campus, New Town Road, Yelahanka, North Bengaluru","2 BHK, 2.5 BHK and 3 BHK Apartments",28202SqMtr,0SqMtr,334,1426SqMtr,,,,
PRM/KA/RERA/1251/472/PR/191206/003056,PRESTIGE FINSBURY PARK - REGENT,Partnership Firm,BENGALURU URBAN,APEX REALTY VENTURES LLP,Residential/Group Housing,30-03-2024,APPROVED,"Plot No. R-6-Part-1, in Hitech Defence & Aerospace Park, Sy. Nos. Parts of 429 & 462, of Bagalur Village, Jala Hobli, Bangalore North, Yelahanka Taluk, Bangalore District",Residential Apartment,85543SqMtr,0SqMtr,958,5505SqMtr,,,,
PRM/KA/RERA/1251/472/PR/191206/003055,PRESTIGE FINSBURY PARK - HYDE,Partnership Firm,BENGALURU URBAN,APEX REALTY VENTURES LLP,Residential/Group Housing,30-03-2024,APPROVED,"Plot No.R-6, Part, Hi-Tech, Defence and Aerospace Park, Bagalur and Hoovinayakanahalli Villages, Jala Hobli",Residential,114450SqMtr,0SqMtr,2092,7030SqMtr,,,,
PRM/KA/RERA/1251/472/PR/190427/002540,GALLIUM AT BRIGADE EL DORADO,Company,BENGALURU URBAN,BRIGADE TETRARCH PRIVATE LIMITED,Residential/Group Housing,30-09-2024,APPROVED,"Plot No. R-8 (Hardware Sector) Hitech, Defence & Aerospace Park, Bengaluru, comprised in Survey No. 177 (P) of Bagalur, Jala Hobli",2 BEDROOM + 2 TOILET,43SqMtr,0SqMtr,190,2SqMtr,,,,
PRM/KA/RERA/1251/472/PR/190204/002350,PURVA ATMOSPHERE,Company,BENGALURU URBAN,PURAVANKARA LIMITED,Residential/Group Housing,30-12-2025,APPROVED,"Khata 479/95/1 Thanisandra Main Road, K R Puram Hobli",2BHK Type 3A,82SqMtr,0SqMtr,43,3SqMtr,,,,
PRM/KA/RERA/1251/472/PR/180728/001967,PEACE PARAMOUNT,Partnership Firm,BENGALURU URBAN,A PEACE PROJECTS LLP,Residential/Group Housing,31-12-2021,APPROVED,"MUNICIPAL CORPORATION NO. 274/90/1B2/97/1B2, K G ANANTAPURA VILLAGE, YELAHANKA",,,,,,,,Not found,Not found
PRM/KA/RERA/1251/472/PR/160124/006543,NIKOO HOMES VI - PHASE - 1,Company,BENGALURU URBAN,BHARTIYA URBAN PRIVATE LIMITED,Residential/Group Housing,31-01-2029,APPROVED,,,,,,,,,,
PRM/KA/RERA/1251/472/PR/100823/006138,SRI BALAJI SERENE,Partnership Firm,BENGALURU URBAN,SRI BALAJI STRUCTURES,Residential/Group Housing,31-12-2026,APPROVED,,,,,,,,,,
PRM/KA/RERA/1251/472/PR/090824/006967,DOWN BY THE WATER,Company,BENGALURU URBAN,TOTAL ENVIRONMENT BUILDING SYSTEMS PVT LTD,Residential/Group Housing,31-05-2031,APPROVED,,,,,,,,,,
PRM/KA/RERA/1251/472/PR/070323/005769,SUMUK SQUARE,Partnership Firm,BENGALURU URBAN,SUMUK PROJECTS,Residential/Group Housing,25-08-2026,APPROVED,"SY NO 55/5 JARAKEBHANDEKAVAL VILLAGE YELAHANKA HOBLI , YELAHANKA TALUK BANGALORE , Yelahanka , Bengaluru Urban, Karnataka - 560097",,,,,,,,,
PRM/KA/RERA/1251/472/PR/060924/007009,SATTVA LUMINA,Company,BENGALURU URBAN,SATTVA RESI PRIVATE LIMITED,Residential/Group Housing,01-11-2029,APPROVED,"Sy. No.20/2, 20/3, 20/4, 20/5, 28/2, 28/4, 28/5, 29/1, 30/1, 30/2, 30/3, 30/4 and 30/5 of Rajanukunte Village , Hesaraghatta Hobli, Yelahanka Taluk , Yelahanka , Bengaluru Urban, Karnataka - 560064",,,,,,,,,
PRM/KA/RERA/1251/472/PR/050224/006611,NORTH PARK,Partnership Firm,BENGALURU URBAN,MAX GLOBAL DEVELOPERS,Residential/Group Housing,31-12-2028,APPROVED,,,,,,,,,,
PRM/KA/RERA/1251/446/PR/311224/007332,LORVEN CASCADE GARDEN,Partnership Firm,BENGALURU URBAN,LORVEN VENTURES,Residential/Group Housing,28-12-2028,APPROVED,"@ KATHA NO 82/598/548/116/2/1 SY NO 116/8,116/6,116/7,116/9,116/5,116/2,116/4 of , Nagondanahalli Village, BBMP Ward No. 84 , Bengaluru East , Bengaluru Urban, Karnataka - 560066",,,,,,,,,
PRM/KA/RERA/1251/446/PR/310322/004799,SOBHA SENTOSA PHASE 4 WING 1 AND 2,Company,BENGALURU URBAN,SOBHA LIMITED,Residential/Group Housing,31-12-2027,APPROVED,,,,,,,,,,
PRM/KA/RERA/1251/446/PR/310322/004798,SOBHA SENTOSA PHASE 3 WING 3 AND 4,Company,BENGALURU URBAN,SOBHA LIMITED,Residential/Group Housing,30-06-2027,APPROVED,,,,,,,,,,
PRM/KA/RERA/1251/446/PR/310322/004797,SOBHA SENTOSA PHASE 2 WING 5 AND 6,Company,BENGALURU URBAN,SOBHA LIMITED,Residential/Group Housing,31-12-2026,APPROVED,,,,,,,,,,
PRM/KA/RERA/1251/446/PR/310322/004796,SOBHA SENTOSA PHASE 1 WING 7,Company,BENGALURU URBAN,SOBHA LIMITED,Residential/Group Housing,30-06-2026,APPROVED,,,,,,,,,,
PRM/KA/RERA/1251/446/PR/300924/007105,GODREJ LAKESIDE ORCHARD,Company,BENGALURU URBAN,GODREJ PROPERTIES LIMITED,Residential/Group Housing,30-09-2030,APPROVED,,,,,,,,,,
PRM/KA/RERA/1251/446/PR/300323/005832,EON AKASH B & C,Partnership Firm,BENGALURU URBAN,ECO LIFE DEVELOPERS,Residential/Group Housing,31-07-2026,APPROVED,,,,,,,,,,
PRM/KA/RERA/1251/446/PR/300124/006601,ASSETZ 66 & SHIBUI,Company,BENGALURU URBAN,APG ENVIRONMENT HOMES PRIVATE LIMITED,Residential/Group Housing,30-06-2028,APPROVED,"Sy. No. 3/3 (Old Sy. No. 3/1A1 and 3/1A1a) , K R Puram Hobli, Bengaluru East Taluk, Bengaluru Urban District Whitefield Village , Bengaluru East , Bengaluru Urban, Karnataka - 560066",,,,,,,,,
PRM/KA/RERA/1251/446/PR/300124/006599,SREE ADITHYA LOTUS PARK,Partnership Firm,BENGALURU URBAN,SREE ADITHYA DEVELOPERS,Residential/Group Housing,30-09-2026,APPROVED,"Old Sy No.18/2, New Converted Sy.No.18/9 and New Converted Sy.No.18/10, , Common BBMP Katha No.1122/18/9 & 18/10/219, Situated at Seegehalli Village, KR Puram Hobli, Bangalore East Taluk , Bengaluru East , Bengaluru Urban, Karnataka - 560049",,,,,,,,,
PRM/KA/RERA/1251/446/PR/290224/006660,PRESTIGE SOMERVILLE,Company,BENGALURU URBAN,PRESTIGE ESTATES PROJECTS LTD,Residential/Group Housing,31-12-2027,APPROVED,"PROPOSED RESIDENTIAL APARTMENT ON KATHA NO. NO.1012/649, SY NO.39/2, 39/3, 39/4, 40/1, 40/2, 48/6A, 48/6B, 48/7, 48/8, 48/9, 48/10, 48/11, 48/12, , 48/13, 48/14, 48/15, 39/1, 40/5, 40/6, 38/1, 38/2, 38/3, 38/4, 38/5, 40/3, 41/2, 41/3, 41/4, 41/5, 41/6, 41/8, WARD NO. 84, RAMAGONDANAHALLI VILLAGE, VARTHUR HOBLI, BANGALORE EAST TALUK BANGALORE , Bengaluru East , Bengaluru Urban, Karnataka - 560066",,,,,,,,,
PRM/KA/RERA/1251/446/PR/281222/005565,PURSUIT OF A RADICAL RHAPSODY TOWER 5,Company,BENGALURU URBAN,TOTAL ENVIRONMENT HABITAT PVT. LTD.,Residential/Group Housing,01-12-2029,APPROVED,,,,,,,,,,
PRM/KA/RERA/1251/446/PR/280324/006759,DSR THE COURTYARD,Partnership Firm,BENGALURU URBAN,DSR INFRAPROJECTS,Residential/Group Housing,22-02-2027,APPROVED,,,,,,,,,,
PRM/KA/RERA/1251/446/PR/280222/004738,FOLIUM BY SUMADHURA PHASE-I,Company,BENGALURU URBAN,SUMADHURA INFRACON PRIVATE LIMITED,Residential/Group Housing,30-06-2025,APPROVED,,,,,,,,,,
PRM/KA/RERA/1251/446/PR/280222/004736,GODREJ PARK RETREAT,Company,BENGALURU URBAN,GODREJ PROPERTIES LIMITED,Residential/Group Housing,27-02-2027,APPROVED,,,,,,,,,,
PRM/KA/RERA/1251/446/PR/270824/006981,PRESTIGE RAINTREE PARK,Company,BENGALURU URBAN,PRESTIGE ESTATES PROJECTS LTD,Residential/Group Housing,31-12-2028,APPROVED,"KATHA NO.1233, SY NO. 112/48, 19/1, 19/2, 20, 21/1, 21/2, 21/3, 21/4, 21/5A, 21/5B, 21/6, 21/7,and other survey numbers of RAMGONDANAHALLI VILLAGE , SY NO. 348/1, 348/2, 348/3, 348/4, 348/5, 348/6, 348/7, 349/2, 3, 350/1, 350/2, 350/3, 350/4, 350/5, 351/1, 351/2, 351/3, 351/4, 352/2, 353/1P, 353/2A, 353/2B, 353/3 OF AMANI BELLANDUR KHANE VILLAGE , Bengaluru East , Bengaluru Urban, Karnataka - 560001",,,,,,,,,
PRM/KA/RERA/1251/446/PR/261224/007320,MEDA EAST WINDS,Proprietorship,BENGALURU URBAN,MEDA PROJECTS,Residential/Group Housing,30-12-2028,APPROVED,"SY.NO:12/1, 12/2, 12/3, 15/2, 15/3 & 15/4, PANATHUR VILLAGE, VARTHUR HOBLI, BANGALORE EAST TALUK, WARD NO.149, BANGALORE.- 560087 , SY.NO:12/1, 12/2, 12/3, 15/2, 15/3 & 15/4, PANATHUR VILLAGE, VARTHUR HOBLI, BANGALORE EAST TALUK, WARD NO.149, BANGALORE.- 560087 , Bengaluru East , Bengaluru Urban, Karnataka - 560087",,,,,,,,,
PRM/KA/RERA/1251/446/PR/250423/005893,FOLIUM BY SUMADHURA PHASE-II,Company,BENGALURU URBAN,SUMADHURA INFRACON PRIVATE LIMITED,Residential/Group Housing,31-12-2025,APPROVED,,,,,,,,,,
PRM/KA/RERA/1251/446/PR/250423/005893,FOLIUM BY SUMADHURA PHASE-II,Company,BENGALURU URBAN,SUMADHURA INFRACON PRIVATE LIMITED,Residential/Group Housing,31-12-2025,APPROVED,,,,,,,,,,
PRM/KA/RERA/1251/446/PR/250222/004731,ASPIRE AMBER,Partnership Firm,BENGALURU URBAN,SUMADHURA HOMES LLP,Residential/Group Housing,31-12-2024,APPROVED,,,,,,,,,,
PRM/KA/RERA/1251/446/PR/250123/005667,PRESTIGE ELM PARK,Company,BENGALURU URBAN,PRESTIGE ESTATES PROJECTS LTD,Residential/Group Housing,14-08-2026,APPROVED,,,,,,,,,,
PRM/KA/RERA/1251/446/PR/240723/006088,ENGRACE 3,Partnership Firm,BENGALURU URBAN,MODERN SPACES,Residential/Group Housing,01-06-2026,APPROVED,,,,,,,,,,
PRM/KA/RERA/1251/446/PR/240723/006088,ENGRACE 3,Partnership Firm,BENGALURU URBAN,MODERN SPACES,Residential/Group Housing,01-06-2026,APPROVED,,,,,,,,,,
PRM/KA/RERA/1251/446/PR/240306/006662,DNR ARISTA PHASE 2,Partnership Firm,BENGALURU URBAN,INESA VENTURES LLP,Residential/Group Housing,31-12-2025,APPROVED,"Katha No. 1743/18/1C, Kaikondarahalli Village, Varthur Hobli, Bangalore East Taluk",4BHK,2448SqMtr,0SqMtr,12,225SqMtr,,,,
PRM/KA/RERA/1251/446/PR/240122/004655,63 DEGREE EAST - TOWER F,Company,BENGALURU URBAN,APG INTELLI HOMES PRIVATE LIMITED,Residential/Group Housing,31-07-2025,APPROVED,"Survey No. 69/1, 69/2, 69/3, 69/4 and 171 , Near Bangalore Technological Institute (BTI), Off Sarjapur Road , Bengaluru East , Bengaluru Urban, Karnataka - 560035",,,,,,,,,
PRM/KA/RERA/1251/446/PR/240122/004654,ASSETZ MARQ PHASE 3A,Company,BENGALURU URBAN,ASSETZ WHITEFIELD HOMES PRIVATE LIMITED,Residential/Group Housing,28-02-2026,APPROVED,"SyNo: 159/1, 159/2, 160/1, 167/1, 167/2, 167/3, 167/4, 168, 169/1, 169/2, 169/3, 169/4, 171, Kannamangala Village, Whitefield - Hoskote Road Bangalor , Kannamangala Village,Whitefield- Hoskote Road , Bengaluru East , Bengaluru Urban, Karnataka - 560067",,,,,,,,,
PRM/KA/RERA/1251/446/PR/221123/006419,AIIKYA VILLAGE SARJAPUR,Partnership Firm,BENGALURU URBAN,AIIKYA VILLAGE SARAJAPUR LLP,Residential/Group Housing,26-11-2026,APPROVED,"No.397/2, Sarjapura Hobli , Bengaluru , Bengaluru East , Bengaluru Urban, Karnataka - 562125",,,,,,,,,
PRM/KA/RERA/1251/446/PR/221024/007164,COURTYARD OF LIFE,Company,BENGALURU URBAN,NAVANAAMI PROJECTS PRIVATE LIMITED,Residential/Group Housing,15-06-2029,APPROVED,"Residential Apartment Building in SY No. 25/4, 25/8, 25/18, 25/9, 25/10, 25/16, 25/19 and 25/11 Kodathi Village, Varthur Hobli, Bangalore East Taluk, , Bangalore Urban District , Bengaluru East , Bengaluru Urban, Karnataka - 560099",,,,,,,,,
PRM/KA/RERA/1251/446/PR/220923/006283,"SOBHA NEOPOLIS PHASE 4 - 3, 4, 8 & 9",Company,BENGALURU URBAN,SOBHA LIMITED,Residential/Group Housing,31-12-2031,APPROVED,,,,,,,,,,
PRM/KA/RERA/1251/446/PR/220923/006282,"SOBHA NEOPOLIS PHASE 3 - W 1, 2, 10 & 11",Company,BENGALURU URBAN,SOBHA LIMITED,Residential/Group Housing,31-12-2029,APPROVED,,,,,,,,,,
PRM/KA/RERA/1251/446/PR/220922/005261,PURSUIT OF A RADICAL RHAPSODY- TOWER 8,Company,BENGALURU URBAN,TOTAL ENVIRONMENT HABITAT PVT. LTD.,Residential/Group Housing,30-09-2029,APPROVED,,,,,,,,,,
PRM/KA/RERA/1251/446/PR/220823/006195,BRIGADE CALISTA - PHASE 2,Company,BENGALURU URBAN,BRIGADE ENTERPRISES LTD,Residential/Group Housing,31-12-2027,APPROVED,"Sy No. 163(p), 165(p), 166/1 (p) & 170/1(p) , Bommenahalli Village, Bidarahalli Hobli, Hoskote Taluk (Now Bengaluru East Taluk) Bengaluru , Bengaluru East , Bengaluru Urban, Karnataka - 560049",,,,,,,,,
PRM/KA/RERA/1251/446/PR/220720/005090,THE WOODS OF EAST - PHASE -V,Partnership Firm,BENGALURU URBAN,ODION BUILDERS AND DEVELOPERS,Plotted Development,31-07-2025,APPROVED,"SY. NOS .32/1 & 37/1 OF CHIKKANAYAKANAHALLI VILLAGE, VARTHUR HOBLI, BANGALORE EAST TALUK",Residential Plots,7039SqMtr,7039SqMtr,52,7039SqMtr,,,Not found,Not found
PRM/KA/RERA/1251/446/PR/220424/006831,GREEN EDGE SIGNATURE,Partnership Firm,BENGALURU URBAN,GREEN EDGE VENTURES,Residential/Group Housing,31-12-2026,APPROVED,"BBMP Katha No 1482 Sy No 58/2, 60/8, 60/9, 60/10, 60/19, 60/20, 60/21 , SORAHUNASE CROSS SORAHUNASE VARTHUR VILLAGE and HOBLI , Bengaluru East , Bengaluru Urban, Karnataka - 560087",,,,,,,,,
PRM/KA/RERA/1251/446/PR/211230/004615,VYSHNAVI BRUNDAVANAM,Partnership Firm,BENGALURU URBAN,SRI VYSHNAVI INFRA,Residential/Group Housing,01-12-2024,APPROVED,"SY.NO.110-5, Katha No-544/110/5, Amani Bellanduru, Khane Village, Varthur Hobli, Ward No-150, Bangalore",2BHK,1170SqMtr,0SqMtr,18,126SqMtr,,,,
PRM/KA/RERA/1251/446/PR/211206/004573,SHRIRAM WYT FIELD -2,Company,BENGALURU URBAN,SPL TOWERS PRIVATE LIMITED,Residential/Group Housing,05-08-2026,APPROVED,"Sy.No. 90/1, 90/2, 90/5, 90/6, 121/1, 121/2, 122/2, 123/2 & 126/1 of, Bommenahalli Village, Bidrahalli Hobli","Tower 6 , 7, 8 ,9 - Type 1",63SqMtr,0SqMtr,114,5SqMtr,,,,
PRM/KA/RERA/1251/446/PR/211005/004337,STERLING VILLA GRANDE PHASE II,Company,BENGALURU URBAN,STERLING URBAN DEVELOPMENTS PRIVATE LIMITED,Residential/Group Housing,31-03-2024,APPROVED,"Survey no. 104(P), 107(P), 108, 109, 110(P), 111(P), 112(P), 113, 114, 115 & 116, , Seegehalii Village, Bidarahalli Hobli, Bengaluru - 560067",TYPE A RADIAL,3708SqMtr,370SqMtr,12,601SqMtr,,,,
PRM/KA/RERA/1251/446/PR/210525/004163,ADARSH PARK HEIGHTS PHASE 1,Company,BENGALURU URBAN,AKARSHA REALTY PRIVATE LIMITED,Residential/Group Housing,31-05-2025,APPROVED,"KATHA NO 1778 , GUNJUR VILLAGE, VARTHUR HOBLI, BANGALORE EAST TALUK, WARD NO.149,, MAHADEVAPURA ZONE, BANGALORE",1 BR,28SqMtr,0SqMtr,130,2SqMtr,,,,
PRM/KA/RERA/1251/446/PR/210524/006932,SARANYA SWAROVSKI,Partnership Firm,BENGALURU URBAN,SARANYA BUILDERS,Residential/Group Housing,31-12-2027,APPROVED,"Sy No 77, Katha No-1200/77, Kumbena Agrahara Village, , Bidarahalli Hobli , Bengaluru East , Bengaluru Urban, Karnataka - 560049",,,,,,,,,
PRM/KA/RERA/1251/446/PR/210524/006924,VAISHNO SERENE,Partnership Firm,BENGALURU URBAN,VAISHNO BUILDERS,Residential/Group Housing,31-03-2028,APPROVED,"SY. NO. 17/2, 17/3, OF KODIGEHALLI VILLAGE & SY. NO. 24/2, 34/1, 34/2, 34/3, 34/4, 35 & 36, OF SADARAMANGALA VILLAGE` , KR Pura Hobli, Bangalore East, Bangalore Urban, Karnataka- 560067 , Bengaluru East , Bengaluru Urban, Karnataka - 560067",,,,,,,,,
